docs/unified_results.csv
kernel,layout,scheduler,tile_m,tile_n,tile_k,sg_m,sg_n,stages,tflops,status,gpu,batch
BmgGemmBF16BF16FP32_RRR_Gemm_128x128x32_SG2x4,RRR,Gemm,128,128,32,2,4,2,154.9,OK,6,batch_0507_gpu6
BmgGemmBF16BF16FP32_RRR_Gemm_128x256x32_SG4x4,RRR,Gemm,128,256,32,4,4,2,149.6,OK,6,batch_0513_gpu6
BmgGemmBF16BF16FP32_RRR_Gemm_256x128x32_SG4x4,RRR,Gemm,256,128,32,4,4,2,149.2,OK,5,batch_0522_gpu5
BmgGemmBF16BF16FP32_RRR_Gemm_256x128x32_SG8x2,RRR,Gemm,256,128,32,8,2,2,147.5,OK,6,batch_0523_gpu6
BmgGemmBF16BF16FP32_RCR_Gemm_128x128x32_SG2x4,RCR,Gemm,128,128,32,2,4,2,147.5,OK,5,batch_0420_gpu5
BmgGemmBF16BF16FP32_RCR_Gemm_256x128x32_SG4x4,RCR,Gemm,256,128,32,4,4,2,146.6,OK,6,batch_0435_gpu6
BmgGemmBF16BF16FP32_RCR_GemmExhaustive_128x256x32_SG2x8_ST2,RCR,GemmExhaustive,128,256,32,2,8,2,145.6,OK,5,batch_0078_gpu5
BmgGemmBF16BF16FP32_RCR_GemmExhaustive_256x128x32_SG4x4_ST2,RCR,GemmExhaustive,256,128,32,4,4,2,144.7,OK,5,batch_0156_gpu5
BmgGemmBF16BF16FP32_RCR_GemmExhaustive_128x256x32_SG2x8_ST3,RCR,GemmExhaustive,128,256,32,2,8,3,144.4,OK,6,batch_0079_gpu6
BmgGemmBF16BF16FP32_RCR_GemmExhaustive_128x256x32_SG4x4_ST3,RCR,GemmExhaustive,128,256,32,4,4,3,144.2,OK,5,batch_0080_gpu5
BmgGemmBF16BF16FP32_RCR_GemmExhaustive_128x128x64_SG2x8_ST2,RCR,GemmExhaustive,128,128,64,2,8,2,144.2,OK,6,unknown
BmgGemmBF16BF16FP32_RCR_StreamK_256x256x32,RCR,StreamK,256,256,32,,,2,144.1,OK,6,unknown
BmgGemmBF16BF16FP32_RCR_GemmExhaustive_256x128x32_SG4x4_ST1,RCR,GemmExhaustive,256,128,32,4,4,1,143.5,OK,5,batch_0156_gpu5
BmgGemmBF16BF16FP32_RCR_GemmExhaustive_256x128x32_SG4x4_ST3,RCR,GemmExhaustive,256,128,32,4,4,3,143.2,OK,6,batch_0157_gpu6
BmgGemmBF16BF16FP32_RCR_GemmExhaustive_64x256x64_SG2x8_ST1,RCR,GemmExhaustive,64,256,64,2,8,1,143.2,OK,6,batch_0361_gpu6
BmgGemmBF16BF16FP32_RCR_Gemm_64x128x32_SG1x8,RCR,Gemm,64,128,32,1,8,2,143.2,OK,6,batch_0451_gpu6
BmgGemmBF16BF16FP32_RCR_GemmExhaustive_128x256x32_SG2x8_ST1,RCR,GemmExhaustive,128,256,32,2,8,1,142.2,OK,5,batch_0078_gpu5
BmgGemmBF16BF16FP32_RCR_GemmExhaustive_256x128x32_SG8x2_ST1,RCR,GemmExhaustive,256,128,32,8,2,1,142.1,OK,6,batch_0159_gpu6
BmgGemmBF16BF16FP32_RCR_GemmExhaustive_128x128x64_SG4x4_ST2,RCR,GemmExhaustive,128,128,64,4,4,2,141.5,OK,5,unknown
BmgGemmBF16BF16FP32_RCR_GemmExhaustive_128x128x64_SG4x4_ST3,RCR,GemmExhaustive,128,128,64,4,4,3,140.9,OK,6,unknown
BmgGemmBF16BF16FP32_RCR_Gemm_128x128x64_SG4x4,RCR,Gemm,128,128,64,4,4,2,140.9,OK,5,batch_0424_gpu5
BmgGemmBF16BF16FP32_RCR_GemmExhaustive_256x128x32_SG8x2_ST2,RCR,GemmExhaustive,256,128,32,8,2,2,140.5,OK,6,batch_0159_gpu6
BmgGemmBF16BF16FP32_RCR_GemmExhaustive_128x256x32_SG4x4_ST1,RCR,GemmExhaustive,128,256,32,4,4,1,140.4,OK,6,batch_0079_gpu6
BmgGemmBF16BF16FP32_RCR_GemmExhaustive_256x128x16_SG4x4_ST2,RCR,GemmExhaustive,256,128,16,4,4,2,140.3,OK,6,batch_0147_gpu6
BmgGemmBF16BF16FP32_RCR_Gemm_128x256x32_SG4x4,RCR,Gemm,128,256,32,4,4,2,139.6,OK,5,batch_0426_gpu5
BmgGemmBF16BF16FP32_RCR_GemmExhaustive_128x256x32_SG4x4_ST2,RCR,GemmExhaustive,128,256,32,4,4,2,139.4,OK,5,batch_0080_gpu5
BmgGemmBF16BF16FP32_RCR_GemmExhaustive_256x256x32_SG8x4_ST1,RCR,GemmExhaustive,256,256,32,8,4,1,139.4,OK,6,batch_0183_gpu6
BmgGemmBF16BF16FP32_RCR_GemmExhaustive_128x128x64_SG2x8_ST3,RCR,GemmExhaustive,128,128,64,2,8,3,139.1,OK,6,unknown
BmgGemmBF16BF16FP32_RRR_Gemm_128x128x64_SG8x2,RRR,Gemm,128,128,64,8,2,2,139.0,OK,5,batch_0512_gpu5
BmgGemmBF16BF16FP32_RCR_GemmExhaustive_128x192x32_SG4x4_ST3,RCR,GemmExhaustive,128,192,32,4,4,3,139.0,OK,6,unknown
BmgGemmBF16BF16FP32_RCR_GemmExhaustive_256x128x16_SG8x2_ST3,RCR,GemmExhaustive,256,128,16,8,2,3,138.8,OK,6,batch_0151_gpu6
BmgGemmBF16BF16FP32_RCR_GemmExhaustive_128x128x32_SG4x4_ST3,RCR,GemmExhaustive,128,128,32,4,4,3,138.5,OK,5,unknown
BmgGemmBF16BF16FP32_RCR_Gemm_256x128x32_SG8x2,RCR,Gemm,256,128,32,8,2,2,138.3,OK,5,batch_0436_gpu5
BmgGemmBF16BF16FP32_RCR_GemmExhaustive_256x128x16_SG4x4_ST1,RCR,GemmExhaustive,256,128,16,4,4,1,137.9,OK,6,batch_0147_gpu6
BmgGemmBF16BF16FP32_RCR_GemmExhaustive_256x128x16_SG4x4_ST3,RCR,GemmExhaustive,256,128,16,4,4,3,137.9,OK,5,batch_0148_gpu5
BmgGemmBF16BF16FP32_RRR_Gemm_256x256x32_SG8x4,RRR,Gemm,256,256,32,8,4,2,137.9,OK,5,batch_0526_gpu5
BmgGemmBF16BF16FP32_RCR_GemmExhaustive_64x256x32_SG2x8_ST2,RCR,GemmExhaustive,64,256,32,2,8,2,137.6,OK,6,batch_0353_gpu6
BmgGemmBF16BF16FP32_RCR_GemmExhaustive_128x128x16_SG4x4_ST3,RCR,GemmExhaustive,128,128,16,4,4,3,137.5,OK,6,unknown
BmgGemmBF16BF16FP32_RCR_GemmExhaustive_256x128x32_SG8x2_ST3,RCR,GemmExhaustive,256,128,32,8,2,3,137.3,OK,5,batch_0160_gpu5
BmgGemmBF16BF16FP32_RCR_GemmExhaustive_128x256x16_SG2x8_ST2,RCR,GemmExhaustive,128,256,16,2,8,2,137.2,OK,6,batch_0069_gpu6
BmgGemmBF16BF16FP32_RCR_GemmExhaustive_256x256x32_SG8x4_ST2,RCR,GemmExhaustive,256,256,32,8,4,2,137.1,OK,6,batch_0183_gpu6
BmgGemmBF16BF16FP32_RCR_GemmExhaustive_128x128x32_SG2x8_ST3,RCR,GemmExhaustive,128,128,32,2,8,3,137.1,OK,5,unknown
BmgGemmBF16BF16FP32_RCR_Gemm_64x128x32_SG2x4,RCR,Gemm,64,128,32,2,4,2,137.1,OK,6,batch_0451_gpu6
BmgGemmBF16BF16FP32_RCR_GemmExhaustive_128x256x16_SG4x4_ST3,RCR,GemmExhaustive,128,256,16,4,4,3,136.7,OK,6,batch_0071_gpu6
BmgGemmBF16BF16FP32_RCR_Gemm_256x256x32_SG8x4,RCR,Gemm,256,256,32,8,4,2,136.7,OK,6,batch_0439_gpu6
BmgGemmBF16BF16FP32_RCR_GemmExhaustive_256x128x16_SG8x2_ST2,RCR,GemmExhaustive,256,128,16,8,2,2,136.5,OK,5,batch_0150_gpu5
BmgGemmBF16BF16FP32_RCR_GemmExhaustive_256x256x32_SG8x4_ST3,RCR,GemmExhaustive,256,256,32,8,4,3,136.4,OK,5,batch_0184_gpu5
BmgGemmBF16BF16FP32_RCR_GemmExhaustive_256x128x16_SG2x8_ST2,RCR,GemmExhaustive,256,128,16,2,8,2,136.1,OK,5,batch_0146_gpu5
BmgGemmBF16BF16FP32_RRR_Gemm_64x128x32_SG2x4,RRR,Gemm,64,128,32,2,4,2,136.1,OK,5,batch_0538_gpu5
BmgGemmBF16BF16FP32_RCR_GemmExhaustive_128x256x16_SG4x4_ST2,RCR,GemmExhaustive,128,256,16,4,4,2,136.0,OK,6,batch_0071_gpu6
BmgGemmBF16BF16FP32_RCR_GemmExhaustive_128x512x32_SG4x8_ST1,RCR,GemmExhaustive,128,512,32,4,8,1,135.8,OK,6,batch_0105_gpu6
BmgGemmBF16BF16FP32_RCR_StreamK_256x192x32,RCR,StreamK,256,192,32,,,2,135.6,OK,5,unknown
BmgGemmBF16BF16FP32_RCR_GemmExhaustive_128x512x32_SG4x8_ST2,RCR,GemmExhaustive,128,512,32,4,8,2,135.6,OK,6,batch_0105_gpu6
BmgGemmBF16BF16FP32_RCR_GemmExhaustive_128x256x16_SG2x8_ST1,RCR,GemmExhaustive,128,256,16,2,8,1,135.5,OK,6,batch_0069_gpu6
BmgGemmBF16BF16FP32_RCR_GemmExhaustive_256x192x32_SG8x4_ST3,RCR,GemmExhaustive,256,192,32,8,4,3,135.5,OK,6,batch_0175_gpu6
BmgGemmBF16BF16FP32_RCR_GemmExhaustive_128x192x16_SG4x4_ST3,RCR,GemmExhaustive,128,192,16,4,4,3,135.4,OK,5,unknown
BmgGemmBF16BF16FP32_RCR_GemmExhaustive_128x128x64_SG4x4_ST1,RCR,GemmExhaustive,128,128,64,4,4,1,135.4,OK,5,unknown
BmgGemmBF16BF16FP32_RCR_GemmExhaustive_256x128x16_SG2x8_ST1,RCR,GemmExhaustive,256,128,16,2,8,1,135.3,OK,6,batch_0145_gpu6
BmgGemmBF16BF16FP32_RCR_GemmExhaustive_128x256x16_SG2x8_ST3,RCR,GemmExhaustive,128,256,16,2,8,3,134.9,OK,5,batch_0070_gpu5
BmgGemmBF16BF16FP32_RCR_GemmExhaustive_256x128x32_SG8x4_ST1,RCR,GemmExhaustive,256,128,32,8,4,1,134.9,OK,5,batch_0160_gpu5
BmgGemmBF16BF16FP32_RCR_GemmExhaustive_128x256x32_SG4x8_ST1,RCR,GemmExhaustive,128,256,32,4,8,1,134.6,OK,6,batch_0081_gpu6
BmgGemmBF16BF16FP32_RCR_GemmExhaustive_128x128x32_SG4x4_ST1,RCR,GemmExhaustive,128,128,32,4,4,1,134.6,OK,6,unknown
BmgGemmBF16BF16FP32_RCR_GemmExhaustive_256x128x16_SG8x2_ST1,RCR,GemmExhaustive,256,128,16,8,2,1,134.4,OK,5,batch_0150_gpu5
BmgGemmBF16BF16FP32_RRR_Gemm_128x64x32_SG2x4,RRR,Gemm,128,64,32,2,4,2,134.3,OK,6,batch_0517_gpu6
BmgGemmBF16BF16FP32_RCR_GemmExhaustive_256x192x32_SG8x4_ST2,RCR,GemmExhaustive,256,192,32,8,4,2,134.3,OK,5,batch_0174_gpu5
BmgGemmBF16BF16FP32_RCR_GemmExhaustive_128x128x32_SG4x4_ST2,RCR,GemmExhaustive,128,128,32,4,4,2,134.2,OK,6,unknown
BmgGemmBF16BF16FP32_RCR_GemmExhaustive_128x192x32_SG4x4_ST2,RCR,GemmExhaustive,128,192,32,4,4,2,134.2,OK,5,unknown
BmgGemmBF16BF16FP32_RCR_GemmExhaustive_256x192x32_SG8x4_ST1,RCR,GemmExhaustive,256,192,32,8,4,1,134.1,OK,5,batch_0174_gpu5
BmgGemmBF16BF16FP32_RCR_GemmExhaustive_256x256x32_SG4x8_ST1,RCR,GemmExhaustive,256,256,32,4,8,1,134.0,OK,6,batch_0181_gpu6
BmgGemmBF16BF16FP32_RCR_GemmExhaustive_128x128x64_SG2x8_ST1,RCR,GemmExhaustive,128,128,64,2,8,1,133.9,OK,5,unknown
BmgGemmBF16BF16FP32_RCR_GemmExhaustive_256x128x16_SG2x8_ST3,RCR,GemmExhaustive,256,128,16,2,8,3,133.7,OK,5,batch_0146_gpu5
BmgGemmBF16BF16FP32_RCR_Gemm_128x128x32_SG4x4,RCR,Gemm,128,128,32,4,4,2,133.6,OK,6,batch_0421_gpu6
BmgGemmBF16BF16FP32_RCR_GemmExhaustive_128x192x16_SG4x4_ST2,RCR,GemmExhaustive,128,192,16,4,4,2,133.5,OK,5,unknown
BmgGemmBF16BF16FP32_RCR_GemmExhaustive_256x128x64_SG8x4_ST1,RCR,GemmExhaustive,256,128,64,8,4,1,133.4,OK,6,batch_0169_gpu6
BmgGemmBF16BF16FP32_RRR_Gemm_128x256x64_SG8x4,RRR,Gemm,128,256,64,8,4,2,133.4,OK,6,batch_0515_gpu6
BmgGemmBF16BF16FP32_RCR_StreamK_256x128x32,RCR,StreamK,256,128,32,,,2,133.3,OK,5,unknown
BmgGemmBF16BF16FP32_RCR_GemmExhaustive_128x128x16_SG2x8_ST3,RCR,GemmExhaustive,128,128,16,2,8,3,132.9,OK,6,unknown
BmgGemmBF16BF16FP32_RCR_StreamK_512x128x32,RCR,StreamK,512,128,32,,,2,132.9,OK,5,unknown
BmgGemmBF16BF16FP32_RCR_Gemm_128x64x32_SG2x4,RCR,Gemm,128,64,32,2,4,2,132.7,OK,5,batch_0430_gpu5
BmgGemmBF16BF16FP32_RCR_GemmExhaustive_128x256x32_SG4x8_ST2,RCR,GemmExhaustive,128,256,32,4,8,2,132.6,OK,6,batch_0081_gpu6
BmgGemmBF16BF16FP32_RCR_Gemm_128x256x32_SG4x8,RCR,Gemm,128,256,32,4,8,2,132.5,OK,6,batch_0427_gpu6
BmgGemmBF16BF16FP32_RRR_Gemm_64x128x32_SG1x8,RRR,Gemm,64,128,32,1,8,2,132.4,OK,5,batch_0538_gpu5
BmgGemmBF16BF16FP32_RCR_GemmExhaustive_128x192x32_SG4x4_ST1,RCR,GemmExhaustive,128,192,32,4,4,1,132.4,OK,5,unknown
BmgGemmBF16BF16FP32_RCR_GemmExhaustive_128x128x16_SG4x4_ST2,RCR,GemmExhaustive,128,128,16,4,4,2,132.2,OK,5,unknown
BmgGemmBF16BF16FP32_RCR_GemmExhaustive_128x256x64_SG4x8_ST1,RCR,GemmExhaustive,128,256,64,4,8,1,132.2,OK,5,batch_0090_gpu5
BmgGemmBF16BF16FP32_RCR_GemmExhaustive_256x128x32_SG4x8_ST1,RCR,GemmExhaustive,256,128,32,4,8,1,132.0,OK,6,batch_0157_gpu6
BmgGemmBF16BF16FP32_RCR_GemmExhaustive_256x128x32_SG8x4_ST2,RCR,GemmExhaustive,256,128,32,8,4,2,131.8,OK,6,batch_0161_gpu6
BmgGemmBF16BF16FP32_RRR_Gemm_256x128x32_SG8x4,RRR,Gemm,256,128,32,8,4,2,131.8,OK,6,batch_0523_gpu6
BmgGemmBF16BF16FP32_RCR_GemmExhaustive_128x128x32_SG2x8_ST1,RCR,GemmExhaustive,128,128,32,2,8,1,131.8,OK,6,unknown
BmgGemmBF16BF16FP32_RRR_Gemm_128x256x32_SG4x8,RRR,Gemm,128,256,32,4,8,2,131.8,OK,5,batch_0514_gpu5
BmgGemmBF16BF16FP32_RCR_Gemm_256x256x32_SG4x8,RCR,Gemm,256,256,32,4,8,2,131.7,OK,6,batch_0439_gpu6
BmgGemmBF16BF16FP32_RCR_GemmExhaustive_256x256x16_SG4x8_ST1,RCR,GemmExhaustive,256,256,16,4,8,1,131.5,OK,6,batch_0177_gpu6
BmgGemmBF16BF16FP32_RCR_GemmExhaustive_256x256x32_SG4x8_ST2,RCR,GemmExhaustive,256,256,32,4,8,2,131.5,OK,5,batch_0182_gpu5
BmgGemmBF16BF16FP32_RRR_Gemm_256x256x16_SG4x8,RRR,Gemm,256,256,16,4,8,2,131.5,OK,6,batch_0525_gpu6
BmgGemmBF16BF16FP32_RCR_GemmExhaustive_256x256x16_SG4x8_ST2,RCR,GemmExhaustive,256,256,16,4,8,2,131.2,OK,6,batch_0177_gpu6
BmgGemmBF16BF16FP32_RRR_Gemm_256x256x32_SG4x8,RRR,Gemm,256,256,32,4,8,2,130.9,OK,5,batch_0526_gpu5
BmgGemmBF16BF16FP32_RCR_Gemm_256x256x16_SG4x8,RCR,Gemm,256,256,16,4,8,2,130.8,OK,5,batch_0438_gpu5
BmgGemmBF16BF16FP32_RRR_Gemm_256x128x64_SG8x4,RRR,Gemm,256,128,64,8,4,2,130.8,OK,5,batch_0524_gpu5
BmgGemmBF16BF16FP32_RCR_GemmExhaustive_128x512x32_SG4x8_ST3,RCR,GemmExhaustive,128,512,32,4,8,3,130.7,OK,5,batch_0106_gpu5
BmgGemmBF16BF16FP32_RCR_GemmExhaustive_256x128x64_SG4x8_ST1,RCR,GemmExhaustive,256,128,64,4,8,1,130.7,OK,5,batch_0166_gpu5
BmgGemmBF16BF16FP32_RCR_GemmExhaustive_256x128x32_SG8x4_ST3,RCR,GemmExhaustive,256,128,32,8,4,3,130.7,OK,6,batch_0161_gpu6
BmgGemmBF16BF16FP32_RRR_Gemm_256x256x16_SG8x4,RRR,Gemm,256,256,16,8,4,2,130.5,OK,6,batch_0525_gpu6
BmgGemmBF16BF16FP32_RCR_GemmExhaustive_128x256x16_SG4x4_ST1,RCR,GemmExhaustive,128,256,16,4,4,1,130.5,OK,5,batch_0070_gpu5
BmgGemmBF16BF16FP32_RCR_GemmExhaustive_256x128x64_SG4x8_ST2,RCR,GemmExhaustive,256,128,64,4,8,2,130.4,OK,6,batch_0167_gpu6
BmgGemmBF16BF16FP32_RCR_Gemm_256x128x64_SG8x4,RCR,Gemm,256,128,64,8,4,2,130.3,OK,6,batch_0437_gpu6
BmgGemmBF16BF16FP32_RCR_GemmExhaustive_128x192x16_SG4x4_ST1,RCR,GemmExhaustive,128,192,16,4,4,1,130.0,OK,6,unknown
BmgGemmBF16BF16FP32_RCR_GemmExhaustive_128x256x64_SG4x8_ST2,RCR,GemmExhaustive,128,256,64,4,8,2,129.9,OK,5,batch_0090_gpu5
BmgGemmBF16BF16FP32_RCR_GemmExhaustive_128x128x16_SG2x8_ST2,RCR,GemmExhaustive,128,128,16,2,8,2,129.8,OK,6,unknown
BmgGemmBF16BF16FP32_RCR_Gemm_256x128x32_SG8x4,RCR,Gemm,256,128,32,8,4,2,129.7,OK,5,batch_0436_gpu5
BmgGemmBF16BF16FP32_RCR_GemmExhaustive_128x256x32_SG4x8_ST3,RCR,GemmExhaustive,128,256,32,4,8,3,129.7,OK,5,batch_0082_gpu5
BmgGemmBF16BF16FP32_RCR_GemmExhaustive_256x256x32_SG4x8_ST3,RCR,GemmExhaustive,256,256,32,4,8,3,129.5,OK,5,batch_0182_gpu5
BmgGemmBF16BF16FP32_RCR_Gemm_256x128x32_SG4x8,RCR,Gemm,256,128,32,4,8,2,129.5,OK,6,batch_0435_gpu6
BmgGemmBF16BF16FP32_RCR_GemmExhaustive_128x128x32_SG2x8_ST2,RCR,GemmExhaustive,128,128,32,2,8,2,129.4,OK,5,unknown
BmgGemmBF16BF16FP32_RCR_GemmExhaustive_256x128x32_SG4x8_ST3,RCR,GemmExhaustive,256,128,32,4,8,3,129.1,OK,5,batch_0158_gpu5
BmgGemmBF16BF16FP32_RRR_Gemm_128x128x32_SG8x2,RRR,Gemm,128,128,32,8,2,2,129.1,OK,6,batch_0509_gpu6
BmgGemmBF16BF16FP32_RCR_GemmExhaustive_256x256x16_SG4x8_ST3,RCR,GemmExhaustive,256,256,16,4,8,3,129.0,OK,5,batch_0178_gpu5
BmgGemmBF16BF16FP32_RRR_Gemm_128x256x32_SG8x4,RRR,Gemm,128,256,32,8,4,2,128.7,OK,6,batch_0515_gpu6
BmgGemmBF16BF16FP32_RRR_Gemm_256x128x32_SG4x8,RRR,Gemm,256,128,32,4,8,2,128.5,OK,5,batch_0522_gpu5
BmgGemmBF16BF16FP32_RCR_GemmExhaustive_256x128x64_SG8x4_ST2,RCR,GemmExhaustive,256,128,64,8,4,2,128.5,OK,5,batch_0170_gpu5
BmgGemmBF16BF16FP32_RCR_StreamK_256x256x16,RCR,StreamK,256,256,16,,,2,128.3,OK,6,unknown
BmgGemmBF16BF16FP32_RCR_GemmExhaustive_256x256x16_SG8x4_ST2,RCR,GemmExhaustive,256,256,16,8,4,2,128.1,OK,6,batch_0179_gpu6
BmgGemmBF16BF16FP32_RCR_GemmExhaustive_64x256x32_SG2x8_ST1,RCR,GemmExhaustive,64,256,32,2,8,1,128.1,OK,5,batch_0352_gpu5
BmgGemmBF16BF16FP32_RCR_GemmExhaustive_64x256x32_SG2x8_ST3,RCR,GemmExhaustive,64,256,32,2,8,3,127.9,OK,6,batch_0353_gpu6
BmgGemmBF16BF16FP32_RCR_Gemm_256x256x16_SG8x4,RCR,Gemm,256,256,16,8,4,2,127.9,OK,5,batch_0438_gpu5
BmgGemmBF16BF16FP32_RCR_GemmExhaustive_128x256x16_SG4x8_ST3,RCR,GemmExhaustive,128,256,16,4,8,3,127.7,OK,6,batch_0073_gpu6
BmgGemmBF16BF16FP32_RCR_GemmExhaustive_256x128x32_SG4x8_ST2,RCR,GemmExhaustive,256,128,32,4,8,2,127.7,OK,5,batch_0158_gpu5
BmgGemmBF16BF16FP32_RRR_Gemm_64x128x32_SG1x4,RRR,Gemm,64,128,32,1,4,2,127.5,OK,6,batch_0537_gpu6
BmgGemmBF16BF16FP32_RCR_GemmExhaustive_128x256x16_SG4x8_ST2,RCR,GemmExhaustive,128,256,16,4,8,2,127.3,OK,5,batch_0072_gpu5
BmgGemmBF16BF16FP32_RCR_GemmExhaustive_64x256x16_SG2x8_ST2,RCR,GemmExhaustive,64,256,16,2,8,2,127.3,OK,5,batch_0344_gpu5
BmgGemmBF16BF16FP32_RCR_GemmExhaustive_128x256x64_SG4x8_ST3,RCR,GemmExhaustive,128,256,64,4,8,3,126.7,OK,6,batch_0091_gpu6
BmgGemmBF16BF16FP32_RCR_StreamK_512x128x16,RCR,StreamK,512,128,16,,,2,126.7,OK,5,unknown
BmgGemmBF16BF16FP32_RCR_GemmExhaustive_128x128x64_SG8x2_ST1,RCR,GemmExhaustive,128,128,64,8,2,1,126.7,OK,6,unknown
BmgGemmBF16BF16FP32_RCR_GemmExhaustive_256x256x16_SG8x4_ST3,RCR,GemmExhaustive,256,256,16,8,4,3,126.4,OK,6,batch_0179_gpu6
BmgGemmBF16BF16FP32_RCR_GemmExhaustive_64x256x16_SG2x8_ST1,RCR,GemmExhaustive,64,256,16,2,8,1,126.4,OK,6,batch_0343_gpu6
BmgGemmBF16BF16FP32_RCR_GemmExhaustive_128x128x16_SG4x4_ST1,RCR,GemmExhaustive,128,128,16,4,4,1,126.3,OK,5,unknown
BmgGemmBF16BF16FP32_RRR_Gemm_64x128x32_SG4x4,RRR,Gemm,64,128,32,4,4,2,126.3,OK,6,batch_0539_gpu6
BmgGemmBF16BF16FP32_RCR_GemmExhaustive_128x128x32_SG8x2_ST2,RCR,GemmExhaustive,128,128,32,8,2,2,125.9,OK,5,unknown
BmgGemmBF16BF16FP32_RCR_Gemm_128x128x32_SG8x2,RCR,Gemm,128,128,32,8,2,2,125.6,OK,5,batch_0422_gpu5
BmgGemmBF16BF16FP32_RCR_GemmExhaustive_128x256x16_SG4x8_ST1,RCR,GemmExhaustive,128,256,16,4,8,1,125.5,OK,5,batch_0072_gpu5
BmgGemmBF16BF16FP32_RRR_Gemm_128x128x64_SG8x4,RRR,Gemm,128,128,64,8,4,2,125.0,OK,5,batch_0512_gpu5
BmgGemmBF16BF16FP32_RCR_GemmExhaustive_128x128x32_SG8x2_ST3,RCR,GemmExhaustive,128,128,32,8,2,3,124.4,OK,6,unknown
BmgGemmBF16BF16FP32_RCR_GemmExhaustive_256x256x16_SG8x4_ST1,RCR,GemmExhaustive,256,256,16,8,4,1,124.3,OK,5,batch_0178_gpu5
BmgGemmBF16BF16FP32_RCR_GemmExhaustive_256x128x64_SG8x4_ST3,RCR,GemmExhaustive,256,128,64,8,4,3,124.1,OK,5,batch_0170_gpu5
BmgGemmBF16BF16FP32_RCR_StreamK_256x128x16,RCR,StreamK,256,128,16,,,2,123.9,OK,5,unknown
BmgGemmBF16BF16FP32_RCR_GemmExhaustive_256x128x16_SG8x4_ST1,RCR,GemmExhaustive,256,128,16,8,4,1,123.6,OK,6,batch_0151_gpu6
BmgGemmBF16BF16FP32_RCR_GemmExhaustive_128x64x64_SG4x4_ST2,RCR,GemmExhaustive,128,64,64,4,4,2,123.5,OK,6,batch_0123_gpu6
BmgGemmBF16BF16FP32_RCR_GemmExhaustive_256x128x64_SG4x8_ST3,RCR,GemmExhaustive,256,128,64,4,8,3,123.4,OK,6,batch_0167_gpu6
BmgGemmBF16BF16FP32_RCR_GemmExhaustive_64x128x64_SG2x8_ST2,RCR,GemmExhaustive,64,128,64,2,8,2,123.2,OK,6,batch_0321_gpu6
BmgGemmBF16BF16FP32_RCR_GemmExhaustive_256x192x16_SG8x4_ST2,RCR,GemmExhaustive,256,192,16,8,4,2,123.2,OK,6,batch_0173_gpu6
BmgGemmBF16BF16FP32_RCR_GemmExhaustive_128x96x32_SG8x2_ST2,RCR,GemmExhaustive,128,96,32,8,2,2,123.2,OK,6,batch_0129_gpu6
BmgGemmBF16BF16FP32_RCR_GemmExhaustive_256x192x16_SG8x4_ST3,RCR,GemmExhaustive,256,192,16,8,4,3,122.9,OK,6,batch_0173_gpu6
BmgGemmBF16BF16FP32_RCR_GemmExhaustive_128x96x64_SG8x2_ST1,RCR,GemmExhaustive,128,96,64,8,2,1,122.5,OK,5,batch_0130_gpu5
BmgGemmBF16BF16FP32_RCR_GemmExhaustive_128x128x64_SG8x2_ST2,RCR,GemmExhaustive,128,128,64,8,2,2,122.3,OK,6,unknown
BmgGemmBF16BF16FP32_RCR_GemmExhaustive_128x128x32_SG8x2_ST1,RCR,GemmExhaustive,128,128,32,8,2,1,122.1,OK,5,unknown
BmgGemmBF16BF16FP32_RCR_GemmExhaustive_64x256x16_SG2x8_ST3,RCR,GemmExhaustive,64,256,16,2,8,3,122.0,OK,5,batch_0344_gpu5
BmgGemmBF16BF16FP32_RCR_GemmExhaustive_128x96x64_SG8x2_ST2,RCR,GemmExhaustive,128,96,64,8,2,2,122.0,OK,6,batch_0131_gpu6
BmgGemmBF16BF16FP32_RCR_GemmExhaustive_128x512x16_SG4x8_ST2,RCR,GemmExhaustive,128,512,16,4,8,2,122.0,OK,6,batch_0101_gpu6
BmgGemmBF16BF16FP32_RCR_Gemm_128x128x64_SG8x2,RCR,Gemm,128,128,64,8,2,2,121.8,OK,6,batch_0425_gpu6
BmgGemmBF16BF16FP32_RCR_GemmExhaustive_256x128x16_SG8x4_ST2,RCR,GemmExhaustive,256,128,16,8,4,2,121.5,OK,5,batch_0152_gpu5
BmgGemmBF16BF16FP32_RRR_Gemm_128x256x16_SG8x4,RRR,Gemm,128,256,16,8,4,2,121.5,OK,6,batch_0513_gpu6
BmgGemmBF16BF16FP32_RCR_GemmExhaustive_256x128x16_SG8x4_ST3,RCR,GemmExhaustive,256,128,16,8,4,3,121.1,OK,5,batch_0152_gpu5
BmgGemmBF16BF16FP32_RRR_Gemm_128x64x32_SG8x2,RRR,Gemm,128,64,32,8,2,2,121.0,OK,5,batch_0518_gpu5
BmgGemmBF16BF16FP32_RCR_GemmExhaustive_128x96x32_SG8x2_ST3,RCR,GemmExhaustive,128,96,32,8,2,3,120.8,OK,5,batch_0130_gpu5
BmgGemmBF16BF16FP32_RCR_GemmExhaustive_64x128x64_SG2x8_ST1,RCR,GemmExhaustive,64,128,64,2,8,1,120.7,OK,6,batch_0321_gpu6
BmgGemmBF16BF16FP32_RCR_GemmExhaustive_256x128x16_SG4x8_ST2,RCR,GemmExhaustive,256,128,16,4,8,2,120.1,OK,6,batch_0149_gpu6
BmgGemmBF16BF16FP32_RCR_StreamK_256x64x64,RCR,StreamK,256,64,64,,,2,119.8,OK,6,unknown
BmgGemmBF16BF16FP32_RCR_GemmExhaustive_128x128x16_SG2x8_ST1,RCR,GemmExhaustive,128,128,16,2,8,1,119.7,OK,5,unknown
BmgGemmBF16BF16FP32_RCR_GemmExhaustive_64x128x32_SG2x8_ST3,RCR,GemmExhaustive,64,128,32,2,8,3,119.6,OK,6,batch_0313_gpu6
BmgGemmBF16BF16FP32_RCR_GemmExhaustive_128x192x32_SG8x2_ST1,RCR,GemmExhaustive,128,192,32,8,2,1,119.6,OK,6,unknown
BmgGemmBF16BF16FP32_RCR_GemmExhaustive_256x128x16_SG4x8_ST3,RCR,GemmExhaustive,256,128,16,4,8,3,119.4,OK,6,batch_0149_gpu6
BmgGemmBF16BF16FP32_RCR_GemmExhaustive_128x512x16_SG4x8_ST3,RCR,GemmExhaustive,128,512,16,4,8,3,119.0,OK,6,batch_0101_gpu6
BmgGemmBF16BF16FP32_RCR_GemmExhaustive_64x256x64_SG2x8_ST2,RCR,GemmExhaustive,64,256,64,2,8,2,118.8,OK,5,batch_0362_gpu5
BmgGemmBF16BF16FP32_RCR_GemmExhaustive_128x128x16_SG8x2_ST2,RCR,GemmExhaustive,128,128,16,8,2,2,118.6,OK,6,unknown
BmgGemmBF16BF16FP32_RCR_GemmExhaustive_128x64x32_SG4x4_ST3,RCR,GemmExhaustive,128,64,32,4,4,3,118.2,OK,6,batch_0119_gpu6
BmgGemmBF16BF16FP32_RCR_GemmExhaustive_128x64x64_SG4x4_ST1,RCR,GemmExhaustive,128,64,64,4,4,1,118.0,OK,6,batch_0123_gpu6
BmgGemmBF16BF16FP32_RRR_Gemm_128x64x32_SG4x4,RRR,Gemm,128,64,32,4,4,2,117.8,OK,5,batch_0518_gpu5
BmgGemmBF16BF16FP32_RCR_GemmExhaustive_128x512x16_SG4x8_ST1,RCR,GemmExhaustive,128,512,16,4,8,1,117.6,OK,5,batch_0100_gpu5
BmgGemmBF16BF16FP32_RCR_Gemm_128x128x64_SG4x8,RCR,Gemm,128,128,64,4,8,2,117.4,OK,5,batch_0424_gpu5
BmgGemmBF16BF16FP32_RCR_DataParallel_128x256x32,RCR,DataParallel,128,256,32,,,2,117.3,OK,6,unknown
BmgGemmBF16BF16FP32_RCR_Gemm_128x64x32_SG4x4,RCR,Gemm,128,64,32,4,4,2,117.3,OK,6,batch_0431_gpu6
BmgGemmBF16BF16FP32_RCR_GemmExhaustive_64x128x32_SG2x8_ST2,RCR,GemmExhaustive,64,128,32,2,8,2,117.2,OK,5,batch_0312_gpu5
BmgGemmBF16BF16FP32_RCR_GemmExhaustive_256x192x16_SG8x4_ST1,RCR,GemmExhaustive,256,192,16,8,4,1,117.2,OK,5,batch_0172_gpu5
BmgGemmBF16BF16FP32_RCR_GemmExhaustive_128x128x64_SG4x8_ST2,RCR,GemmExhaustive,128,128,64,4,8,2,117.2,OK,5,unknown
BmgGemmBF16BF16FP32_RCR_GemmExhaustive_128x64x32_SG4x4_ST2,RCR,GemmExhaustive,128,64,32,4,4,2,117.2,OK,6,batch_0119_gpu6
BmgGemmBF16BF16FP32_RCR_GemmExhaustive_128x192x32_SG8x2_ST2,RCR,GemmExhaustive,128,192,32,8,2,2,117.1,OK,5,unknown
BmgGemmBF16BF16FP32_RCR_GemmExhaustive_128x256x32_SG8x4_ST3,RCR,GemmExhaustive,128,256,32,8,4,3,116.7,OK,6,batch_0085_gpu6
BmgGemmBF16BF16FP32_RCR_GemmExhaustive_128x64x64_SG4x4_ST3,RCR,GemmExhaustive,128,64,64,4,4,3,116.6,OK,5,batch_0124_gpu5
BmgGemmBF16BF16FP32_RCR_GemmExhaustive_128x96x32_SG8x2_ST1,RCR,GemmExhaustive,128,96,32,8,2,1,116.2,OK,6,batch_0129_gpu6
BmgGemmBF16BF16FP32_RCR_GemmExhaustive_128x128x16_SG8x2_ST3,RCR,GemmExhaustive,128,128,16,8,2,3,116.2,OK,5,unknown
BmgGemmBF16BF16FP32_RCR_GemmExhaustive_128x64x64_SG8x2_ST2,RCR,GemmExhaustive,128,64,64,8,2,2,115.8,OK,6,batch_0125_gpu6
BmgGemmBF16BF16FP32_RCR_GemmExhaustive_128x128x16_SG8x2_ST1,RCR,GemmExhaustive,128,128,16,8,2,1,115.6,OK,6,unknown
BmgGemmBF16BF16FP32_RCR_GemmExhaustive_128x256x32_SG8x4_ST1,RCR,GemmExhaustive,128,256,32,8,4,1,115.6,OK,5,batch_0084_gpu5
BmgGemmBF16BF16FP32_RCR_Gemm_128x256x32_SG8x4,RCR,Gemm,128,256,32,8,4,2,115.3,OK,5,batch_0428_gpu5
BmgGemmBF16BF16FP32_RCR_GemmExhaustive_128x256x32_SG8x4_ST2,RCR,GemmExhaustive,128,256,32,8,4,2,115.3,OK,5,batch_0084_gpu5
BmgGemmBF16BF16FP32_RCR_GemmExhaustive_128x256x64_SG8x4_ST2,RCR,GemmExhaustive,128,256,64,8,4,2,115.1,OK,6,batch_0093_gpu6
BmgGemmBF16BF16FP32_RCR_GemmExhaustive_128x256x16_SG8x2_ST1,RCR,GemmExhaustive,128,256,16,8,2,1,115.1,OK,6,batch_0073_gpu6
BmgGemmBF16BF16FP32_RCR_GemmExhaustive_64x128x64_SG4x4_ST2,RCR,GemmExhaustive,64,128,64,4,4,2,115.0,OK,6,batch_0323_gpu6
BmgGemmBF16BF16FP32_RCR_GemmExhaustive_128x256x64_SG8x4_ST1,RCR,GemmExhaustive,128,256,64,8,4,1,114.9,OK,6,batch_0093_gpu6
BmgGemmBF16BF16FP32_RCR_GemmExhaustive_256x128x16_SG4x8_ST1,RCR,GemmExhaustive,256,128,16,4,8,1,114.7,OK,5,batch_0148_gpu5
BmgGemmBF16BF16FP32_RCR_GemmExhaustive_128x128x64_SG4x8_ST3,RCR,GemmExhaustive,128,128,64,4,8,3,114.0,OK,5,unknown
BmgGemmBF16BF16FP32_RCR_GemmExhaustive_128x192x16_SG8x2_ST2,RCR,GemmExhaustive,128,192,16,8,2,2,114.0,OK,6,unknown
BmgGemmBF16BF16FP32_RCR_GemmExhaustive_64x256x32_SG4x4_ST1,RCR,GemmExhaustive,64,256,32,4,4,1,113.8,OK,5,batch_0354_gpu5
BmgGemmBF16BF16FP32_RCR_GemmExhaustive_128x192x16_SG8x2_ST1,RCR,GemmExhaustive,128,192,16,8,2,1,113.6,OK,6,unknown
BmgGemmBF16BF16FP32_RCR_GemmExhaustive_128x192x32_SG8x2_ST3,RCR,GemmExhaustive,128,192,32,8,2,3,113.3,OK,5,unknown
BmgGemmBF16BF16FP32_RCR_Gemm_128x256x64_SG8x4,RCR,Gemm,128,256,64,8,4,2,113.2,OK,5,batch_0428_gpu5
BmgGemmBF16BF16FP32_RCR_GemmExhaustive_64x192x64_SG4x4_ST1,RCR,GemmExhaustive,64,192,64,4,4,1,112.9,OK,6,batch_0339_gpu6
BmgGemmBF16BF16FP32_RCR_GemmExhaustive_64x256x64_SG2x8_ST3,RCR,GemmExhaustive,64,256,64,2,8,3,112.6,OK,5,batch_0362_gpu5
BmgGemmBF16BF16FP32_RCR_GemmExhaustive_128x128x64_SG4x8_ST1,RCR,GemmExhaustive,128,128,64,4,8,1,112.1,OK,6,unknown
BmgGemmBF16BF16FP32_RCR_GemmExhaustive_128x256x16_SG8x2_ST2,RCR,GemmExhaustive,128,256,16,8,2,2,111.7,OK,5,batch_0074_gpu5
BmgGemmBF16BF16FP32_RCR_GemmExhaustive_128x96x64_SG8x2_ST3,RCR,GemmExhaustive,128,96,64,8,2,3,111.7,OK,6,batch_0131_gpu6
BmgGemmBF16BF16FP32_RCR_GemmExhaustive_64x192x32_SG4x4_ST2,RCR,GemmExhaustive,64,192,32,4,4,2,111.6,OK,6,batch_0335_gpu6
BmgGemmBF16BF16FP32_RCR_StreamK_256x64x32,RCR,StreamK,256,64,32,,,2,111.4,OK,6,unknown
BmgGemmBF16BF16FP32_RCR_GemmExhaustive_64x512x32_SG2x8_ST1,RCR,GemmExhaustive,64,512,32,2,8,1,111.3,OK,5,batch_0384_gpu5
BmgGemmBF16BF16FP32_RCR_GemmExhaustive_128x128x64_SG8x2_ST3,RCR,GemmExhaustive,128,128,64,8,2,3,111.0,OK,5,unknown
BmgGemmBF16BF16FP32_RCR_GemmExhaustive_128x192x64_SG8x4_ST1,RCR,GemmExhaustive,128,192,64,8,4,1,110.9,OK,6,batch_0067_gpu6
BmgGemmBF16BF16FP32_RCR_GemmExhaustive_64x256x64_SG4x4_ST1,RCR,GemmExhaustive,64,256,64,4,4,1,110.9,OK,6,batch_0363_gpu6
BmgGemmBF16BF16FP32_RCR_GemmExhaustive_128x256x64_SG8x4_ST3,RCR,GemmExhaustive,128,256,64,8,4,3,110.5,OK,5,batch_0094_gpu5
BmgGemmBF16BF16FP32_RCR_Gemm_128x128x32_SG4x8,RCR,Gemm,128,128,32,4,8,2,110.3,OK,6,batch_0421_gpu6
BmgGemmBF16BF16FP32_RCR_GemmExhaustive_128x64x64_SG8x2_ST1,RCR,GemmExhaustive,128,64,64,8,2,1,110.3,OK,5,batch_0124_gpu5
BmgGemmBF16BF16FP32_RCR_GemmExhaustive_128x96x16_SG8x2_ST3,RCR,GemmExhaustive,128,96,16,8,2,3,110.1,OK,5,batch_0128_gpu5
BmgGemmBF16BF16FP32_RCR_GemmExhaustive_128x96x16_SG8x2_ST2,RCR,GemmExhaustive,128,96,16,8,2,2,109.9,OK,5,batch_0128_gpu5
BmgGemmBF16BF16FP32_RCR_GemmExhaustive_64x256x32_SG4x4_ST2,RCR,GemmExhaustive,64,256,32,4,4,2,109.7,OK,5,batch_0354_gpu5
BmgGemmBF16BF16FP32_RCR_GemmExhaustive_128x64x32_SG8x2_ST3,RCR,GemmExhaustive,128,64,32,8,2,3,109.7,OK,6,batch_0121_gpu6
BmgGemmBF16BF16FP32_RCR_GemmExhaustive_128x192x16_SG8x2_ST3,RCR,GemmExhaustive,128,192,16,8,2,3,109.7,OK,5,unknown
BmgGemmBF16BF16FP32_RCR_Gemm_64x128x32_SG1x4,RCR,Gemm,64,128,32,1,4,2,109.3,OK,5,batch_0450_gpu5
BmgGemmBF16BF16FP32_RCR_GemmExhaustive_64x192x32_SG4x4_ST1,RCR,GemmExhaustive,64,192,32,4,4,1,109.0,OK,5,batch_0334_gpu5
BmgGemmBF16BF16FP32_RCR_GemmExhaustive_128x192x32_SG8x4_ST2,RCR,GemmExhaustive,128,192,32,8,4,2,109.0,OK,6,unknown
BmgGemmBF16BF16FP32_RCR_Gemm_128x64x32_SG8x2,RCR,Gemm,128,64,32,8,2,2,109.0,OK,6,batch_0431_gpu6
BmgGemmBF16BF16FP32_RCR_GemmExhaustive_128x128x32_SG4x8_ST2,RCR,GemmExhaustive,128,128,32,4,8,2,109.0,OK,6,unknown
BmgGemmBF16BF16FP32_RCR_GemmExhaustive_128x64x32_SG4x4_ST1,RCR,GemmExhaustive,128,64,32,4,4,1,108.2,OK,5,batch_0118_gpu5
BmgGemmBF16BF16FP32_RCR_GemmExhaustive_128x96x16_SG8x2_ST1,RCR,GemmExhaustive,128,96,16,8,2,1,108.0,OK,6,batch_0127_gpu6
BmgGemmBF16BF16FP32_RCR_GemmExhaustive_128x64x64_SG8x2_ST3,RCR,GemmExhaustive,128,64,64,8,2,3,107.7,OK,6,batch_0125_gpu6
BmgGemmBF16BF16FP32_RCR_GemmExhaustive_64x128x64_SG4x4_ST1,RCR,GemmExhaustive,64,128,64,4,4,1,107.7,OK,5,batch_0322_gpu5
BmgGemmBF16BF16FP32_RCR_GemmExhaustive_128x64x32_SG8x2_ST2,RCR,GemmExhaustive,128,64,32,8,2,2,107.7,OK,5,batch_0120_gpu5
BmgGemmBF16BF16FP32_RCR_StreamK_128x192x64,RCR,StreamK,128,192,64,,,2,107.5,OK,6,unknown
BmgGemmBF16BF16FP32_RCR_GemmExhaustive_64x128x32_SG4x4_ST3,RCR,GemmExhaustive,64,128,32,4,4,3,107.5,OK,5,batch_0314_gpu5
BmgGemmBF16BF16FP32_RCR_GemmExhaustive_128x192x32_SG8x4_ST3,RCR,GemmExhaustive,128,192,32,8,4,3,107.4,OK,5,unknown
BmgGemmBF16BF16FP32_RCR_GemmExhaustive_128x192x64_SG8x4_ST2,RCR,GemmExhaustive,128,192,64,8,4,2,107.3,OK,5,batch_0068_gpu5
BmgGemmBF16BF16FP32_RCR_GemmExhaustive_128x256x16_SG8x2_ST3,RCR,GemmExhaustive,128,256,16,8,2,3,107.2,OK,5,batch_0074_gpu5
BmgGemmBF16BF16FP32_RRR_Gemm_64x256x32_SG8x4,RRR,Gemm,64,256,32,8,4,2,107.2,OK,6,batch_0541_gpu6
BmgGemmBF16BF16FP32_RRR_Gemm_64x128x32_SG8x2,RRR,Gemm,64,128,32,8,2,2,107.2,OK,5,batch_0540_gpu5
BmgGemmBF16BF16FP32_RCR_GemmExhaustive_128x128x32_SG4x8_ST3,RCR,GemmExhaustive,128,128,32,4,8,3,106.9,OK,6,unknown
BmgGemmBF16BF16FP32_RRR_Gemm_64x256x64_SG8x4,RRR,Gemm,64,256,64,8,4,2,106.4,OK,5,batch_0542_gpu5
BmgGemmBF16BF16FP32_RCR_StreamK_128x256x16,RCR,StreamK,128,256,16,,,2,106.4,OK,6,unknown
BmgGemmBF16BF16FP32_RCR_Gemm_64x128x32_SG4x4,RCR,Gemm,64,128,32,4,4,2,106.3,OK,5,batch_0452_gpu5
BmgGemmBF16BF16FP32_RCR_GemmExhaustive_64x128x32_SG4x4_ST2,RCR,GemmExhaustive,64,128,32,4,4,2,106.3,OK,5,batch_0314_gpu5
BmgGemmBF16BF16FP32_RCR_DataParallel_128x256x16,RCR,DataParallel,128,256,16,,,2,106.3,OK,6,unknown
BmgGemmBF16BF16FP32_RCR_GemmExhaustive_64x192x32_SG4x4_ST3,RCR,GemmExhaustive,64,192,32,4,4,3,106.0,OK,6,batch_0335_gpu6
BmgGemmBF16BF16FP32_RCR_GemmExhaustive_64x128x32_SG2x8_ST1,RCR,GemmExhaustive,64,128,32,2,8,1,105.8,OK,5,batch_0312_gpu5
BmgGemmBF16BF16FP32_RCR_GemmExhaustive_128x192x32_SG8x4_ST1,RCR,GemmExhaustive,128,192,32,8,4,1,105.6,OK,6,unknown
BmgGemmBF16BF16FP32_RCR_GemmExhaustive_64x256x16_SG4x4_ST2,RCR,GemmExhaustive,64,256,16,4,4,2,105.5,OK,6,batch_0345_gpu6
BmgGemmBF16BF16FP32_RCR_GemmExhaustive_64x256x64_SG4x8_ST2,RCR,GemmExhaustive,64,256,64,4,8,2,105.5,OK,6,batch_0365_gpu6
BmgGemmBF16BF16FP32_RCR_Gemm_128x128x64_SG8x4,RCR,Gemm,128,128,64,8,4,2,105.4,OK,6,batch_0425_gpu6
BmgGemmBF16BF16FP32_RCR_GemmExhaustive_128x128x64_SG8x4_ST2,RCR,GemmExhaustive,128,128,64,8,4,2,105.2,OK,6,unknown
BmgGemmBF16BF16FP32_RCR_GemmExhaustive_64x256x16_SG4x4_ST1,RCR,GemmExhaustive,64,256,16,4,4,1,105.2,OK,6,batch_0345_gpu6
BmgGemmBF16BF16FP32_RCR_GemmExhaustive_64x512x32_SG2x8_ST2,RCR,GemmExhaustive,64,512,32,2,8,2,104.9,OK,5,batch_0384_gpu5
BmgGemmBF16BF16FP32_RCR_GemmExhaustive_128x192x64_SG8x4_ST3,RCR,GemmExhaustive,128,192,64,8,4,3,104.7,OK,5,batch_0068_gpu5
BmgGemmBF16BF16FP32_RCR_GemmExhaustive_128x256x16_SG8x4_ST2,RCR,GemmExhaustive,128,256,16,8,4,2,104.6,OK,6,batch_0075_gpu6
BmgGemmBF16BF16FP32_RCR_GemmExhaustive_128x256x16_SG8x4_ST1,RCR,GemmExhaustive,128,256,16,8,4,1,104.3,OK,6,batch_0075_gpu6
BmgGemmBF16BF16FP32_RCR_Gemm_128x256x16_SG8x4,RCR,Gemm,128,256,16,8,4,2,103.9,OK,5,batch_0426_gpu5
BmgGemmBF16BF16FP32_RCR_GemmExhaustive_128x128x64_SG8x4_ST1,RCR,GemmExhaustive,128,128,64,8,4,1,103.8,OK,5,unknown
BmgGemmBF16BF16FP32_RCR_GemmExhaustive_128x128x32_SG8x4_ST2,RCR,GemmExhaustive,128,128,32,8,4,2,103.7,OK,5,unknown
BmgGemmBF16BF16FP32_RCR_GemmExhaustive_64x512x32_SG4x8_ST1,RCR,GemmExhaustive,64,512,32,4,8,1,103.7,OK,6,batch_0387_gpu6
BmgGemmBF16BF16FP32_RCR_GemmExhaustive_128x128x64_SG8x4_ST3,RCR,GemmExhaustive,128,128,64,8,4,3,103.6,OK,6,unknown
BmgGemmBF16BF16FP32_RCR_Gemm_128x128x32_SG8x4,RCR,Gemm,128,128,32,8,4,2,103.5,OK,5,batch_0422_gpu5
BmgGemmBF16BF16FP32_RCR_GemmExhaustive_64x128x16_SG2x8_ST3,RCR,GemmExhaustive,64,128,16,2,8,3,103.3,OK,5,batch_0304_gpu5
BmgGemmBF16BF16FP32_RCR_GemmExhaustive_64x256x32_SG4x4_ST3,RCR,GemmExhaustive,64,256,32,4,4,3,103.2,OK,6,batch_0355_gpu6
BmgGemmBF16BF16FP32_RCR_GemmExhaustive_128x256x16_SG8x4_ST3,RCR,GemmExhaustive,128,256,16,8,4,3,103.0,OK,5,batch_0076_gpu5
BmgGemmBF16BF16FP32_RCR_GemmExhaustive_64x128x64_SG2x8_ST3,RCR,GemmExhaustive,64,128,64,2,8,3,103.0,OK,5,batch_0322_gpu5
BmgGemmBF16BF16FP32_RCR_GemmExhaustive_64x512x32_SG2x8_ST3,RCR,GemmExhaustive,64,512,32,2,8,3,102.8,OK,6,batch_0385_gpu6
BmgGemmBF16BF16FP32_RCR_GemmExhaustive_64x512x16_SG2x8_ST1,RCR,GemmExhaustive,64,512,16,2,8,1,102.8,OK,6,batch_0375_gpu6
BmgGemmBF16BF16FP32_RCR_StreamK_128x192x32,RCR,StreamK,128,192,32,,,2,102.7,OK,5,unknown
BmgGemmBF16BF16FP32_RCR_GemmExhaustive_512x64x32_SG8x2_ST3,RCR,GemmExhaustive,512,64,32,8,2,3,102.7,OK,5,batch_0296_gpu5
BmgGemmBF16BF16FP32_RCR_GemmExhaustive_64x512x32_SG4x8_ST2,RCR,GemmExhaustive,64,512,32,4,8,2,102.7,OK,6,batch_0387_gpu6
BmgGemmBF16BF16FP32_RCR_GemmExhaustive_128x128x32_SG4x8_ST1,RCR,GemmExhaustive,128,128,32,4,8,1,102.5,OK,5,unknown
BmgGemmBF16BF16FP32_RCR_GemmExhaustive_64x192x64_SG4x4_ST2,RCR,GemmExhaustive,64,192,64,4,4,2,102.4,OK,6,batch_0339_gpu6
BmgGemmBF16BF16FP32_RCR_GemmExhaustive_64x512x64_SG4x8_ST1,RCR,GemmExhaustive,64,512,64,4,8,1,102.4,OK,5,batch_0396_gpu5
BmgGemmBF16BF16FP32_RCR_GemmExhaustive_128x512x16_SG8x4_ST2,RCR,GemmExhaustive,128,512,16,8,4,2,102.4,OK,5,batch_0102_gpu5
BmgGemmBF16BF16FP32_RCR_GemmExhaustive_64x192x16_SG4x4_ST3,RCR,GemmExhaustive,64,192,16,4,4,3,102.0,OK,6,batch_0331_gpu6
BmgGemmBF16BF16FP32_RCR_GemmExhaustive_128x64x16_SG4x4_ST3,RCR,GemmExhaustive,128,64,16,4,4,3,101.6,OK,6,batch_0115_gpu6
BmgGemmBF16BF16FP32_RCR_GemmExhaustive_64x192x16_SG4x4_ST2,RCR,GemmExhaustive,64,192,16,4,4,2,101.6,OK,5,batch_0330_gpu5
BmgGemmBF16BF16FP32_RCR_GemmExhaustive_64x256x32_SG4x8_ST3,RCR,GemmExhaustive,64,256,32,4,8,3,101.1,OK,5,batch_0356_gpu5
BmgGemmBF16BF16FP32_RCR_GemmExhaustive_512x128x32_SG8x4_ST3,RCR,GemmExhaustive,512,128,32,8,4,3,101.1,OK,5,batch_0274_gpu5
BmgGemmBF16BF16FP32_RCR_GemmExhaustive_64x256x32_SG4x8_ST2,RCR,GemmExhaustive,64,256,32,4,8,2,100.7,OK,5,batch_0356_gpu5
BmgGemmBF16BF16FP32_RCR_GemmExhaustive_64x128x64_SG4x4_ST3,RCR,GemmExhaustive,64,128,64,4,4,3,100.6,OK,6,batch_0323_gpu6
BmgGemmBF16BF16FP32_RCR_GemmExhaustive_64x128x16_SG2x8_ST2,RCR,GemmExhaustive,64,128,16,2,8,2,100.4,OK,6,batch_0303_gpu6
BmgGemmBF16BF16FP32_RCR_GemmExhaustive_64x128x16_SG4x4_ST3,RCR,GemmExhaustive,64,128,16,4,4,3,100.3,OK,6,batch_0305_gpu6
BmgGemmBF16BF16FP32_RCR_GemmExhaustive_64x256x64_SG4x8_ST1,RCR,GemmExhaustive,64,256,64,4,8,1,100.2,OK,5,batch_0364_gpu5
BmgGemmBF16BF16FP32_RCR_GemmExhaustive_64x192x16_SG4x4_ST1,RCR,GemmExhaustive,64,192,16,4,4,1,99.7,OK,5,batch_0330_gpu5
BmgGemmBF16BF16FP32_RCR_GemmExhaustive_64x256x64_SG4x8_ST3,RCR,GemmExhaustive,64,256,64,4,8,3,99.6,OK,6,batch_0365_gpu6
BmgGemmBF16BF16FP32_RCR_GemmExhaustive_512x64x32_SG8x2_ST2,RCR,GemmExhaustive,512,64,32,8,2,2,99.5,OK,5,batch_0296_gpu5
BmgGemmBF16BF16FP32_RCR_GemmExhaustive_512x64x32_SG8x2_ST1,RCR,GemmExhaustive,512,64,32,8,2,1,99.5,OK,6,batch_0295_gpu6
BmgGemmBF16BF16FP32_RCR_GemmExhaustive_64x128x16_SG4x4_ST2,RCR,GemmExhaustive,64,128,16,4,4,2,99.4,OK,6,batch_0305_gpu6
BmgGemmBF16BF16FP32_RCR_GemmExhaustive_128x128x32_SG8x4_ST3,RCR,GemmExhaustive,128,128,32,8,4,3,99.3,OK,5,unknown
BmgGemmBF16BF16FP32_RRR_Gemm_128x64x64_SG8x4,RRR,Gemm,128,64,64,8,4,2,99.3,OK,6,batch_0519_gpu6
BmgGemmBF16BF16FP32_RCR_GemmExhaustive_64x128x32_SG4x4_ST1,RCR,GemmExhaustive,64,128,32,4,4,1,98.9,OK,6,batch_0313_gpu6
BmgGemmBF16BF16FP32_RCR_GemmExhaustive_64x256x16_SG4x4_ST3,RCR,GemmExhaustive,64,256,16,4,4,3,98.7,OK,5,batch_0346_gpu5
BmgGemmBF16BF16FP32_RCR_GemmExhaustive_128x192x16_SG8x4_ST3,RCR,GemmExhaustive,128,192,16,8,4,3,98.6,OK,6,unknown
BmgGemmBF16BF16FP32_RRR_Gemm_32x512x32_SG4x4,RRR,Gemm,32,512,32,4,4,2,98.6,OK,5,batch_0532_gpu5
BmgGemmBF16BF16FP32_RCR_GemmExhaustive_128x64x16_SG8x2_ST3,RCR,GemmExhaustive,128,64,16,8,2,3,98.4,OK,5,batch_0116_gpu5
BmgGemmBF16BF16FP32_RRR_Gemm_32x512x32_SG4x8,RRR,Gemm,32,512,32,4,8,2,98.2,OK,5,batch_0532_gpu5
BmgGemmBF16BF16FP32_RCR_GemmExhaustive_128x64x16_SG8x2_ST2,RCR,GemmExhaustive,128,64,16,8,2,2,97.8,OK,5,batch_0116_gpu5
BmgGemmBF16BF16FP32_RCR_GemmExhaustive_128x64x32_SG8x2_ST1,RCR,GemmExhaustive,128,64,32,8,2,1,97.7,OK,5,batch_0120_gpu5
BmgGemmBF16BF16FP32_RCR_GemmExhaustive_512x128x32_SG8x4_ST2,RCR,GemmExhaustive,512,128,32,8,4,2,97.5,OK,6,batch_0273_gpu6
BmgGemmBF16BF16FP32_RCR_Gemm_512x128x32_SG8x4,RCR,Gemm,512,128,32,8,4,2,97.5,OK,6,batch_0447_gpu6
BmgGemmBF16BF16FP32_RCR_GemmExhaustive_128x512x16_SG8x4_ST3,RCR,GemmExhaustive,128,512,16,8,4,3,97.2,OK,6,batch_0103_gpu6
BmgGemmBF16BF16FP32_RCR_GemmExhaustive_128x64x16_SG4x4_ST2,RCR,GemmExhaustive,128,64,16,4,4,2,96.8,OK,5,unknown
BmgGemmBF16BF16FP32_RCR_GemmExhaustive_512x128x16_SG8x4_ST3,RCR,GemmExhaustive,512,128,16,8,4,3,96.7,OK,6,batch_0269_gpu6
BmgGemmBF16BF16FP32_RCR_GemmExhaustive_512x128x32_SG8x4_ST1,RCR,GemmExhaustive,512,128,32,8,4,1,96.6,OK,6,batch_0273_gpu6
BmgGemmBF16BF16FP32_RCR_GemmExhaustive_512x128x16_SG4x8_ST3,RCR,GemmExhaustive,512,128,16,4,8,3,96.4,OK,5,batch_0268_gpu5
BmgGemmBF16BF16FP32_RCR_GemmExhaustive_128x192x16_SG8x4_ST2,RCR,GemmExhaustive,128,192,16,8,4,2,96.3,OK,6,unknown
BmgGemmBF16BF16FP32_RCR_GemmExhaustive_64x512x32_SG4x8_ST3,RCR,GemmExhaustive,64,512,32,4,8,3,96.2,OK,5,batch_0388_gpu5
BmgGemmBF16BF16FP32_RCR_GemmExhaustive_128x512x16_SG8x4_ST1,RCR,GemmExhaustive,128,512,16,8,4,1,96.2,OK,5,batch_0102_gpu5
BmgGemmBF16BF16FP32_RCR_GemmExhaustive_512x128x16_SG4x8_ST2,RCR,GemmExhaustive,512,128,16,4,8,2,95.7,OK,6,batch_0267_gpu6
BmgGemmBF16BF16FP32_RCR_GemmExhaustive_128x128x16_SG4x8_ST3,RCR,GemmExhaustive,128,128,16,4,8,3,95.7,OK,5,unknown
BmgGemmBF16BF16FP32_RCR_StreamK_128x512x16,RCR,StreamK,128,512,16,,,2,95.6,OK,6,unknown
BmgGemmBF16BF16FP32_RRR_Gemm_512x128x32_SG8x4,RRR,Gemm,512,128,32,8,4,2,95.5,OK,5,batch_0534_gpu5
BmgGemmBF16BF16FP32_RCR_GemmExhaustive_512x128x16_SG8x4_ST2,RCR,GemmExhaustive,512,128,16,8,4,2,95.3,OK,6,batch_0269_gpu6
BmgGemmBF16BF16FP32_RCR_GemmExhaustive_128x128x32_SG8x4_ST1,RCR,GemmExhaustive,128,128,32,8,4,1,94.8,OK,6,unknown
BmgGemmBF16BF16FP32_RCR_GemmExhaustive_128x128x16_SG4x8_ST2,RCR,GemmExhaustive,128,128,16,4,8,2,94.7,OK,5,unknown
BmgGemmBF16BF16FP32_RCR_GemmExhaustive_128x192x16_SG8x4_ST1,RCR,GemmExhaustive,128,192,16,8,4,1,94.5,OK,5,unknown
BmgGemmBF16BF16FP32_RCR_GemmExhaustive_64x512x16_SG2x8_ST2,RCR,GemmExhaustive,64,512,16,2,8,2,93.9,OK,6,batch_0375_gpu6
BmgGemmBF16BF16FP32_RCR_GemmExhaustive_256x192x64_SG8x4_ST1,RCR,GemmExhaustive,256,192,64,8,4,1,93.8,OK,6,batch_0175_gpu6
BmgGemmBF16BF16FP32_RCR_GemmExhaustive_512x128x16_SG4x8_ST1,RCR,GemmExhaustive,512,128,16,4,8,1,93.7,OK,6,batch_0267_gpu6
BmgGemmBF16BF16FP32_RRR_Gemm_64x128x64_SG8x4,RRR,Gemm,64,128,64,8,4,2,93.7,OK,6,batch_0541_gpu6
BmgGemmBF16BF16FP32_RCR_GemmExhaustive_512x128x16_SG8x4_ST1,RCR,GemmExhaustive,512,128,16,8,4,1,93.7,OK,5,batch_0268_gpu5
BmgGemmBF16BF16FP32_RCR_GemmExhaustive_64x512x16_SG4x8_ST2,RCR,GemmExhaustive,64,512,16,4,8,2,93.4,OK,5,batch_0378_gpu5
BmgGemmBF16BF16FP32_RCR_GemmExhaustive_64x256x64_SG4x4_ST2,RCR,GemmExhaustive,64,256,64,4,4,2,93.4,OK,6,batch_0363_gpu6
BmgGemmBF16BF16FP32_RRR_Gemm_256x192x64_SG8x4,RRR,Gemm,256,192,64,8,4,2,93.2,OK,5,batch_0524_gpu5
BmgGemmBF16BF16FP32_RCR_GemmExhaustive_256x96x32_SG8x2_ST3,RCR,GemmExhaustive,256,96,32,8,2,3,93.1,OK,6,batch_0215_gpu6
BmgGemmBF16BF16FP32_RCR_GemmExhaustive_512x64x16_SG8x2_ST1,RCR,GemmExhaustive,512,64,16,8,2,1,92.9,OK,6,batch_0291_gpu6
BmgGemmBF16BF16FP32_RCR_GemmExhaustive_32x256x64_SG2x8_ST1,RCR,GemmExhaustive,32,256,64,2,8,1,92.5,OK,5,batch_0244_gpu5
BmgGemmBF16BF16FP32_RCR_GemmExhaustive_64x256x32_SG4x8_ST1,RCR,GemmExhaustive,64,256,32,4,8,1,92.2,OK,6,batch_0355_gpu6
BmgGemmBF16BF16FP32_RRR_Gemm_32x64x32_SG2x4,RRR,Gemm,32,64,32,2,4,2,92.1,OK,6,batch_0533_gpu6
BmgGemmBF16BF16FP32_RCR_GemmExhaustive_128x64x16_SG4x4_ST1,RCR,GemmExhaustive,128,64,16,4,4,1,91.9,OK,5,unknown
BmgGemmBF16BF16FP32_RCR_GemmExhaustive_64x512x16_SG4x8_ST1,RCR,GemmExhaustive,64,512,16,4,8,1,91.7,OK,5,batch_0378_gpu5
BmgGemmBF16BF16FP32_RCR_GemmExhaustive_64x512x16_SG4x8_ST3,RCR,GemmExhaustive,64,512,16,4,8,3,91.2,OK,6,batch_0379_gpu6
BmgGemmBF16BF16FP32_RCR_GemmExhaustive_64x512x64_SG4x8_ST2,RCR,GemmExhaustive,64,512,64,4,8,2,91.1,OK,5,batch_0396_gpu5
BmgGemmBF16BF16FP32_RRR_Gemm_32x512x32_SG1x8,RRR,Gemm,32,512,32,1,8,2,91.0,OK,6,batch_0531_gpu6
BmgGemmBF16BF16FP32_RCR_GemmExhaustive_32x256x32_SG2x8_ST1,RCR,GemmExhaustive,32,256,32,2,8,1,91.0,OK,5,batch_0240_gpu5
BmgGemmBF16BF16FP32_RCR_GemmExhaustive_64x128x16_SG2x8_ST1,RCR,GemmExhaustive,64,128,16,2,8,1,90.8,OK,6,batch_0303_gpu6
BmgGemmBF16BF16FP32_RCR_StreamK_128x192x16,RCR,StreamK,128,192,16,,,2,90.7,OK,5,unknown
BmgGemmBF16BF16FP32_RCR_GemmExhaustive_512x64x16_SG8x2_ST2,RCR,GemmExhaustive,512,64,16,8,2,2,90.5,OK,6,batch_0291_gpu6
BmgGemmBF16BF16FP32_RCR_GemmExhaustive_64x192x64_SG4x4_ST3,RCR,GemmExhaustive,64,192,64,4,4,3,90.4,OK,5,batch_0340_gpu5
BmgGemmBF16BF16FP32_RCR_GemmExhaustive_64x64x64_SG4x4_ST3,RCR,GemmExhaustive,64,64,64,4,4,3,90.2,OK,5,batch_0412_gpu5
BmgGemmBF16BF16FP32_RCR_GemmExhaustive_64x256x16_SG4x8_ST3,RCR,GemmExhaustive,64,256,16,4,8,3,90.1,OK,6,batch_0347_gpu6
BmgGemmBF16BF16FP32_RCR_GemmExhaustive_256x96x32_SG8x2_ST2,RCR,GemmExhaustive,256,96,32,8,2,2,89.9,OK,6,batch_0215_gpu6
BmgGemmBF16BF16FP32_RCR_GemmExhaustive_64x64x64_SG4x4_ST2,RCR,GemmExhaustive,64,64,64,4,4,2,89.2,OK,6,batch_0411_gpu6
BmgGemmBF16BF16FP32_RCR_GemmExhaustive_256x96x16_SG8x2_ST3,RCR,GemmExhaustive,256,96,16,8,2,3,88.9,OK,5,batch_0214_gpu5
BmgGemmBF16BF16FP32_RCR_GemmExhaustive_128x128x16_SG8x4_ST3,RCR,GemmExhaustive,128,128,16,8,4,3,88.9,OK,6,unknown
BmgGemmBF16BF16FP32_RRR_Gemm_32x64x32_SG1x4,RRR,Gemm,32,64,32,1,4,2,88.0,OK,6,batch_0533_gpu6
BmgGemmBF16BF16FP32_RCR_GemmExhaustive_256x192x64_SG8x4_ST2,RCR,GemmExhaustive,256,192,64,8,4,2,87.9,OK,5,batch_0176_gpu5
BmgGemmBF16BF16FP32_RCR_GemmExhaustive_64x512x64_SG4x8_ST3,RCR,GemmExhaustive,64,512,64,4,8,3,87.9,OK,6,batch_0397_gpu6
BmgGemmBF16BF16FP32_RCR_Gemm_256x192x64_SG8x4,RCR,Gemm,256,192,64,8,4,2,87.8,OK,6,batch_0437_gpu6
BmgGemmBF16BF16FP32_RCR_GemmExhaustive_128x128x16_SG8x4_ST2,RCR,GemmExhaustive,128,128,16,8,4,2,87.6,OK,6,unknown
BmgGemmBF16BF16FP32_RCR_StreamK_128x128x16,RCR,StreamK,128,128,16,,,2,87.5,OK,5,unknown
BmgGemmBF16BF16FP32_RCR_GemmExhaustive_256x96x16_SG8x2_ST2,RCR,GemmExhaustive,256,96,16,8,2,2,87.4,OK,6,batch_0213_gpu6
BmgGemmBF16BF16FP32_RCR_Gemm_32x64x32_SG1x4,RCR,Gemm,32,64,32,1,4,2,87.3,OK,5,batch_0446_gpu5
BmgGemmBF16BF16FP32_RCR_GemmExhaustive_256x96x32_SG8x2_ST1,RCR,GemmExhaustive,256,96,32,8,2,1,87.3,OK,5,batch_0214_gpu5
BmgGemmBF16BF16FP32_RCR_GemmExhaustive_64x256x64_SG4x4_ST3,RCR,GemmExhaustive,64,256,64,4,4,3,87.3,OK,5,batch_0364_gpu5
BmgGemmBF16BF16FP32_RCR_GemmExhaustive_32x256x32_SG2x8_ST2,RCR,GemmExhaustive,32,256,32,2,8,2,87.1,OK,5,batch_0240_gpu5
BmgGemmBF16BF16FP32_RCR_GemmExhaustive_128x64x16_SG8x2_ST1,RCR,GemmExhaustive,128,64,16,8,2,1,87.0,OK,6,batch_0115_gpu6
BmgGemmBF16BF16FP32_RCR_GemmExhaustive_128x64x64_SG8x4_ST3,RCR,GemmExhaustive,128,64,64,8,4,3,87.0,OK,6,batch_0127_gpu6
BmgGemmBF16BF16FP32_RCR_Gemm_128x64x64_SG8x4,RCR,Gemm,128,64,64,8,4,2,86.9,OK,5,batch_0432_gpu5
BmgGemmBF16BF16FP32_RCR_GemmExhaustive_128x64x64_SG8x4_ST2,RCR,GemmExhaustive,128,64,64,8,4,2,86.9,OK,5,batch_0126_gpu5
BmgGemmBF16BF16FP32_RCR_GemmExhaustive_64x128x16_SG4x4_ST1,RCR,GemmExhaustive,64,128,16,4,4,1,86.9,OK,5,batch_0304_gpu5
BmgGemmBF16BF16FP32_RCR_GemmExhaustive_64x256x16_SG4x8_ST2,RCR,GemmExhaustive,64,256,16,4,8,2,86.8,OK,6,batch_0347_gpu6
BmgGemmBF16BF16FP32_RCR_GemmExhaustive_256x96x16_SG8x2_ST1,RCR,GemmExhaustive,256,96,16,8,2,1,86.7,OK,6,batch_0213_gpu6
BmgGemmBF16BF16FP32_RCR_GemmExhaustive_128x192x64_SG4x4_ST1,RCR,GemmExhaustive,128,192,64,4,4,1,86.5,OK,5,unknown
BmgGemmBF16BF16FP32_RCR_GemmExhaustive_64x512x16_SG2x8_ST3,RCR,GemmExhaustive,64,512,16,2,8,3,86.4,OK,5,batch_0376_gpu5
BmgGemmBF16BF16FP32_RRR_Gemm_128x64x32_SG8x4,RRR,Gemm,128,64,32,8,4,2,85.9,OK,6,batch_0519_gpu6
BmgGemmBF16BF16FP32_RCR_GemmExhaustive_256x64x64_SG8x2_ST3,RCR,GemmExhaustive,256,64,64,8,2,3,85.6,OK,6,batch_0211_gpu6
BmgGemmBF16BF16FP32_RCR_GemmExhaustive_256x192x64_SG8x4_ST3,RCR,GemmExhaustive,256,192,64,8,4,3,85.3,OK,5,batch_0176_gpu5
BmgGemmBF16BF16FP32_RCR_GemmExhaustive_128x128x16_SG4x8_ST1,RCR,GemmExhaustive,128,128,16,4,8,1,85.0,OK,6,unknown
BmgGemmBF16BF16FP32_RCR_GemmExhaustive_256x64x64_SG4x4_ST3,RCR,GemmExhaustive,256,64,64,4,4,3,84.8,OK,6,batch_0209_gpu6
BmgGemmBF16BF16FP32_RCR_GemmExhaustive_32x128x64_SG2x8_ST2,RCR,GemmExhaustive,32,128,64,2,8,2,83.8,OK,6,batch_0227_gpu6
BmgGemmBF16BF16FP32_RCR_GemmExhaustive_256x64x64_SG8x2_ST2,RCR,GemmExhaustive,256,64,64,8,2,2,83.6,OK,5,batch_0210_gpu5
BmgGemmBF16BF16FP32_RCR_GemmExhaustive_512x64x16_SG8x2_ST3,RCR,GemmExhaustive,512,64,16,8,2,3,83.4,OK,5,batch_0292_gpu5
BmgGemmBF16BF16FP32_RCR_GemmExhaustive_256x64x64_SG4x4_ST2,RCR,GemmExhaustive,256,64,64,4,4,2,83.3,OK,6,batch_0209_gpu6
BmgGemmBF16BF16FP32_RCR_GemmExhaustive_64x128x64_SG4x8_ST3,RCR,GemmExhaustive,64,128,64,4,8,3,83.1,OK,6,batch_0325_gpu6
BmgGemmBF16BF16FP32_RCR_GemmExhaustive_64x128x64_SG4x8_ST2,RCR,GemmExhaustive,64,128,64,4,8,2,83.0,OK,5,batch_0324_gpu5
BmgGemmBF16BF16FP32_RRR_Gemm_64x128x32_SG4x8,RRR,Gemm,64,128,32,4,8,2,82.9,OK,6,batch_0539_gpu6
BmgGemmBF16BF16FP32_RCR_GemmExhaustive_32x256x16_SG2x8_ST1,RCR,GemmExhaustive,32,256,16,2,8,1,82.4,OK,6,batch_0235_gpu6
BmgGemmBF16BF16FP32_RCR_GemmExhaustive_512x64x64_SG8x4_ST3,RCR,GemmExhaustive,512,64,64,8,4,3,81.8,OK,5,batch_0302_gpu5
BmgGemmBF16BF16FP32_RCR_GemmExhaustive_32x256x16_SG2x8_ST2,RCR,GemmExhaustive,32,256,16,2,8,2,81.4,OK,5,batch_0236_gpu5
BmgGemmBF16BF16FP32_RCR_GemmExhaustive_256x64x32_SG8x2_ST3,RCR,GemmExhaustive,256,64,32,8,2,3,81.3,OK,5,batch_0206_gpu5
BmgGemmBF16BF16FP32_RCR_GemmExhaustive_256x64x32_SG4x4_ST3,RCR,GemmExhaustive,256,64,32,4,4,3,81.2,OK,6,batch_0205_gpu6
BmgGemmBF16BF16FP32_RCR_GemmExhaustive_64x64x32_SG4x4_ST3,RCR,GemmExhaustive,64,64,32,4,4,3,80.9,OK,6,batch_0407_gpu6
BmgGemmBF16BF16FP32_RCR_GemmExhaustive_128x64x64_SG8x4_ST1,RCR,GemmExhaustive,128,64,64,8,4,1,80.8,OK,5,batch_0126_gpu5
BmgGemmBF16BF16FP32_RRR_Gemm_128x256x32_SG8x2,RRR,Gemm,128,256,32,8,2,2,80.8,OK,5,batch_0514_gpu5
BmgGemmBF16BF16FP32_RRR_Gemm_64x128x32_SG8x4,RRR,Gemm,64,128,32,8,4,2,80.8,OK,5,batch_0540_gpu5
BmgGemmBF16BF16FP32_RCR_Gemm_32x64x32_SG2x4,RCR,Gemm,32,64,32,2,4,2,80.4,OK,5,batch_0446_gpu5
BmgGemmBF16BF16FP32_RCR_GemmExhaustive_64x64x32_SG4x4_ST2,RCR,GemmExhaustive,64,64,32,4,4,2,80.2,OK,6,batch_0407_gpu6
BmgGemmBF16BF16FP32_RCR_GemmExhaustive_32x256x32_SG2x8_ST3,RCR,GemmExhaustive,32,256,32,2,8,3,80.2,OK,6,batch_0241_gpu6
BmgGemmBF16BF16FP32_RCR_StreamK_256x192x64,RCR,StreamK,256,192,64,,,2,80.0,OK,5,unknown
BmgGemmBF16BF16FP32_RCR_GemmExhaustive_64x64x64_SG4x4_ST1,RCR,GemmExhaustive,64,64,64,4,4,1,80.0,OK,6,batch_0411_gpu6
BmgGemmBF16BF16FP32_RCR_GemmExhaustive_128x128x16_SG8x4_ST1,RCR,GemmExhaustive,128,128,16,8,4,1,80.0,OK,5,unknown
BmgGemmBF16BF16FP32_RCR_Gemm_512x64x64_SG8x4,RCR,Gemm,512,64,64,8,4,2,79.6,OK,5,batch_0450_gpu5
BmgGemmBF16BF16FP32_RCR_GemmExhaustive_512x64x64_SG8x4_ST2,RCR,GemmExhaustive,512,64,64,8,4,2,79.6,OK,5,batch_0302_gpu5
BmgGemmBF16BF16FP32_RCR_GemmExhaustive_256x96x64_SG8x2_ST1,RCR,GemmExhaustive,256,96,64,8,2,1,79.4,OK,5,batch_0216_gpu5
BmgGemmBF16BF16FP32_RCR_GemmExhaustive_128x64x32_SG8x4_ST2,RCR,GemmExhaustive,128,64,32,8,4,2,79.4,OK,5,batch_0122_gpu5
BmgGemmBF16BF16FP32_RCR_Gemm_128x64x32_SG8x4,RCR,Gemm,128,64,32,8,4,2,79.3,OK,5,batch_0432_gpu5
BmgGemmBF16BF16FP32_RCR_GemmExhaustive_64x256x16_SG4x8_ST1,RCR,GemmExhaustive,64,256,16,4,8,1,79.1,OK,5,batch_0346_gpu5
BmgGemmBF16BF16FP32_RCR_GemmExhaustive_128x192x64_SG4x4_ST3,RCR,GemmExhaustive,128,192,64,4,4,3,78.9,OK,6,unknown
BmgGemmBF16BF16FP32_RCR_GemmExhaustive_128x64x32_SG8x4_ST3,RCR,GemmExhaustive,128,64,32,8,4,3,78.7,OK,5,batch_0122_gpu5
BmgGemmBF16BF16FP32_RCR_GemmExhaustive_32x256x64_SG2x8_ST2,RCR,GemmExhaustive,32,256,64,2,8,2,78.6,OK,6,batch_0245_gpu6
BmgGemmBF16BF16FP32_RCR_GemmExhaustive_32x256x16_SG2x8_ST3,RCR,GemmExhaustive,32,256,16,2,8,3,78.5,OK,5,batch_0236_gpu5
BmgGemmBF16BF16FP32_RCR_GemmExhaustive_512x64x32_SG8x4_ST3,RCR,GemmExhaustive,512,64,32,8,4,3,78.4,OK,5,batch_0298_gpu5
BmgGemmBF16BF16FP32_RCR_GemmExhaustive_128x192x64_SG4x4_ST2,RCR,GemmExhaustive,128,192,64,4,4,2,78.1,OK,6,unknown
BmgGemmBF16BF16FP32_RCR_GemmExhaustive_32x128x32_SG2x8_ST3,RCR,GemmExhaustive,32,128,32,2,8,3,78.0,OK,6,batch_0223_gpu6
BmgGemmBF16BF16FP32_RCR_GemmExhaustive_256x64x64_SG4x4_ST1,RCR,GemmExhaustive,256,64,64,4,4,1,78.0,OK,5,batch_0208_gpu5
BmgGemmBF16BF16FP32_RCR_GemmExhaustive_256x64x32_SG8x2_ST2,RCR,GemmExhaustive,256,64,32,8,2,2,77.9,OK,5,batch_0206_gpu5
BmgGemmBF16BF16FP32_RCR_Gemm_256x64x32_SG8x2,RCR,Gemm,256,64,32,8,2,2,77.9,OK,5,batch_0442_gpu5
BmgGemmBF16BF16FP32_RRR_Gemm_128x512x32_SG8x4,RRR,Gemm,128,512,32,8,4,2,77.8,OK,5,batch_0516_gpu5
BmgGemmBF16BF16FP32_RCR_Gemm_256x64x32_SG4x4,RCR,Gemm,256,64,32,4,4,2,77.6,OK,5,batch_0442_gpu5
BmgGemmBF16BF16FP32_RCR_GemmExhaustive_256x64x32_SG4x4_ST2,RCR,GemmExhaustive,256,64,32,4,4,2,77.6,OK,5,batch_0204_gpu5
BmgGemmBF16BF16FP32_RCR_GemmExhaustive_256x64x64_SG8x2_ST1,RCR,GemmExhaustive,256,64,64,8,2,1,77.5,OK,5,batch_0210_gpu5
BmgGemmBF16BF16FP32_RCR_GemmExhaustive_512x64x64_SG8x4_ST1,RCR,GemmExhaustive,512,64,64,8,4,1,77.4,OK,6,batch_0301_gpu6
BmgGemmBF16BF16FP32_RCR_GemmExhaustive_256x64x16_SG8x2_ST3,RCR,GemmExhaustive,256,64,16,8,2,3,77.3,OK,5,batch_0202_gpu5
BmgGemmBF16BF16FP32_RCR_GemmExhaustive_32x128x64_SG2x8_ST1,RCR,GemmExhaustive,32,128,64,2,8,1,76.7,OK,5,batch_0226_gpu5
BmgGemmBF16BF16FP32_RCR_GemmExhaustive_512x64x16_SG4x4_ST1,RCR,GemmExhaustive,512,64,16,4,4,1,76.7,OK,6,batch_0289_gpu6
BmgGemmBF16BF16FP32_RCR_GemmExhaustive_256x64x16_SG4x4_ST3,RCR,GemmExhaustive,256,64,16,4,4,3,76.6,OK,5,batch_0200_gpu5
BmgGemmBF16BF16FP32_RCR_GemmExhaustive_32x128x32_SG2x8_ST2,RCR,GemmExhaustive,32,128,32,2,8,2,76.3,OK,5,batch_0222_gpu5
BmgGemmBF16BF16FP32_RCR_GemmExhaustive_256x64x16_SG8x2_ST2,RCR,GemmExhaustive,256,64,16,8,2,2,76.0,OK,6,batch_0201_gpu6
BmgGemmBF16BF16FP32_RCR_GemmExhaustive_256x64x32_SG8x2_ST1,RCR,GemmExhaustive,256,64,32,8,2,1,75.7,OK,6,batch_0205_gpu6
BmgGemmBF16BF16FP32_RCR_GemmExhaustive_512x32x32_SG8x2_ST2,RCR,GemmExhaustive,512,32,32,8,2,2,75.7,OK,6,batch_0287_gpu6
BmgGemmBF16BF16FP32_RCR_GemmExhaustive_512x32x64_SG8x2_ST1,RCR,GemmExhaustive,512,32,64,8,2,1,75.6,OK,5,batch_0288_gpu5
BmgGemmBF16BF16FP32_RCR_GemmExhaustive_256x64x32_SG4x4_ST1,RCR,GemmExhaustive,256,64,32,4,4,1,75.6,OK,5,batch_0204_gpu5
BmgGemmBF16BF16FP32_RCR_GemmExhaustive_256x64x16_SG4x4_ST2,RCR,GemmExhaustive,256,64,16,4,4,2,75.3,OK,5,batch_0200_gpu5
BmgGemmBF16BF16FP32_RCR_GemmExhaustive_512x64x32_SG8x4_ST2,RCR,GemmExhaustive,512,64,32,8,4,2,75.3,OK,6,batch_0297_gpu6
BmgGemmBF16BF16FP32_RCR_Gemm_512x64x32_SG8x4,RCR,Gemm,512,64,32,8,4,2,75.2,OK,6,batch_0449_gpu6
BmgGemmBF16BF16FP32_RCR_GemmExhaustive_512x64x16_SG8x4_ST3,RCR,GemmExhaustive,512,64,16,8,4,3,74.9,OK,6,batch_0293_gpu6
BmgGemmBF16BF16FP32_RCR_GemmExhaustive_512x32x32_SG8x2_ST1,RCR,GemmExhaustive,512,32,32,8,2,1,74.7,OK,5,batch_0286_gpu5
BmgGemmBF16BF16FP32_RCR_GemmExhaustive_256x64x16_SG8x2_ST1,RCR,GemmExhaustive,256,64,16,8,2,1,74.6,OK,6,batch_0201_gpu6
BmgGemmBF16BF16FP32_RCR_GemmExhaustive_128x64x32_SG8x4_ST1,RCR,GemmExhaustive,128,64,32,8,4,1,74.2,OK,6,batch_0121_gpu6
BmgGemmBF16BF16FP32_RCR_GemmExhaustive_256x64x16_SG4x4_ST1,RCR,GemmExhaustive,256,64,16,4,4,1,74.2,OK,6,batch_0199_gpu6
BmgGemmBF16BF16FP32_RCR_GemmExhaustive_64x128x32_SG4x8_ST3,RCR,GemmExhaustive,64,128,32,4,8,3,73.9,OK,5,batch_0316_gpu5
BmgGemmBF16BF16FP32_RCR_GemmExhaustive_64x128x32_SG4x8_ST2,RCR,GemmExhaustive,64,128,32,4,8,2,73.7,OK,6,batch_0315_gpu6
BmgGemmBF16BF16FP32_RCR_Gemm_64x128x32_SG4x8,RCR,Gemm,64,128,32,4,8,2,73.7,OK,5,batch_0452_gpu5
BmgGemmBF16BF16FP32_RCR_GemmExhaustive_256x96x64_SG8x2_ST2,RCR,GemmExhaustive,256,96,64,8,2,2,73.2,OK,5,batch_0216_gpu5
BmgGemmBF16BF16FP32_RCR_GemmExhaustive_64x128x64_SG4x8_ST1,RCR,GemmExhaustive,64,128,64,4,8,1,73.2,OK,5,batch_0324_gpu5
BmgGemmBF16BF16FP32_RCR_GemmExhaustive_32x128x64_SG2x8_ST3,RCR,GemmExhaustive,32,128,64,2,8,3,73.1,OK,6,batch_0227_gpu6
BmgGemmBF16BF16FP32_RCR_GemmExhaustive_512x64x16_SG8x4_ST2,RCR,GemmExhaustive,512,64,16,8,4,2,73.1,OK,6,batch_0293_gpu6
BmgGemmBF16BF16FP32_RRR_Gemm_256x64x32_SG8x2,RRR,Gemm,256,64,32,8,2,2,73.0,OK,6,batch_0529_gpu6
BmgGemmBF16BF16FP32_RCR_GemmExhaustive_64x128x64_SG8x2_ST1,RCR,GemmExhaustive,64,128,64,8,2,1,72.7,OK,6,batch_0325_gpu6
BmgGemmBF16BF16FP32_RCR_GemmExhaustive_512x64x32_SG8x4_ST1,RCR,GemmExhaustive,512,64,32,8,4,1,72.5,OK,6,batch_0297_gpu6
BmgGemmBF16BF16FP32_RCR_GemmExhaustive_256x96x64_SG8x2_ST3,RCR,GemmExhaustive,256,96,64,8,2,3,72.2,OK,6,batch_0217_gpu6
BmgGemmBF16BF16FP32_RRR_Gemm_256x64x32_SG4x4,RRR,Gemm,256,64,32,4,4,2,72.0,OK,6,batch_0529_gpu6
BmgGemmBF16BF16FP32_RCR_Gemm_64x128x32_SG8x2,RCR,Gemm,64,128,32,8,2,2,72.0,OK,6,batch_0453_gpu6
BmgGemmBF16BF16FP32_RCR_GemmExhaustive_512x32x32_SG8x2_ST3,RCR,GemmExhaustive,512,32,32,8,2,3,72.0,OK,6,batch_0287_gpu6
BmgGemmBF16BF16FP32_RCR_GemmExhaustive_64x128x32_SG8x2_ST2,RCR,GemmExhaustive,64,128,32,8,2,2,72.0,OK,6,batch_0317_gpu6
BmgGemmBF16BF16FP32_RCR_GemmExhaustive_64x128x64_SG8x2_ST2,RCR,GemmExhaustive,64,128,64,8,2,2,71.9,OK,5,batch_0326_gpu5
BmgGemmBF16BF16FP32_RCR_GemmExhaustive_64x96x64_SG8x2_ST2,RCR,GemmExhaustive,64,96,64,8,2,2,71.7,OK,6,batch_0419_gpu6
BmgGemmBF16BF16FP32_RCR_GemmExhaustive_64x128x32_SG8x2_ST3,RCR,GemmExhaustive,64,128,32,8,2,3,71.5,OK,6,batch_0317_gpu6
BmgGemmBF16BF16FP32_RCR_GemmExhaustive_64x128x32_SG8x2_ST1,RCR,GemmExhaustive,64,128,32,8,2,1,71.5,OK,5,batch_0316_gpu5
BmgGemmBF16BF16FP32_RRR_Gemm_512x64x64_SG8x4,RRR,Gemm,512,64,64,8,4,2,71.5,OK,6,batch_0537_gpu6
BmgGemmBF16BF16FP32_RCR_GemmExhaustive_64x64x64_SG8x2_ST2,RCR,GemmExhaustive,64,64,64,8,2,2,71.5,OK,6,batch_0413_gpu6
BmgGemmBF16BF16FP32_RCR_GemmExhaustive_512x64x16_SG8x4_ST1,RCR,GemmExhaustive,512,64,16,8,4,1,71.4,OK,5,batch_0292_gpu5
BmgGemmBF16BF16FP32_RCR_GemmExhaustive_64x96x64_SG8x2_ST1,RCR,GemmExhaustive,64,96,64,8,2,1,71.1,OK,5,batch_0418_gpu5
BmgGemmBF16BF16FP32_RCR_GemmExhaustive_32x256x64_SG2x8_ST3,RCR,GemmExhaustive,32,256,64,2,8,3,70.7,OK,6,batch_0245_gpu6
BmgGemmBF16BF16FP32_RCR_GemmExhaustive_64x96x32_SG8x2_ST2,RCR,GemmExhaustive,64,96,32,8,2,2,70.6,OK,6,batch_0417_gpu6
BmgGemmBF16BF16FP32_RCR_GemmExhaustive_64x256x32_SG8x2_ST1,RCR,GemmExhaustive,64,256,32,8,2,1,70.3,OK,6,batch_0357_gpu6
BmgGemmBF16BF16FP32_RCR_GemmExhaustive_64x64x64_SG8x2_ST3,RCR,GemmExhaustive,64,64,64,8,2,3,70.0,OK,6,batch_0413_gpu6
BmgGemmBF16BF16FP32_RCR_GemmExhaustive_64x96x64_SG8x2_ST3,RCR,GemmExhaustive,64,96,64,8,2,3,69.9,OK,6,batch_0419_gpu6
BmgGemmBF16BF16FP32_RCR_GemmExhaustive_64x96x32_SG8x2_ST3,RCR,GemmExhaustive,64,96,32,8,2,3,69.8,OK,5,batch_0418_gpu5
BmgGemmBF16BF16FP32_RCR_GemmExhaustive_512x64x16_SG4x4_ST2,RCR,GemmExhaustive,512,64,16,4,4,2,69.8,OK,5,batch_0290_gpu5
BmgGemmBF16BF16FP32_RCR_Gemm_32x512x32_SG1x8,RCR,Gemm,32,512,32,1,8,2,69.6,OK,5,batch_0444_gpu5
BmgGemmBF16BF16FP32_RCR_GemmExhaustive_64x256x32_SG8x2_ST2,RCR,GemmExhaustive,64,256,32,8,2,2,69.4,OK,6,batch_0357_gpu6
BmgGemmBF16BF16FP32_RRR_Gemm_64x64x64_SG8x4,RRR,Gemm,64,64,64,8,4,2,69.1,OK,6,batch_0543_gpu6
BmgGemmBF16BF16FP32_RCR_GemmExhaustive_64x128x64_SG8x2_ST3,RCR,GemmExhaustive,64,128,64,8,2,3,68.9,OK,5,batch_0326_gpu5
BmgGemmBF16BF16FP32_RCR_GemmExhaustive_32x128x16_SG2x8_ST3,RCR,GemmExhaustive,32,128,16,2,8,3,68.7,OK,5,batch_0218_gpu5
BmgGemmBF16BF16FP32_RCR_GemmExhaustive_64x64x32_SG4x4_ST1,RCR,GemmExhaustive,64,64,32,4,4,1,68.6,OK,5,batch_0406_gpu5
BmgGemmBF16BF16FP32_RCR_GemmExhaustive_64x64x64_SG8x2_ST1,RCR,GemmExhaustive,64,64,64,8,2,1,68.4,OK,5,batch_0412_gpu5
BmgGemmBF16BF16FP32_RCR_GemmExhaustive_64x512x16_SG4x4_ST1,RCR,GemmExhaustive,64,512,16,4,4,1,68.2,OK,5,batch_0376_gpu5
BmgGemmBF16BF16FP32_RCR_GemmExhaustive_64x96x32_SG8x2_ST1,RCR,GemmExhaustive,64,96,32,8,2,1,68.0,OK,6,batch_0417_gpu6
BmgGemmBF16BF16FP32_RCR_GemmExhaustive_64x192x32_SG8x2_ST1,RCR,GemmExhaustive,64,192,32,8,2,1,67.4,OK,5,batch_0336_gpu5
BmgGemmBF16BF16FP32_RCR_GemmExhaustive_64x64x16_SG4x4_ST3,RCR,GemmExhaustive,64,64,16,4,4,3,67.3,OK,6,batch_0403_gpu6
BmgGemmBF16BF16FP32_RCR_Gemm_64x256x32_SG8x4,RCR,Gemm,64,256,32,8,4,2,67.2,OK,5,batch_0454_gpu5
BmgGemmBF16BF16FP32_RCR_GemmExhaustive_64x256x32_SG8x4_ST2,RCR,GemmExhaustive,64,256,32,8,4,2,67.1,OK,6,batch_0359_gpu6
BmgGemmBF16BF16FP32_RCR_GemmExhaustive_64x128x16_SG8x2_ST1,RCR,GemmExhaustive,64,128,16,8,2,1,67.1,OK,6,batch_0307_gpu6
BmgGemmBF16BF16FP32_RCR_GemmExhaustive_64x192x32_SG8x2_ST2,RCR,GemmExhaustive,64,192,32,8,2,2,67.1,OK,5,batch_0336_gpu5
BmgGemmBF16BF16FP32_RCR_GemmExhaustive_64x256x32_SG8x4_ST3,RCR,GemmExhaustive,64,256,32,8,4,3,67.1,OK,6,batch_0359_gpu6
BmgGemmBF16BF16FP32_RCR_GemmExhaustive_32x128x64_SG4x4_ST2,RCR,GemmExhaustive,32,128,64,4,4,2,67.0,OK,5,batch_0228_gpu5
BmgGemmBF16BF16FP32_RCR_GemmExhaustive_32x128x32_SG2x8_ST1,RCR,GemmExhaustive,32,128,32,2,8,1,66.9,OK,5,batch_0222_gpu5
BmgGemmBF16BF16FP32_RCR_GemmExhaustive_512x32x64_SG8x2_ST2,RCR,GemmExhaustive,512,32,64,8,2,2,66.8,OK,5,batch_0288_gpu5
BmgGemmBF16BF16FP32_RCR_GemmExhaustive_64x256x32_SG8x2_ST3,RCR,GemmExhaustive,64,256,32,8,2,3,66.7,OK,5,batch_0358_gpu5
BmgGemmBF16BF16FP32_RCR_GemmExhaustive_64x256x64_SG8x4_ST3,RCR,GemmExhaustive,64,256,64,8,4,3,66.6,OK,5,batch_0368_gpu5
BmgGemmBF16BF16FP32_RCR_GemmExhaustive_64x256x32_SG8x4_ST1,RCR,GemmExhaustive,64,256,32,8,4,1,66.5,OK,5,batch_0358_gpu5
BmgGemmBF16BF16FP32_RCR_GemmExhaustive_64x192x32_SG8x2_ST3,RCR,GemmExhaustive,64,192,32,8,2,3,66.4,OK,6,batch_0337_gpu6
BmgGemmBF16BF16FP32_RCR_GemmExhaustive_64x256x16_SG8x2_ST1,RCR,GemmExhaustive,64,256,16,8,2,1,66.4,OK,5,batch_0348_gpu5
BmgGemmBF16BF16FP32_RCR_GemmExhaustive_32x256x32_SG4x4_ST1,RCR,GemmExhaustive,32,256,32,4,4,1,66.2,OK,6,batch_0241_gpu6
BmgGemmBF16BF16FP32_RCR_GemmExhaustive_32x512x32_SG2x8_ST1,RCR,GemmExhaustive,32,512,32,2,8,1,66.2,OK,6,batch_0253_gpu6
BmgGemmBF16BF16FP32_RCR_GemmExhaustive_64x256x16_SG8x2_ST2,RCR,GemmExhaustive,64,256,16,8,2,2,66.1,OK,5,batch_0348_gpu5
BmgGemmBF16BF16FP32_RCR_GemmExhaustive_64x256x64_SG8x4_ST1,RCR,GemmExhaustive,64,256,64,8,4,1,65.9,OK,6,batch_0367_gpu6
BmgGemmBF16BF16FP32_RCR_GemmExhaustive_64x64x32_SG8x2_ST3,RCR,GemmExhaustive,64,64,32,8,2,3,65.9,OK,6,batch_0409_gpu6
BmgGemmBF16BF16FP32_RCR_GemmExhaustive_128x64x16_SG8x4_ST3,RCR,GemmExhaustive,128,64,16,8,4,3,65.8,OK,5,batch_0118_gpu5
BmgGemmBF16BF16FP32_RRR_Gemm_128x128x32_SG4x4,RRR,Gemm,128,128,32,4,4,2,65.8,OK,5,batch_0508_gpu5
BmgGemmBF16BF16FP32_RCR_GemmExhaustive_512x64x16_SG4x4_ST3,RCR,GemmExhaustive,512,64,16,4,4,3,65.8,OK,5,batch_0290_gpu5
BmgGemmBF16BF16FP32_RCR_GemmExhaustive_32x128x64_SG4x4_ST1,RCR,GemmExhaustive,32,128,64,4,4,1,65.7,OK,5,batch_0228_gpu5
BmgGemmBF16BF16FP32_RCR_GemmExhaustive_64x128x16_SG8x2_ST3,RCR,GemmExhaustive,64,128,16,8,2,3,65.4,OK,5,batch_0308_gpu5
BmgGemmBF16BF16FP32_RCR_GemmExhaustive_64x128x16_SG8x2_ST2,RCR,GemmExhaustive,64,128,16,8,2,2,65.4,OK,5,batch_0308_gpu5
BmgGemmBF16BF16FP32_RCR_GemmExhaustive_512x32x64_SG8x2_ST3,RCR,GemmExhaustive,512,32,64,8,2,3,65.2,OK,6,batch_0289_gpu6
BmgGemmBF16BF16FP32_RCR_GemmExhaustive_64x64x32_SG8x2_ST2,RCR,GemmExhaustive,64,64,32,8,2,2,65.2,OK,5,batch_0408_gpu5
BmgGemmBF16BF16FP32_RCR_GemmExhaustive_64x128x32_SG4x8_ST1,RCR,GemmExhaustive,64,128,32,4,8,1,65.0,OK,6,batch_0315_gpu6
BmgGemmBF16BF16FP32_RCR_GemmExhaustive_64x512x16_SG4x4_ST2,RCR,GemmExhaustive,64,512,16,4,4,2,64.7,OK,6,batch_0377_gpu6
BmgGemmBF16BF16FP32_RCR_StreamK_128x64x16,RCR,StreamK,128,64,16,,,2,64.6,OK,5,unknown
BmgGemmBF16BF16FP32_RCR_Gemm_256x32x64_SG8x2,RCR,Gemm,256,32,64,8,2,2,64.6,OK,6,batch_0441_gpu6
BmgGemmBF16BF16FP32_RCR_GemmExhaustive_32x256x32_SG4x4_ST2,RCR,GemmExhaustive,32,256,32,4,4,2,64.5,OK,5,batch_0242_gpu5
BmgGemmBF16BF16FP32_RCR_GemmExhaustive_256x32x64_SG8x2_ST2,RCR,GemmExhaustive,256,32,64,8,2,2,64.4,OK,5,batch_0194_gpu5
BmgGemmBF16BF16FP32_RCR_GemmExhaustive_128x64x16_SG8x4_ST2,RCR,GemmExhaustive,128,64,16,8,4,2,64.4,OK,6,batch_0117_gpu6
BmgGemmBF16BF16FP32_RCR_GemmExhaustive_64x128x16_SG4x8_ST3,RCR,GemmExhaustive,64,128,16,4,8,3,64.4,OK,6,batch_0307_gpu6
BmgGemmBF16BF16FP32_RCR_GemmExhaustive_64x256x16_SG8x2_ST3,RCR,GemmExhaustive,64,256,16,8,2,3,64.2,OK,6,batch_0349_gpu6
BmgGemmBF16BF16FP32_RCR_GemmExhaustive_64x192x16_SG8x2_ST1,RCR,GemmExhaustive,64,192,16,8,2,1,64.1,OK,6,batch_0331_gpu6
BmgGemmBF16BF16FP32_RCR_GemmExhaustive_64x256x64_SG8x4_ST2,RCR,GemmExhaustive,64,256,64,8,4,2,63.9,OK,5,batch_0368_gpu5
BmgGemmBF16BF16FP32_RCR_Gemm_64x256x64_SG8x4,RCR,Gemm,64,256,64,8,4,2,63.9,OK,6,batch_0455_gpu6
BmgGemmBF16BF16FP32_RCR_GemmExhaustive_32x192x32_SG4x4_ST2,RCR,GemmExhaustive,32,192,32,4,4,2,63.8,OK,6,batch_0233_gpu6
BmgGemmBF16BF16FP32_RCR_GemmExhaustive_32x192x64_SG4x4_ST1,RCR,GemmExhaustive,32,192,64,4,4,1,63.8,OK,5,batch_0234_gpu5
BmgGemmBF16BF16FP32_RCR_GemmExhaustive_32x128x32_SG4x4_ST2,RCR,GemmExhaustive,32,128,32,4,4,2,63.7,OK,5,batch_0224_gpu5
BmgGemmBF16BF16FP32_RCR_GemmExhaustive_64x128x64_SG8x4_ST2,RCR,GemmExhaustive,64,128,64,8,4,2,63.7,OK,6,batch_0327_gpu6
BmgGemmBF16BF16FP32_RCR_Gemm_64x128x64_SG8x4,RCR,Gemm,64,128,64,8,4,2,63.6,OK,5,batch_0454_gpu5
BmgGemmBF16BF16FP32_RCR_GemmExhaustive_64x192x16_SG8x2_ST2,RCR,GemmExhaustive,64,192,16,8,2,2,63.6,OK,5,batch_0332_gpu5
BmgGemmBF16BF16FP32_RCR_GemmExhaustive_64x192x16_SG8x2_ST3,RCR,GemmExhaustive,64,192,16,8,2,3,63.5,OK,5,batch_0332_gpu5
BmgGemmBF16BF16FP32_RCR_GemmExhaustive_32x128x16_SG2x8_ST2,RCR,GemmExhaustive,32,128,16,2,8,2,63.3,OK,5,batch_0218_gpu5
BmgGemmBF16BF16FP32_RCR_GemmExhaustive_256x32x32_SG8x2_ST3,RCR,GemmExhaustive,256,32,32,8,2,3,63.3,OK,6,batch_0193_gpu6
BmgGemmBF16BF16FP32_RCR_GemmExhaustive_32x256x64_SG4x4_ST1,RCR,GemmExhaustive,32,256,64,4,4,1,63.2,OK,5,batch_0246_gpu5
BmgGemmBF16BF16FP32_RRR_Gemm_512x64x32_SG8x4,RRR,Gemm,512,64,32,8,4,2,63.2,OK,5,batch_0536_gpu5
BmgGemmBF16BF16FP32_RCR_GemmExhaustive_64x96x16_SG8x2_ST2,RCR,GemmExhaustive,64,96,16,8,2,2,63.2,OK,5,batch_0416_gpu5
BmgGemmBF16BF16FP32_RCR_GemmExhaustive_64x512x32_SG8x4_ST1,RCR,GemmExhaustive,64,512,32,8,4,1,63.1,OK,5,batch_0390_gpu5
BmgGemmBF16BF16FP32_RCR_GemmExhaustive_64x64x16_SG4x4_ST2,RCR,GemmExhaustive,64,64,16,4,4,2,63.0,OK,5,batch_0402_gpu5
BmgGemmBF16BF16FP32_RRR_Gemm_128x128x32_SG4x8,RRR,Gemm,128,128,32,4,8,2,63.0,OK,5,batch_0508_gpu5
BmgGemmBF16BF16FP32_RCR_GemmExhaustive_64x96x16_SG8x2_ST3,RCR,GemmExhaustive,64,96,16,8,2,3,62.9,OK,5,batch_0416_gpu5
BmgGemmBF16BF16FP32_RCR_GemmExhaustive_64x128x64_SG8x4_ST3,RCR,GemmExhaustive,64,128,64,8,4,3,62.9,OK,5,batch_0328_gpu5
BmgGemmBF16BF16FP32_RCR_GemmExhaustive_64x512x32_SG8x4_ST2,RCR,GemmExhaustive,64,512,32,8,4,2,62.8,OK,5,batch_0390_gpu5
BmgGemmBF16BF16FP32_RCR_GemmExhaustive_32x128x32_SG4x4_ST3,RCR,GemmExhaustive,32,128,32,4,4,3,62.7,OK,5,batch_0224_gpu5
BmgGemmBF16BF16FP32_RCR_GemmExhaustive_64x96x16_SG8x2_ST1,RCR,GemmExhaustive,64,96,16,8,2,1,62.5,OK,6,batch_0415_gpu6
BmgGemmBF16BF16FP32_RCR_GemmExhaustive_64x512x16_SG4x4_ST3,RCR,GemmExhaustive,64,512,16,4,4,3,62.5,OK,6,batch_0377_gpu6
BmgGemmBF16BF16FP32_RCR_GemmExhaustive_512x32x16_SG8x2_ST1,RCR,GemmExhaustive,512,32,16,8,2,1,62.4,OK,6,batch_0285_gpu6
BmgGemmBF16BF16FP32_RCR_GemmExhaustive_256x64x64_SG8x4_ST3,RCR,GemmExhaustive,256,64,64,8,4,3,62.4,OK,5,batch_0212_gpu5
BmgGemmBF16BF16FP32_RCR_GemmExhaustive_32x256x64_SG4x8_ST2,RCR,GemmExhaustive,32,256,64,4,8,2,62.4,OK,5,batch_0248_gpu5
BmgGemmBF16BF16FP32_RCR_GemmExhaustive_32x192x32_SG4x4_ST1,RCR,GemmExhaustive,32,192,32,4,4,1,62.3,OK,5,batch_0232_gpu5
BmgGemmBF16BF16FP32_RCR_GemmExhaustive_32x512x32_SG2x8_ST2,RCR,GemmExhaustive,32,512,32,2,8,2,62.0,OK,5,batch_0254_gpu5
BmgGemmBF16BF16FP32_RRR_Gemm_128x128x32_SG8x4,RRR,Gemm,128,128,32,8,4,2,61.9,OK,6,batch_0509_gpu6
BmgGemmBF16BF16FP32_RCR_StreamK_64x256x16,RCR,StreamK,64,256,16,,,2,61.8,OK,5,unknown
BmgGemmBF16BF16FP32_RCR_GemmExhaustive_64x128x64_SG8x4_ST1,RCR,GemmExhaustive,64,128,64,8,4,1,61.7,OK,6,batch_0327_gpu6
BmgGemmBF16BF16FP32_RCR_GemmExhaustive_64x128x32_SG8x4_ST2,RCR,GemmExhaustive,64,128,32,8,4,2,61.5,OK,5,batch_0318_gpu5
BmgGemmBF16BF16FP32_RCR_GemmExhaustive_32x256x16_SG4x4_ST2,RCR,GemmExhaustive,32,256,16,4,4,2,61.5,OK,6,batch_0237_gpu6
BmgGemmBF16BF16FP32_RCR_Gemm_64x128x32_SG8x4,RCR,Gemm,64,128,32,8,4,2,61.5,OK,6,batch_0453_gpu6
BmgGemmBF16BF16FP32_RCR_GemmExhaustive_64x192x64_SG8x4_ST1,RCR,GemmExhaustive,64,192,64,8,4,1,61.3,OK,5,batch_0342_gpu5
BmgGemmBF16BF16FP32_RCR_GemmExhaustive_32x128x64_SG4x4_ST3,RCR,GemmExhaustive,32,128,64,4,4,3,61.2,OK,6,batch_0229_gpu6
BmgGemmBF16BF16FP32_RCR_GemmExhaustive_64x192x32_SG8x4_ST2,RCR,GemmExhaustive,64,192,32,8,4,2,61.2,OK,5,batch_0338_gpu5
BmgGemmBF16BF16FP32_RCR_GemmExhaustive_32x256x16_SG4x4_ST1,RCR,GemmExhaustive,32,256,16,4,4,1,61.2,OK,6,batch_0237_gpu6
BmgGemmBF16BF16FP32_RCR_GemmExhaustive_64x128x32_SG8x4_ST3,RCR,GemmExhaustive,64,128,32,8,4,3,61.1,OK,6,batch_0319_gpu6
BmgGemmBF16BF16FP32_RCR_GemmExhaustive_64x512x32_SG8x4_ST3,RCR,GemmExhaustive,64,512,32,8,4,3,61.1,OK,6,batch_0391_gpu6
BmgGemmBF16BF16FP32_RCR_GemmExhaustive_32x192x64_SG4x4_ST2,RCR,GemmExhaustive,32,192,64,4,4,2,61.0,OK,5,batch_0234_gpu5
BmgGemmBF16BF16FP32_RCR_GemmExhaustive_128x512x32_SG8x4_ST1,RCR,GemmExhaustive,128,512,32,8,4,1,60.9,OK,5,batch_0106_gpu5
BmgGemmBF16BF16FP32_RCR_GemmExhaustive_32x192x32_SG4x4_ST3,RCR,GemmExhaustive,32,192,32,4,4,3,60.9,OK,6,batch_0233_gpu6
BmgGemmBF16BF16FP32_RCR_GemmExhaustive_64x192x32_SG8x4_ST3,RCR,GemmExhaustive,64,192,32,8,4,3,60.8,OK,5,batch_0338_gpu5
BmgGemmBF16BF16FP32_RCR_GemmExhaustive_128x256x32_SG8x2_ST1,RCR,GemmExhaustive,128,256,32,8,2,1,60.7,OK,5,batch_0082_gpu5
BmgGemmBF16BF16FP32_RCR_GemmExhaustive_256x32x64_SG8x2_ST3,RCR,GemmExhaustive,256,32,64,8,2,3,60.6,OK,5,batch_0194_gpu5
BmgGemmBF16BF16FP32_RCR_GemmExhaustive_256x32x64_SG8x2_ST1,RCR,GemmExhaustive,256,32,64,8,2,1,60.6,OK,6,batch_0193_gpu6
BmgGemmBF16BF16FP32_RCR_GemmExhaustive_64x256x16_SG8x4_ST1,RCR,GemmExhaustive,64,256,16,8,4,1,60.3,OK,6,batch_0349_gpu6
BmgGemmBF16BF16FP32_RCR_GemmExhaustive_32x256x32_SG4x8_ST2,RCR,GemmExhaustive,32,256,32,4,8,2,60.2,OK,6,batch_0243_gpu6
BmgGemmBF16BF16FP32_RCR_DataParallel_64x512x32,RCR,DataParallel,64,512,32,,,2,60.2,OK,5,unknown
BmgGemmBF16BF16FP32_RCR_GemmExhaustive_32x256x32_SG4x8_ST3,RCR,GemmExhaustive,32,256,32,4,8,3,60.2,OK,5,batch_0244_gpu5
BmgGemmBF16BF16FP32_RCR_StreamK_64x512x32,RCR,StreamK,64,512,32,,,2,60.2,OK,5,unknown
BmgGemmBF16BF16FP32_RCR_GemmExhaustive_64x256x16_SG8x4_ST3,RCR,GemmExhaustive,64,256,16,8,4,3,60.2,OK,5,batch_0350_gpu5
BmgGemmBF16BF16FP32_RCR_GemmExhaustive_32x512x16_SG2x8_ST1,RCR,GemmExhaustive,32,512,16,2,8,1,60.0,OK,6,batch_0249_gpu6
BmgGemmBF16BF16FP32_RCR_GemmExhaustive_64x256x16_SG8x4_ST2,RCR,GemmExhaustive,64,256,16,8,4,2,60.0,OK,5,batch_0350_gpu5
BmgGemmBF16BF16FP32_RCR_GemmExhaustive_64x128x16_SG4x8_ST2,RCR,GemmExhaustive,64,128,16,4,8,2,59.9,OK,5,batch_0306_gpu5
BmgGemmBF16BF16FP32_RCR_GemmExhaustive_64x192x64_SG8x4_ST3,RCR,GemmExhaustive,64,192,64,8,4,3,59.6,OK,6,batch_0343_gpu6
BmgGemmBF16BF16FP32_RCR_GemmExhaustive_256x128x32_SG2x8_ST1,RCR,GemmExhaustive,256,128,32,2,8,1,59.5,OK,5,batch_0154_gpu5
BmgGemmBF16BF16FP32_RCR_GemmExhaustive_256x32x32_SG8x2_ST2,RCR,GemmExhaustive,256,32,32,8,2,2,59.5,OK,5,batch_0192_gpu5
BmgGemmBF16BF16FP32_RCR_Gemm_256x32x32_SG8x2,RCR,Gemm,256,32,32,8,2,2,59.4,OK,5,batch_0440_gpu5
BmgGemmBF16BF16FP32_RCR_GemmExhaustive_32x256x64_SG4x8_ST3,RCR,GemmExhaustive,32,256,64,4,8,3,59.3,OK,5,batch_0248_gpu5
BmgGemmBF16BF16FP32_RCR_GemmExhaustive_64x512x16_SG8x4_ST1,RCR,GemmExhaustive,64,512,16,8,4,1,59.2,OK,6,batch_0381_gpu6
BmgGemmBF16BF16FP32_RCR_GemmExhaustive_64x192x32_SG8x4_ST1,RCR,GemmExhaustive,64,192,32,8,4,1,59.1,OK,6,batch_0337_gpu6
BmgGemmBF16BF16FP32_RCR_GemmExhaustive_32x512x32_SG2x8_ST3,RCR,GemmExhaustive,32,512,32,2,8,3,59.1,OK,5,batch_0254_gpu5
BmgGemmBF16BF16FP32_RCR_GemmExhaustive_32x192x16_SG4x4_ST2,RCR,GemmExhaustive,32,192,16,4,4,2,59.1,OK,6,batch_0231_gpu6
BmgGemmBF16BF16FP32_RCR_GemmExhaustive_32x256x16_SG4x4_ST3,RCR,GemmExhaustive,32,256,16,4,4,3,59.0,OK,5,batch_0238_gpu5
BmgGemmBF16BF16FP32_RCR_GemmExhaustive_32x512x32_SG4x8_ST1,RCR,GemmExhaustive,32,512,32,4,8,1,59.0,OK,5,batch_0256_gpu5
BmgGemmBF16BF16FP32_RCR_GemmExhaustive_128x512x32_SG8x4_ST2,RCR,GemmExhaustive,128,512,32,8,4,2,58.9,OK,6,batch_0107_gpu6
BmgGemmBF16BF16FP32_RCR_Gemm_128x512x32_SG8x4,RCR,Gemm,128,512,32,8,4,2,58.9,OK,6,batch_0429_gpu6
BmgGemmBF16BF16FP32_RCR_GemmExhaustive_32x256x32_SG4x4_ST3,RCR,GemmExhaustive,32,256,32,4,4,3,58.7,OK,5,batch_0242_gpu5
BmgGemmBF16BF16FP32_RCR_GemmExhaustive_32x256x64_SG4x8_ST1,RCR,GemmExhaustive,32,256,64,4,8,1,58.7,OK,6,batch_0247_gpu6
BmgGemmBF16BF16FP32_RCR_GemmExhaustive_64x32x64_SG8x2_ST2,RCR,GemmExhaustive,64,32,64,8,2,2,58.6,OK,5,batch_0374_gpu5
BmgGemmBF16BF16FP32_RCR_GemmExhaustive_128x256x32_SG8x2_ST2,RCR,GemmExhaustive,128,256,32,8,2,2,58.5,OK,6,batch_0083_gpu6
BmgGemmBF16BF16FP32_RCR_GemmExhaustive_256x32x16_SG8x2_ST3,RCR,GemmExhaustive,256,32,16,8,2,3,58.5,OK,6,batch_0191_gpu6
BmgGemmBF16BF16FP32_RCR_Gemm_128x256x32_SG8x2,RCR,Gemm,128,256,32,8,2,2,58.5,OK,6,batch_0427_gpu6
BmgGemmBF16BF16FP32_RRR_Gemm_256x32x64_SG8x2,RRR,Gemm,256,32,64,8,2,2,58.5,OK,5,batch_0528_gpu5
BmgGemmBF16BF16FP32_RCR_GemmExhaustive_32x128x32_SG4x4_ST1,RCR,GemmExhaustive,32,128,32,4,4,1,58.4,OK,6,batch_0223_gpu6
BmgGemmBF16BF16FP32_RCR_GemmExhaustive_32x192x16_SG4x4_ST3,RCR,GemmExhaustive,32,192,16,4,4,3,58.3,OK,5,batch_0232_gpu5
BmgGemmBF16BF16FP32_RCR_GemmExhaustive_256x64x64_SG8x4_ST2,RCR,GemmExhaustive,256,64,64,8,4,2,58.3,OK,5,batch_0212_gpu5
BmgGemmBF16BF16FP32_RCR_GemmExhaustive_64x192x64_SG8x4_ST2,RCR,GemmExhaustive,64,192,64,8,4,2,58.3,OK,5,batch_0342_gpu5
BmgGemmBF16BF16FP32_RCR_Gemm_256x64x64_SG8x4,RCR,Gemm,256,64,64,8,4,2,58.3,OK,6,batch_0443_gpu6
BmgGemmBF16BF16FP32_RRR_Gemm_16x64x64_SG2x4,RRR,Gemm,16,64,64,2,4,2,58.3,OK,6,batch_0521_gpu6
BmgGemmBF16BF16FP32_RCR_StreamK_64x192x32,RCR,StreamK,64,192,32,,,2,58.1,OK,6,unknown
BmgGemmBF16BF16FP32_RCR_GemmExhaustive_64x512x16_SG8x4_ST2,RCR,GemmExhaustive,64,512,16,8,4,2,58.1,OK,6,batch_0381_gpu6
BmgGemmBF16BF16FP32_RCR_GemmExhaustive_256x32x32_SG8x2_ST1,RCR,GemmExhaustive,256,32,32,8,2,1,58.0,OK,5,batch_0192_gpu5
BmgGemmBF16BF16FP32_RCR_GemmExhaustive_32x128x16_SG4x4_ST3,RCR,GemmExhaustive,32,128,16,4,4,3,58.0,OK,5,batch_0220_gpu5
BmgGemmBF16BF16FP32_RCR_Gemm_16x64x32_SG1x4,RCR,Gemm,16,64,32,1,4,2,57.9,OK,6,batch_0433_gpu6
BmgGemmBF16BF16FP32_RCR_StreamK_64x192x64,RCR,StreamK,64,192,64,,,2,57.9,OK,5,unknown
BmgGemmBF16BF16FP32_RCR_GemmExhaustive_32x512x32_SG4x8_ST2,RCR,GemmExhaustive,32,512,32,4,8,2,57.9,OK,6,batch_0257_gpu6
BmgGemmBF16BF16FP32_RCR_Gemm_32x512x32_SG4x8,RCR,Gemm,32,512,32,4,8,2,57.9,OK,6,batch_0445_gpu6
BmgGemmBF16BF16FP32_RCR_GemmExhaustive_64x64x16_SG8x2_ST3,RCR,GemmExhaustive,64,64,16,8,2,3,57.8,OK,5,batch_0404_gpu5
BmgGemmBF16BF16FP32_RCR_GemmExhaustive_64x32x64_SG8x2_ST3,RCR,GemmExhaustive,64,32,64,8,2,3,57.8,OK,5,batch_0374_gpu5
BmgGemmBF16BF16FP32_RCR_GemmExhaustive_32x128x16_SG4x4_ST2,RCR,GemmExhaustive,32,128,16,4,4,2,57.7,OK,6,batch_0219_gpu6
BmgGemmBF16BF16FP32_RCR_GemmExhaustive_32x192x16_SG4x4_ST1,RCR,GemmExhaustive,32,192,16,4,4,1,57.7,OK,6,batch_0231_gpu6
BmgGemmBF16BF16FP32_RRR_Gemm_16x64x32_SG1x4,RRR,Gemm,16,64,32,1,4,2,57.4,OK,5,batch_0520_gpu5
BmgGemmBF16BF16FP32_RCR_GemmExhaustive_128x64x16_SG8x4_ST1,RCR,GemmExhaustive,128,64,16,8,4,1,57.2,OK,6,batch_0117_gpu6
BmgGemmBF16BF16FP32_RCR_GemmExhaustive_32x512x64_SG4x8_ST1,RCR,GemmExhaustive,32,512,64,4,8,1,57.2,OK,6,batch_0261_gpu6
BmgGemmBF16BF16FP32_RCR_GemmExhaustive_256x32x16_SG8x2_ST2,RCR,GemmExhaustive,256,32,16,8,2,2,57.1,OK,6,batch_0191_gpu6
BmgGemmBF16BF16FP32_RCR_GemmExhaustive_128x512x32_SG8x4_ST3,RCR,GemmExhaustive,128,512,32,8,4,3,57.0,OK,6,batch_0107_gpu6
BmgGemmBF16BF16FP32_RCR_GemmExhaustive_64x512x16_SG8x4_ST3,RCR,GemmExhaustive,64,512,16,8,4,3,56.9,OK,5,batch_0382_gpu5
BmgGemmBF16BF16FP32_RCR_GemmExhaustive_64x64x32_SG8x2_ST1,RCR,GemmExhaustive,64,64,32,8,2,1,56.8,OK,5,batch_0408_gpu5
BmgGemmBF16BF16FP32_RRR_Gemm_128x128x32_SG1x8,RRR,Gemm,128,128,32,1,8,2,56.8,OK,6,batch_0507_gpu6
BmgGemmBF16BF16FP32_RCR_GemmExhaustive_64x64x16_SG8x2_ST2,RCR,GemmExhaustive,64,64,16,8,2,2,56.7,OK,5,batch_0404_gpu5
BmgGemmBF16BF16FP32_RCR_GemmExhaustive_256x128x32_SG2x8_ST2,RCR,GemmExhaustive,256,128,32,2,8,2,56.3,OK,6,batch_0155_gpu6
BmgGemmBF16BF16FP32_RCR_GemmExhaustive_256x64x32_SG8x4_ST3,RCR,GemmExhaustive,256,64,32,8,4,3,56.2,OK,5,batch_0208_gpu5
BmgGemmBF16BF16FP32_RCR_GemmExhaustive_128x256x32_SG8x2_ST3,RCR,GemmExhaustive,128,256,32,8,2,3,56.1,OK,6,batch_0083_gpu6
BmgGemmBF16BF16FP32_RCR_GemmExhaustive_32x512x64_SG2x8_ST1,RCR,GemmExhaustive,32,512,64,2,8,1,55.8,OK,5,batch_0258_gpu5
BmgGemmBF16BF16FP32_RCR_GemmExhaustive_256x64x64_SG8x4_ST1,RCR,GemmExhaustive,256,64,64,8,4,1,55.8,OK,6,batch_0211_gpu6
BmgGemmBF16BF16FP32_RCR_GemmExhaustive_32x64x64_SG4x4_ST2,RCR,GemmExhaustive,32,64,64,4,4,2,55.8,OK,5,batch_0266_gpu5
BmgGemmBF16BF16FP32_RCR_GemmExhaustive_512x128x32_SG4x8_ST1,RCR,GemmExhaustive,512,128,32,4,8,1,55.7,OK,6,batch_0271_gpu6
BmgGemmBF16BF16FP32_RCR_GemmExhaustive_512x32x16_SG8x2_ST2,RCR,GemmExhaustive,512,32,16,8,2,2,55.5,OK,6,batch_0285_gpu6
BmgGemmBF16BF16FP32_RCR_GemmExhaustive_256x32x16_SG8x2_ST1,RCR,GemmExhaustive,256,32,16,8,2,1,55.4,OK,5,batch_0190_gpu5
BmgGemmBF16BF16FP32_RCR_GemmExhaustive_64x192x16_SG8x4_ST2,RCR,GemmExhaustive,64,192,16,8,4,2,55.1,OK,6,batch_0333_gpu6
BmgGemmBF16BF16FP32_RCR_GemmExhaustive_64x64x16_SG4x4_ST1,RCR,GemmExhaustive,64,64,16,4,4,1,55.0,OK,5,batch_0402_gpu5
BmgGemmBF16BF16FP32_RCR_GemmExhaustive_64x128x32_SG8x4_ST1,RCR,GemmExhaustive,64,128,32,8,4,1,55.0,OK,5,batch_0318_gpu5
BmgGemmBF16BF16FP32_RCR_GemmExhaustive_64x192x16_SG8x4_ST3,RCR,GemmExhaustive,64,192,16,8,4,3,54.8,OK,5,batch_0334_gpu5
BmgGemmBF16BF16FP32_RCR_GemmExhaustive_32x64x64_SG4x4_ST3,RCR,GemmExhaustive,32,64,64,4,4,3,54.8,OK,5,batch_0266_gpu5
BmgGemmBF16BF16FP32_RCR_StreamK_64x512x16,RCR,StreamK,64,512,16,,,2,54.8,OK,5,unknown
BmgGemmBF16BF16FP32_RCR_GemmExhaustive_256x256x64_SG8x4_ST1,RCR,GemmExhaustive,256,256,64,8,4,1,54.6,OK,6,batch_0187_gpu6
BmgGemmBF16BF16FP32_RCR_GemmExhaustive_32x256x32_SG4x8_ST1,RCR,GemmExhaustive,32,256,32,4,8,1,54.6,OK,6,batch_0243_gpu6
BmgGemmBF16BF16FP32_RCR_GemmExhaustive_32x512x32_SG4x8_ST3,RCR,GemmExhaustive,32,512,32,4,8,3,54.5,OK,6,batch_0257_gpu6
BmgGemmBF16BF16FP32_RCR_GemmExhaustive_32x128x16_SG2x8_ST1,RCR,GemmExhaustive,32,128,16,2,8,1,54.4,OK,6,batch_0217_gpu6
BmgGemmBF16BF16FP32_RCR_GemmExhaustive_32x512x16_SG2x8_ST2,RCR,GemmExhaustive,32,512,16,2,8,2,54.4,OK,6,batch_0249_gpu6
BmgGemmBF16BF16FP32_RCR_GemmExhaustive_16x256x64_SG2x8_ST1,RCR,GemmExhaustive,16,256,64,2,8,1,54.1,OK,6,batch_0139_gpu6
BmgGemmBF16BF16FP32_RCR_StreamK_64x64x64,RCR,StreamK,64,64,64,,,2,54.0,OK,5,unknown
BmgGemmBF16BF16FP32_RCR_DataParallel_64x64x64,RCR,DataParallel,64,64,64,,,2,54.0,OK,5,unknown
BmgGemmBF16BF16FP32_RCR_GemmExhaustive_64x192x16_SG8x4_ST1,RCR,GemmExhaustive,64,192,16,8,4,1,53.8,OK,6,batch_0333_gpu6
BmgGemmBF16BF16FP32_RCR_GemmExhaustive_64x32x64_SG8x2_ST1,RCR,GemmExhaustive,64,32,64,8,2,1,53.8,OK,6,batch_0373_gpu6
BmgGemmBF16BF16FP32_RCR_GemmExhaustive_256x128x64_SG8x2_ST1,RCR,GemmExhaustive,256,128,64,8,2,1,53.7,OK,5,batch_0168_gpu5
BmgGemmBF16BF16FP32_RCR_Gemm_128x128x32_SG1x8,RCR,Gemm,128,128,32,1,8,2,53.6,OK,5,batch_0420_gpu5
BmgGemmBF16BF16FP32_RCR_GemmExhaustive_32x192x64_SG4x4_ST3,RCR,GemmExhaustive,32,192,64,4,4,3,53.6,OK,6,batch_0235_gpu6
BmgGemmBF16BF16FP32_RCR_Gemm_64x64x64_SG8x4,RCR,Gemm,64,64,64,8,4,2,53.6,OK,5,batch_0456_gpu5
BmgGemmBF16BF16FP32_RCR_GemmExhaustive_64x64x64_SG8x4_ST2,RCR,GemmExhaustive,64,64,64,8,4,2,53.5,OK,5,batch_0414_gpu5
BmgGemmBF16BF16FP32_RCR_GemmExhaustive_256x128x32_SG2x8_ST3,RCR,GemmExhaustive,256,128,32,2,8,3,53.3,OK,6,batch_0155_gpu6
BmgGemmBF16BF16FP32_RRR_Gemm_16x64x32_SG2x4,RRR,Gemm,16,64,32,2,4,2,53.2,OK,5,batch_0520_gpu5
BmgGemmBF16BF16FP32_RCR_GemmExhaustive_32x512x16_SG4x8_ST1,RCR,GemmExhaustive,32,512,16,4,8,1,53.2,OK,5,batch_0252_gpu5
BmgGemmBF16BF16FP32_RCR_GemmExhaustive_64x64x64_SG8x4_ST3,RCR,GemmExhaustive,64,64,64,8,4,3,53.1,OK,6,batch_0415_gpu6
BmgGemmBF16BF16FP32_RCR_GemmExhaustive_256x64x32_SG8x4_ST2,RCR,GemmExhaustive,256,64,32,8,4,2,53.0,OK,6,batch_0207_gpu6
BmgGemmBF16BF16FP32_RCR_Gemm_256x64x32_SG8x4,RCR,Gemm,256,64,32,8,4,2,53.0,OK,6,batch_0443_gpu6
BmgGemmBF16BF16FP32_RCR_GemmExhaustive_32x256x64_SG4x4_ST2,RCR,GemmExhaustive,32,256,64,4,4,2,53.0,OK,5,batch_0246_gpu5
BmgGemmBF16BF16FP32_RCR_GemmExhaustive_32x512x16_SG4x8_ST2,RCR,GemmExhaustive,32,512,16,4,8,2,53.0,OK,5,batch_0252_gpu5
BmgGemmBF16BF16FP32_RCR_GemmExhaustive_128x256x64_SG4x4_ST1,RCR,GemmExhaustive,128,256,64,4,4,1,52.9,OK,5,batch_0088_gpu5
BmgGemmBF16BF16FP32_RCR_GemmExhaustive_256x256x64_SG8x4_ST3,RCR,GemmExhaustive,256,256,64,8,4,3,52.8,OK,5,batch_0188_gpu5
BmgGemmBF16BF16FP32_RRR_Gemm_64x64x32_SG8x4,RRR,Gemm,64,64,32,8,4,2,52.8,OK,5,batch_0542_gpu5
BmgGemmBF16BF16FP32_RCR_StreamK_64x192x16,RCR,StreamK,64,192,16,,,2,52.5,OK,6,unknown
BmgGemmBF16BF16FP32_RCR_GemmExhaustive_256x64x16_SG8x4_ST3,RCR,GemmExhaustive,256,64,16,8,4,3,52.4,OK,6,batch_0203_gpu6
BmgGemmBF16BF16FP32_RCR_GemmExhaustive_32x512x64_SG4x8_ST2,RCR,GemmExhaustive,32,512,64,4,8,2,52.1,OK,6,batch_0261_gpu6
BmgGemmBF16BF16FP32_RCR_GemmExhaustive_256x64x32_SG8x4_ST1,RCR,GemmExhaustive,256,64,32,8,4,1,52.1,OK,6,batch_0207_gpu6
BmgGemmBF16BF16FP32_RCR_GemmExhaustive_32x128x64_SG4x8_ST2,RCR,GemmExhaustive,32,128,64,4,8,2,52.0,OK,5,batch_0230_gpu5
BmgGemmBF16BF16FP32_RCR_GemmExhaustive_64x128x16_SG4x8_ST1,RCR,GemmExhaustive,64,128,16,4,8,1,52.0,OK,5,batch_0306_gpu5
BmgGemmBF16BF16FP32_RCR_GemmExhaustive_64x192x64_SG8x2_ST1,RCR,GemmExhaustive,64,192,64,8,2,1,52.0,OK,5,batch_0340_gpu5
BmgGemmBF16BF16FP32_RRR_Gemm_32x64x32_SG4x4,RRR,Gemm,32,64,32,4,4,2,51.9,OK,5,batch_0534_gpu5
BmgGemmBF16BF16FP32_RCR_GemmExhaustive_32x128x64_SG4x8_ST3,RCR,GemmExhaustive,32,128,64,4,8,3,51.8,OK,5,batch_0230_gpu5
BmgGemmBF16BF16FP32_RCR_GemmExhaustive_16x256x32_SG2x8_ST1,RCR,GemmExhaustive,16,256,32,2,8,1,51.8,OK,5,batch_0138_gpu5
BmgGemmBF16BF16FP32_RCR_GemmExhaustive_512x128x32_SG4x8_ST2,RCR,GemmExhaustive,512,128,32,4,8,2,51.7,OK,5,batch_0272_gpu5
BmgGemmBF16BF16FP32_RCR_GemmExhaustive_256x128x64_SG8x2_ST3,RCR,GemmExhaustive,256,128,64,8,2,3,51.7,OK,6,batch_0169_gpu6
BmgGemmBF16BF16FP32_RCR_GemmExhaustive_32x512x16_SG4x8_ST3,RCR,GemmExhaustive,32,512,16,4,8,3,51.4,OK,6,batch_0253_gpu6
BmgGemmBF16BF16FP32_RCR_GemmExhaustive_256x128x64_SG8x2_ST2,RCR,GemmExhaustive,256,128,64,8,2,2,51.4,OK,5,batch_0168_gpu5
BmgGemmBF16BF16FP32_RCR_GemmExhaustive_256x64x16_SG8x4_ST2,RCR,GemmExhaustive,256,64,16,8,4,2,51.3,OK,6,batch_0203_gpu6
BmgGemmBF16BF16FP32_RCR_GemmExhaustive_512x32x16_SG8x2_ST3,RCR,GemmExhaustive,512,32,16,8,2,3,51.2,OK,5,batch_0286_gpu5
BmgGemmBF16BF16FP32_RCR_GemmExhaustive_32x512x16_SG2x8_ST3,RCR,GemmExhaustive,32,512,16,2,8,3,50.7,OK,5,batch_0250_gpu5
BmgGemmBF16BF16FP32_RCR_GemmExhaustive_32x512x64_SG2x8_ST2,RCR,GemmExhaustive,32,512,64,2,8,2,50.7,OK,5,batch_0258_gpu5
BmgGemmBF16BF16FP32_RCR_Gemm_256x256x64_SG8x4,RCR,Gemm,256,256,64,8,4,2,50.4,OK,5,batch_0440_gpu5
BmgGemmBF16BF16FP32_RCR_GemmExhaustive_32x512x64_SG2x8_ST3,RCR,GemmExhaustive,32,512,64,2,8,3,50.3,OK,6,batch_0259_gpu6
BmgGemmBF16BF16FP32_RCR_GemmExhaustive_256x256x64_SG8x4_ST2,RCR,GemmExhaustive,256,256,64,8,4,2,50.3,OK,5,batch_0188_gpu5
BmgGemmBF16BF16FP32_RCR_GemmExhaustive_256x64x16_SG8x4_ST1,RCR,GemmExhaustive,256,64,16,8,4,1,50.0,OK,5,batch_0202_gpu5
BmgGemmBF16BF16FP32_RCR_GemmExhaustive_32x256x16_SG4x8_ST3,RCR,GemmExhaustive,32,256,16,4,8,3,50.0,OK,6,batch_0239_gpu6
BmgGemmBF16BF16FP32_RCR_GemmExhaustive_32x256x16_SG4x8_ST2,RCR,GemmExhaustive,32,256,16,4,8,2,49.6,OK,6,batch_0239_gpu6
BmgGemmBF16BF16FP32_RCR_GemmExhaustive_128x512x64_SG4x8_ST1,RCR,GemmExhaustive,128,512,64,4,8,1,49.6,OK,6,batch_0109_gpu6
BmgGemmBF16BF16FP32_RCR_Gemm_16x64x64_SG2x4,RCR,Gemm,16,64,64,2,4,2,49.6,OK,5,batch_0434_gpu5
BmgGemmBF16BF16FP32_RCR_GemmExhaustive_16x256x32_SG2x8_ST2,RCR,GemmExhaustive,16,256,32,2,8,2,49.5,OK,5,batch_0138_gpu5
BmgGemmBF16BF16FP32_RCR_GemmExhaustive_64x128x16_SG8x4_ST3,RCR,GemmExhaustive,64,128,16,8,4,3,49.5,OK,5,batch_0310_gpu5
BmgGemmBF16BF16FP32_RCR_GemmExhaustive_64x64x64_SG8x4_ST1,RCR,GemmExhaustive,64,64,64,8,4,1,49.5,OK,5,batch_0414_gpu5
BmgGemmBF16BF16FP32_RCR_GemmExhaustive_32x256x64_SG4x4_ST3,RCR,GemmExhaustive,32,256,64,4,4,3,49.1,OK,6,batch_0247_gpu6
BmgGemmBF16BF16FP32_RCR_GemmExhaustive_128x256x64_SG4x4_ST2,RCR,GemmExhaustive,128,256,64,4,4,2,48.9,OK,6,batch_0089_gpu6
BmgGemmBF16BF16FP32_RCR_GemmExhaustive_64x128x16_SG8x4_ST2,RCR,GemmExhaustive,64,128,16,8,4,2,48.9,OK,6,batch_0309_gpu6
BmgGemmBF16BF16FP32_RCR_GemmExhaustive_16x128x64_SG2x8_ST1,RCR,GemmExhaustive,16,128,64,2,8,1,48.5,OK,6,batch_0135_gpu6
BmgGemmBF16BF16FP32_RCR_GemmExhaustive_32x64x64_SG4x4_ST1,RCR,GemmExhaustive,32,64,64,4,4,1,48.5,OK,6,batch_0265_gpu6
BmgGemmBF16BF16FP32_RCR_GemmExhaustive_16x128x64_SG2x8_ST2,RCR,GemmExhaustive,16,128,64,2,8,2,48.3,OK,6,batch_0135_gpu6
BmgGemmBF16BF16FP32_RCR_GemmExhaustive_128x512x64_SG4x8_ST3,RCR,GemmExhaustive,128,512,64,4,8,3,48.3,OK,5,batch_0110_gpu5
BmgGemmBF16BF16FP32_RCR_GemmExhaustive_32x512x64_SG4x8_ST3,RCR,GemmExhaustive,32,512,64,4,8,3,48.2,OK,5,batch_0262_gpu5
BmgGemmBF16BF16FP32_RCR_GemmExhaustive_128x256x64_SG4x4_ST3,RCR,GemmExhaustive,128,256,64,4,4,3,48.0,OK,6,batch_0089_gpu6
BmgGemmBF16BF16FP32_RCR_GemmExhaustive_32x128x16_SG4x4_ST1,RCR,GemmExhaustive,32,128,16,4,4,1,47.9,OK,6,batch_0219_gpu6
BmgGemmBF16BF16FP32_RCR_GemmExhaustive_512x128x32_SG4x8_ST3,RCR,GemmExhaustive,512,128,32,4,8,3,47.4,OK,5,batch_0272_gpu5
BmgGemmBF16BF16FP32_RRR_Gemm_256x64x64_SG8x4,RRR,Gemm,256,64,64,8,4,2,47.2,OK,5,unknown
BmgGemmBF16BF16FP32_RCR_GemmExhaustive_64x64x16_SG8x2_ST1,RCR,GemmExhaustive,64,64,16,8,2,1,47.0,OK,6,batch_0403_gpu6
BmgGemmBF16BF16FP32_RCR_GemmExhaustive_16x256x16_SG2x8_ST2,RCR,GemmExhaustive,16,256,16,2,8,2,46.9,OK,6,batch_0137_gpu6
BmgGemmBF16BF16FP32_RRR_Gemm_32x512x32_SG2x4,RRR,Gemm,32,512,32,2,4,2,46.8,OK,6,batch_0531_gpu6
BmgGemmBF16BF16FP32_RCR_GemmExhaustive_128x512x64_SG4x8_ST2,RCR,GemmExhaustive,128,512,64,4,8,2,46.7,OK,5,batch_0110_gpu5
BmgGemmBF16BF16FP32_RCR_Gemm_16x64x64_SG1x4,RCR,Gemm,16,64,64,1,4,2,46.4,OK,5,batch_0434_gpu5
BmgGemmBF16BF16FP32_RCR_Gemm_16x64x32_SG2x4,RCR,Gemm,16,64,32,2,4,2,46.4,OK,6,batch_0433_gpu6
BmgGemmBF16BF16FP32_RCR_Gemm_128x64x32_SG1x4,RCR,Gemm,128,64,32,1,4,2,46.0,OK,5,batch_0430_gpu5
BmgGemmBF16BF16FP32_RCR_StreamK_128x512x32,RCR,StreamK,128,512,32,,,2,45.7,OK,6,unknown
BmgGemmBF16BF16FP32_RCR_DataParallel_128x512x32,RCR,DataParallel,128,512,32,,,2,45.7,OK,6,unknown
BmgGemmBF16BF16FP32_RCR_GemmExhaustive_64x192x64_SG8x2_ST2,RCR,GemmExhaustive,64,192,64,8,2,2,45.5,OK,6,batch_0341_gpu6
BmgGemmBF16BF16FP32_RCR_GemmExhaustive_16x256x16_SG2x8_ST1,RCR,GemmExhaustive,16,256,16,2,8,1,45.2,OK,5,batch_0136_gpu5
BmgGemmBF16BF16FP32_RCR_GemmExhaustive_16x256x16_SG2x8_ST3,RCR,GemmExhaustive,16,256,16,2,8,3,45.2,OK,6,batch_0137_gpu6
BmgGemmBF16BF16FP32_RCR_GemmExhaustive_32x128x64_SG4x8_ST1,RCR,GemmExhaustive,32,128,64,4,8,1,45.0,OK,6,batch_0229_gpu6
BmgGemmBF16BF16FP32_RCR_GemmExhaustive_64x32x32_SG8x2_ST3,RCR,GemmExhaustive,64,32,32,8,2,3,44.7,OK,6,batch_0373_gpu6
BmgGemmBF16BF16FP32_RCR_GemmExhaustive_64x512x32_SG4x4_ST1,RCR,GemmExhaustive,64,512,32,4,4,1,44.6,OK,6,batch_0385_gpu6
BmgGemmBF16BF16FP32_RCR_GemmExhaustive_64x32x32_SG8x2_ST2,RCR,GemmExhaustive,64,32,32,8,2,2,44.6,OK,5,batch_0372_gpu5
BmgGemmBF16BF16FP32_RRR_Gemm_256x32x32_SG8x2,RRR,Gemm,256,32,32,8,2,2,44.5,OK,6,batch_0527_gpu6
BmgGemmBF16BF16FP32_RCR_GemmExhaustive_64x64x32_SG8x4_ST3,RCR,GemmExhaustive,64,64,32,8,4,3,44.4,OK,5,batch_0410_gpu5
BmgGemmBF16BF16FP32_RCR_GemmExhaustive_32x64x32_SG4x4_ST3,RCR,GemmExhaustive,32,64,32,4,4,3,44.3,OK,6,batch_0265_gpu6
BmgGemmBF16BF16FP32_RCR_GemmExhaustive_16x256x32_SG2x8_ST3,RCR,GemmExhaustive,16,256,32,2,8,3,44.3,OK,6,batch_0139_gpu6
BmgGemmBF16BF16FP32_RCR_Gemm_64x64x32_SG8x4,RCR,Gemm,64,64,32,8,4,2,44.1,OK,6,batch_0455_gpu6
BmgGemmBF16BF16FP32_RCR_GemmExhaustive_64x64x32_SG8x4_ST2,RCR,GemmExhaustive,64,64,32,8,4,2,44.1,OK,5,batch_0410_gpu5
BmgGemmBF16BF16FP32_RCR_GemmExhaustive_64x192x64_SG8x2_ST3,RCR,GemmExhaustive,64,192,64,8,2,3,44.1,OK,6,batch_0341_gpu6
BmgGemmBF16BF16FP32_RCR_GemmExhaustive_32x64x32_SG4x4_ST2,RCR,GemmExhaustive,32,64,32,4,4,2,44.1,OK,5,batch_0264_gpu5
BmgGemmBF16BF16FP32_RCR_Gemm_32x64x32_SG4x4,RCR,Gemm,32,64,32,4,4,2,44.1,OK,6,batch_0447_gpu6
BmgGemmBF16BF16FP32_RCR_GemmExhaustive_16x256x64_SG2x8_ST2,RCR,GemmExhaustive,16,256,64,2,8,2,43.8,OK,5,batch_0140_gpu5
BmgGemmBF16BF16FP32_RCR_GemmExhaustive_64x512x64_SG2x8_ST1,RCR,GemmExhaustive,64,512,64,2,8,1,43.8,OK,6,batch_0393_gpu6
BmgGemmBF16BF16FP32_RCR_GemmExhaustive_64x512x32_SG4x4_ST2,RCR,GemmExhaustive,64,512,32,4,4,2,43.8,OK,5,batch_0386_gpu5
BmgGemmBF16BF16FP32_RRR_Gemm_128x64x32_SG1x4,RRR,Gemm,128,64,32,1,4,2,43.6,OK,6,batch_0517_gpu6
BmgGemmBF16BF16FP32_RCR_GemmExhaustive_64x32x16_SG8x2_ST3,RCR,GemmExhaustive,64,32,16,8,2,3,43.4,OK,6,batch_0371_gpu6
BmgGemmBF16BF16FP32_RCR_GemmExhaustive_64x128x16_SG8x4_ST1,RCR,GemmExhaustive,64,128,16,8,4,1,42.9,OK,6,batch_0309_gpu6
BmgGemmBF16BF16FP32_RCR_GemmExhaustive_64x512x32_SG4x4_ST3,RCR,GemmExhaustive,64,512,32,4,4,3,42.8,OK,5,batch_0386_gpu5
BmgGemmBF16BF16FP32_RCR_GemmExhaustive_32x256x16_SG4x8_ST1,RCR,GemmExhaustive,32,256,16,4,8,1,42.8,OK,5,batch_0238_gpu5
BmgGemmBF16BF16FP32_RCR_GemmExhaustive_512x64x32_SG4x4_ST1,RCR,GemmExhaustive,512,64,32,4,4,1,42.6,OK,5,batch_0294_gpu5
BmgGemmBF16BF16FP32_RCR_GemmExhaustive_64x32x32_SG8x2_ST1,RCR,GemmExhaustive,64,32,32,8,2,1,42.2,OK,5,batch_0372_gpu5
BmgGemmBF16BF16FP32_RCR_GemmExhaustive_64x64x32_SG8x4_ST1,RCR,GemmExhaustive,64,64,32,8,4,1,42.2,OK,6,batch_0409_gpu6
BmgGemmBF16BF16FP32_RCR_GemmExhaustive_16x128x64_SG2x8_ST3,RCR,GemmExhaustive,16,128,64,2,8,3,42.0,OK,5,batch_0136_gpu5
BmgGemmBF16BF16FP32_RCR_GemmExhaustive_32x128x32_SG4x8_ST3,RCR,GemmExhaustive,32,128,32,4,8,3,41.9,OK,5,batch_0226_gpu5
BmgGemmBF16BF16FP32_RRR_Gemm_256x64x32_SG8x4,RRR,Gemm,256,64,32,8,4,2,41.8,OK,5,unknown
BmgGemmBF16BF16FP32_RCR_GemmExhaustive_32x128x32_SG4x8_ST2,RCR,GemmExhaustive,32,128,32,4,8,2,41.8,OK,6,batch_0225_gpu6
BmgGemmBF16BF16FP32_RCR_GemmExhaustive_16x128x32_SG2x8_ST2,RCR,GemmExhaustive,16,128,32,2,8,2,41.7,OK,5,batch_0134_gpu5
BmgGemmBF16BF16FP32_RCR_GemmExhaustive_16x128x32_SG2x8_ST3,RCR,GemmExhaustive,16,128,32,2,8,3,41.5,OK,5,batch_0134_gpu5
BmgGemmBF16BF16FP32_RCR_GemmExhaustive_512x64x32_SG4x4_ST2,RCR,GemmExhaustive,512,64,32,4,4,2,41.4,OK,5,batch_0294_gpu5
BmgGemmBF16BF16FP32_RCR_DataParallel_64x64x32,RCR,DataParallel,64,64,32,,,2,41.4,OK,6,unknown
BmgGemmBF16BF16FP32_RCR_StreamK_64x64x32,RCR,StreamK,64,64,32,,,2,41.3,OK,5,unknown
BmgGemmBF16BF16FP32_RRR_Gemm_256x64x32_SG2x4,RRR,Gemm,256,64,32,2,4,2,41.2,OK,5,batch_0528_gpu5
BmgGemmBF16BF16FP32_RCR_Gemm_256x64x32_SG2x4,RCR,Gemm,256,64,32,2,4,2,41.2,OK,6,batch_0441_gpu6
BmgGemmBF16BF16FP32_RRR_Gemm_16x64x64_SG1x4,RRR,Gemm,16,64,64,1,4,2,41.0,OK,6,batch_0521_gpu6
BmgGemmBF16BF16FP32_RCR_GemmExhaustive_128x192x64_SG8x2_ST1,RCR,GemmExhaustive,128,192,64,8,2,1,40.5,OK,5,batch_0066_gpu5
BmgGemmBF16BF16FP32_RCR_GemmExhaustive_512x64x32_SG4x4_ST3,RCR,GemmExhaustive,512,64,32,4,4,3,40.3,OK,6,batch_0295_gpu6
BmgGemmBF16BF16FP32_RCR_GemmExhaustive_256x256x64_SG4x8_ST1,RCR,GemmExhaustive,256,256,64,4,8,1,40.2,OK,5,batch_0186_gpu5
BmgGemmBF16BF16FP32_RCR_GemmExhaustive_64x512x64_SG2x8_ST3,RCR,GemmExhaustive,64,512,64,2,8,3,39.9,OK,5,batch_0394_gpu5
BmgGemmBF16BF16FP32_RCR_GemmExhaustive_64x32x16_SG8x2_ST2,RCR,GemmExhaustive,64,32,16,8,2,2,39.9,OK,6,batch_0371_gpu6
BmgGemmBF16BF16FP32_RCR_GemmExhaustive_16x128x16_SG2x8_ST3,RCR,GemmExhaustive,16,128,16,2,8,3,39.8,OK,6,batch_0133_gpu6
BmgGemmBF16BF16FP32_RCR_GemmExhaustive_64x512x64_SG2x8_ST2,RCR,GemmExhaustive,64,512,64,2,8,2,39.7,OK,6,batch_0393_gpu6
BmgGemmBF16BF16FP32_RCR_GemmExhaustive_32x64x16_SG4x4_ST3,RCR,GemmExhaustive,32,64,16,4,4,3,39.6,OK,6,batch_0263_gpu6
BmgGemmBF16BF16FP32_RCR_GemmExhaustive_128x256x64_SG2x8_ST1,RCR,GemmExhaustive,128,256,64,2,8,1,39.4,OK,6,batch_0087_gpu6
BmgGemmBF16BF16FP32_RCR_GemmExhaustive_16x256x64_SG2x8_ST3,RCR,GemmExhaustive,16,256,64,2,8,3,39.0,OK,5,batch_0140_gpu5
BmgGemmBF16BF16FP32_RCR_GemmExhaustive_256x256x64_SG4x8_ST3,RCR,GemmExhaustive,256,256,64,4,8,3,38.9,OK,6,batch_0187_gpu6
BmgGemmBF16BF16FP32_RCR_GemmExhaustive_32x64x32_SG4x4_ST1,RCR,GemmExhaustive,32,64,32,4,4,1,38.8,OK,5,batch_0264_gpu5
BmgGemmBF16BF16FP32_RRR_Gemm_8x128x32_SG1x8,RRR,Gemm,8,128,32,1,8,2,38.4,OK,5,batch_0544_gpu5
BmgGemmBF16BF16FP32_RCR_GemmExhaustive_32x512x32_SG4x4_ST1,RCR,GemmExhaustive,32,512,32,4,4,1,38.2,OK,6,batch_0255_gpu6
BmgGemmBF16BF16FP32_RCR_GemmExhaustive_256x256x64_SG4x8_ST2,RCR,GemmExhaustive,256,256,64,4,8,2,38.2,OK,5,batch_0186_gpu5
BmgGemmBF16BF16FP32_RCR_GemmExhaustive_16x128x32_SG2x8_ST1,RCR,GemmExhaustive,16,128,32,2,8,1,38.1,OK,6,batch_0133_gpu6
BmgGemmBF16BF16FP32_RCR_GemmExhaustive_256x128x64_SG4x4_ST1,RCR,GemmExhaustive,256,128,64,4,4,1,38.1,OK,6,batch_0165_gpu6
BmgGemmBF16BF16FP32_RCR_GemmExhaustive_32x512x16_SG4x4_ST1,RCR,GemmExhaustive,32,512,16,4,4,1,38.0,OK,5,batch_0250_gpu5
BmgGemmBF16BF16FP32_RCR_GemmExhaustive_128x192x64_SG8x2_ST2,RCR,GemmExhaustive,128,192,64,8,2,2,37.7,OK,5,batch_0066_gpu5
BmgGemmBF16BF16FP32_RCR_GemmExhaustive_256x128x64_SG4x4_ST3,RCR,GemmExhaustive,256,128,64,4,4,3,37.3,OK,5,batch_0166_gpu5
BmgGemmBF16BF16FP32_RCR_GemmExhaustive_128x256x64_SG2x8_ST3,RCR,GemmExhaustive,128,256,64,2,8,3,37.3,OK,5,batch_0088_gpu5
BmgGemmBF16BF16FP32_RCR_GemmExhaustive_512x128x64_SG8x4_ST1,RCR,GemmExhaustive,512,128,64,8,4,1,37.3,OK,6,batch_0277_gpu6
BmgGemmBF16BF16FP32_RCR_GemmExhaustive_64x64x16_SG8x4_ST3,RCR,GemmExhaustive,64,64,16,8,4,3,37.3,OK,5,batch_0406_gpu5
BmgGemmBF16BF16FP32_RCR_GemmExhaustive_32x128x32_SG4x8_ST1,RCR,GemmExhaustive,32,128,32,4,8,1,37.2,OK,6,batch_0225_gpu6
BmgGemmBF16BF16FP32_RCR_GemmExhaustive_16x128x16_SG2x8_ST2,RCR,GemmExhaustive,16,128,16,2,8,2,37.0,OK,5,batch_0132_gpu5
BmgGemmBF16BF16FP32_RCR_GemmExhaustive_128x256x64_SG2x8_ST2,RCR,GemmExhaustive,128,256,64,2,8,2,36.9,OK,6,batch_0087_gpu6
BmgGemmBF16BF16FP32_RCR_GemmExhaustive_128x192x64_SG8x2_ST3,RCR,GemmExhaustive,128,192,64,8,2,3,36.8,OK,6,batch_0067_gpu6
BmgGemmBF16BF16FP32_RRR_Gemm_128x128x64_SG4x8,RRR,Gemm,128,128,64,4,8,2,36.8,OK,6,batch_0511_gpu6
BmgGemmBF16BF16FP32_RCR_GemmExhaustive_32x128x16_SG4x8_ST3,RCR,GemmExhaustive,32,128,16,4,8,3,36.6,OK,6,batch_0221_gpu6
BmgGemmBF16BF16FP32_RCR_GemmExhaustive_32x512x32_SG4x4_ST2,RCR,GemmExhaustive,32,512,32,4,4,2,36.6,OK,6,batch_0255_gpu6
BmgGemmBF16BF16FP32_RCR_Gemm_32x512x32_SG4x4,RCR,Gemm,32,512,32,4,4,2,36.6,OK,6,batch_0445_gpu6
BmgGemmBF16BF16FP32_RCR_GemmExhaustive_256x128x64_SG4x4_ST2,RCR,GemmExhaustive,256,128,64,4,4,2,36.6,OK,6,batch_0165_gpu6
BmgGemmBF16BF16FP32_RCR_GemmExhaustive_32x64x16_SG4x4_ST2,RCR,GemmExhaustive,32,64,16,4,4,2,36.3,OK,6,batch_0263_gpu6
BmgGemmBF16BF16FP32_RCR_GemmExhaustive_32x512x16_SG4x4_ST2,RCR,GemmExhaustive,32,512,16,4,4,2,35.8,OK,6,batch_0251_gpu6
BmgGemmBF16BF16FP32_RCR_GemmExhaustive_512x128x64_SG8x4_ST2,RCR,GemmExhaustive,512,128,64,8,4,2,35.7,OK,5,batch_0278_gpu5
BmgGemmBF16BF16FP32_RCR_Gemm_512x128x64_SG8x4,RCR,Gemm,512,128,64,8,4,2,35.5,OK,5,batch_0448_gpu5
BmgGemmBF16BF16FP32_RCR_GemmExhaustive_16x512x32_SG2x8_ST1,RCR,GemmExhaustive,16,512,32,2,8,1,35.3,OK,5,batch_0142_gpu5
BmgGemmBF16BF16FP32_RCR_GemmExhaustive_512x128x64_SG8x4_ST3,RCR,GemmExhaustive,512,128,64,8,4,3,35.2,OK,5,batch_0278_gpu5
BmgGemmBF16BF16FP32_RCR_GemmExhaustive_32x512x32_SG4x4_ST3,RCR,GemmExhaustive,32,512,32,4,4,3,35.1,OK,5,batch_0256_gpu5
BmgGemmBF16BF16FP32_RCR_GemmExhaustive_64x64x16_SG8x4_ST2,RCR,GemmExhaustive,64,64,16,8,4,2,34.9,OK,6,batch_0405_gpu6
BmgGemmBF16BF16FP32_RRR_Gemm_128x128x64_SG4x4,RRR,Gemm,128,128,64,4,4,2,34.8,OK,6,batch_0511_gpu6
BmgGemmBF16BF16FP32_RRR_Gemm_256x256x64_SG8x4,RRR,Gemm,256,256,64,8,4,2,34.7,OK,6,batch_0527_gpu6
BmgGemmBF16BF16FP32_RCR_StreamK_64x64x16,RCR,StreamK,64,64,16,,,2,34.6,OK,6,unknown
BmgGemmBF16BF16FP32_RCR_Gemm_128x128x64_SG2x4,RCR,Gemm,128,128,64,2,4,2,34.5,OK,6,batch_0423_gpu6
BmgGemmBF16BF16FP32_RCR_DataParallel_64x64x16,RCR,DataParallel,64,64,16,,,2,34.5,OK,6,unknown
BmgGemmBF16BF16FP32_RCR_GemmExhaustive_32x512x16_SG4x4_ST3,RCR,GemmExhaustive,32,512,16,4,4,3,34.4,OK,6,batch_0251_gpu6
BmgGemmBF16BF16FP32_RCR_GemmExhaustive_32x128x16_SG4x8_ST2,RCR,GemmExhaustive,32,128,16,4,8,2,33.9,OK,6,batch_0221_gpu6
BmgGemmBF16BF16FP32_RCR_GemmExhaustive_128x32x64_SG8x2_ST3,RCR,GemmExhaustive,128,32,64,8,2,3,33.9,OK,5,batch_0100_gpu5
BmgGemmBF16BF16FP32_RCR_GemmExhaustive_64x32x16_SG8x2_ST1,RCR,GemmExhaustive,64,32,16,8,2,1,33.7,OK,5,batch_0370_gpu5
BmgGemmBF16BF16FP32_RRR_Gemm_8x128x32_SG1x4,RRR,Gemm,8,128,32,1,4,2,33.4,OK,6,batch_0543_gpu6
BmgGemmBF16BF16FP32_RCR_18,RCR,Gemm,128,128,32,4,4,2,33.4,OK,6,unknown
BmgGemmBF16BF16FP32_RCR_6,RCR,Gemm,256,256,32,8,4,2,33.2,OK,5,unknown
BmgGemmBF16BF16FP32_RCR_Gemm_8x64x32_SG1x4,RCR,Gemm,8,64,32,1,4,2,33.2,OK,6,batch_0457_gpu6
BmgGemmBF16BF16FP32_RRR_Gemm_8x64x32_SG1x4,RRR,Gemm,8,64,32,1,4,2,33.1,OK,5,batch_0544_gpu5
BmgGemmBF16BF16FP32_RCR_Gemm_32x512x32_SG2x4,RCR,Gemm,32,512,32,2,4,2,33.1,OK,5,batch_0444_gpu5
BmgGemmBF16BF16FP32_RCR_GemmExhaustive_128x32x64_SG8x2_ST2,RCR,GemmExhaustive,128,32,64,8,2,2,32.9,OK,6,batch_0099_gpu6
BmgGemmBF16BF16FP32_RCR_Gemm_128x32x64_SG8x2,RCR,Gemm,128,32,64,8,2,2,32.9,OK,6,batch_0429_gpu6
BmgGemmBF16BF16FP32_RCR_GemmExhaustive_16x512x32_SG2x8_ST2,RCR,GemmExhaustive,16,512,32,2,8,2,32.8,OK,6,batch_0143_gpu6
BmgGemmBF16BF16FP32_RCR_GemmExhaustive_128x32x64_SG8x2_ST1,RCR,GemmExhaustive,128,32,64,8,2,1,32.8,OK,6,batch_0099_gpu6
BmgGemmBF16BF16FP32_RCR_Gemm_8x128x32_SG1x8,RCR,Gemm,8,128,32,1,8,2,32.7,OK,6,batch_0457_gpu6
BmgGemmBF16BF16FP32_RCR_GemmExhaustive_16x512x16_SG2x8_ST1,RCR,GemmExhaustive,16,512,16,2,8,1,32.0,OK,6,batch_0141_gpu6
BmgGemmBF16BF16FP32_RCR_19,RCR,Gemm,128,256,32,4,4,2,32.0,OK,6,unknown
BmgGemmBF16BF16FP32_RCR_GemmExhaustive_128x32x32_SG8x2_ST3,RCR,GemmExhaustive,128,32,32,8,2,3,31.9,OK,5,batch_0098_gpu5
BmgGemmBF16BF16FP32_RCR_GemmExhaustive_16x512x32_SG2x8_ST3,RCR,GemmExhaustive,16,512,32,2,8,3,31.1,OK,6,batch_0143_gpu6
BmgGemmBF16BF16FP32_RCR_GemmExhaustive_32x64x16_SG4x4_ST1,RCR,GemmExhaustive,32,64,16,4,4,1,31.0,OK,5,batch_0262_gpu5
BmgGemmBF16BF16FP32_RCR_GemmExhaustive_64x64x16_SG8x4_ST1,RCR,GemmExhaustive,64,64,16,8,4,1,30.8,OK,6,batch_0405_gpu6
BmgGemmBF16BF16FP32_RCR_GemmExhaustive_128x32x32_SG8x2_ST2,RCR,GemmExhaustive,128,32,32,8,2,2,30.4,OK,5,batch_0098_gpu5
BmgGemmBF16BF16FP32_RCR_17,RCR,Gemm,64,128,32,4,4,2,30.3,OK,5,unknown
BmgGemmBF16BF16FP32_RCR_GemmExhaustive_512x64x64_SG8x2_ST1,RCR,GemmExhaustive,512,64,64,8,2,1,30.1,OK,5,batch_0300_gpu5
BmgGemmBF16BF16FP32_RCR_GemmExhaustive_16x128x16_SG2x8_ST1,RCR,GemmExhaustive,16,128,16,2,8,1,30.1,OK,5,batch_0132_gpu5
BmgGemmBF16BF16FP32_RRR_Gemm_128x32x64_SG8x2,RRR,Gemm,128,32,64,8,2,2,29.9,OK,5,batch_0516_gpu5
BmgGemmBF16BF16FP32_RCR_GemmExhaustive_128x32x32_SG8x2_ST1,RCR,GemmExhaustive,128,32,32,8,2,1,29.5,OK,6,batch_0097_gpu6
BmgGemmBF16BF16FP32_RRR_Gemm_512x128x64_SG8x4,RRR,Gemm,512,128,64,8,4,2,29.3,OK,6,batch_0535_gpu6
BmgGemmBF16BF16FP32_RCR_GemmExhaustive_128x32x16_SG8x2_ST3,RCR,GemmExhaustive,128,32,16,8,2,3,29.2,OK,6,batch_0097_gpu6
BmgGemmBF16BF16FP32_RCR_GemmExhaustive_16x512x64_SG2x8_ST1,RCR,GemmExhaustive,16,512,64,2,8,1,29.1,OK,5,batch_0144_gpu5
BmgGemmBF16BF16FP32_RCR_GemmExhaustive_16x512x16_SG2x8_ST2,RCR,GemmExhaustive,16,512,16,2,8,2,28.8,OK,6,batch_0141_gpu6
BmgGemmBF16BF16FP32_RCR_GemmExhaustive_32x128x16_SG4x8_ST1,RCR,GemmExhaustive,32,128,16,4,8,1,28.8,OK,5,batch_0220_gpu5
BmgGemmBF16BF16FP32_RCR_GemmExhaustive_128x32x16_SG8x2_ST2,RCR,GemmExhaustive,128,32,16,8,2,2,28.3,OK,5,batch_0096_gpu5
BmgGemmBF16BF16FP32_RCR_GemmExhaustive_64x512x16_SG8x2_ST1,RCR,GemmExhaustive,64,512,16,8,2,1,28.0,OK,6,batch_0379_gpu6
BmgGemmBF16BF16FP32_RCR_GemmExhaustive_128x32x16_SG8x2_ST1,RCR,GemmExhaustive,128,32,16,8,2,1,27.9,OK,5,batch_0096_gpu5
BmgGemmBF16BF16FP32_RCR_GemmExhaustive_64x512x16_SG8x2_ST2,RCR,GemmExhaustive,64,512,16,8,2,2,27.1,OK,5,batch_0380_gpu5
BmgGemmBF16BF16FP32_RCR_GemmExhaustive_16x512x16_SG2x8_ST3,RCR,GemmExhaustive,16,512,16,2,8,3,26.9,OK,5,batch_0142_gpu5
BmgGemmBF16BF16FP32_RCR_GemmExhaustive_64x512x16_SG8x2_ST3,RCR,GemmExhaustive,64,512,16,8,2,3,26.7,OK,5,batch_0380_gpu5
BmgGemmBF16BF16FP32_RCR_GemmExhaustive_16x512x64_SG2x8_ST2,RCR,GemmExhaustive,16,512,64,2,8,2,26.4,OK,5,batch_0144_gpu5
BmgGemmBF16BF16FP32_RCR_DataParallel_128x128x32,RCR,DataParallel,128,128,32,,,2,26.3,OK,5,unknown
BmgGemmBF16BF16FP32_RCR_DataParallel_128x192x32,RCR,DataParallel,128,192,32,,,2,26.3,OK,5,unknown
BmgGemmBF16BF16FP32_RCR_GemmExhaustive_16x512x64_SG2x8_ST3,RCR,GemmExhaustive,16,512,64,2,8,3,26.2,OK,6,batch_0145_gpu6
BmgGemmBF16BF16FP32_RCR_DataParallel_128x192x64,RCR,DataParallel,128,192,64,,,2,25.7,OK,5,unknown
BmgGemmBF16BF16FP32_RCR_Gemm_8x128x32_SG1x4,RCR,Gemm,8,128,32,1,4,2,24.4,OK,5,batch_0456_gpu5
BmgGemmBF16BF16FP32_RCR_GemmExhaustive_64x256x64_SG8x2_ST1,RCR,GemmExhaustive,64,256,64,8,2,1,23.9,OK,5,batch_0366_gpu5
BmgGemmBF16BF16FP32_RCR_GemmExhaustive_512x64x64_SG8x2_ST2,RCR,GemmExhaustive,512,64,64,8,2,2,23.5,OK,5,batch_0300_gpu5
BmgGemmBF16BF16FP32_RCR_GemmExhaustive_64x512x64_SG8x4_ST1,RCR,GemmExhaustive,64,512,64,8,4,1,23.2,OK,6,batch_0399_gpu6
BmgGemmBF16BF16FP32_RCR_GemmExhaustive_64x256x64_SG8x2_ST2,RCR,GemmExhaustive,64,256,64,8,2,2,21.6,OK,5,batch_0366_gpu5
BmgGemmBF16BF16FP32_RCR_GemmExhaustive_64x256x64_SG8x2_ST3,RCR,GemmExhaustive,64,256,64,8,2,3,20.7,OK,6,batch_0367_gpu6
BmgGemmBF16BF16FP32_RCR_GemmExhaustive_64x512x64_SG8x4_ST2,RCR,GemmExhaustive,64,512,64,8,4,2,20.6,OK,6,batch_0399_gpu6
BmgGemmBF16BF16FP32_RCR_GemmExhaustive_512x64x64_SG8x2_ST3,RCR,GemmExhaustive,512,64,64,8,2,3,20.2,OK,6,batch_0301_gpu6
BmgGemmBF16BF16FP32_RCR_DataParallel_128x128x16,RCR,DataParallel,128,128,16,,,2,19.8,OK,5,unknown
BmgGemmBF16BF16FP32_RCR_GemmExhaustive_64x512x64_SG8x4_ST3,RCR,GemmExhaustive,64,512,64,8,4,3,19.6,OK,5,batch_0400_gpu5
BmgGemmBF16BF16FP32_RCR_GemmExhaustive_32x512x64_SG4x4_ST1,RCR,GemmExhaustive,32,512,64,4,4,1,17.9,OK,6,batch_0259_gpu6
BmgGemmBF16BF16FP32_RCR_16,RCR,Gemm,16,64,32,2,4,2,17.5,OK,5,unknown
BmgGemmBF16BF16FP32_RCR_GemmExhaustive_32x512x64_SG4x4_ST3,RCR,GemmExhaustive,32,512,64,4,4,3,15.8,OK,5,batch_0260_gpu5
BmgGemmBF16BF16FP32_RCR_GemmExhaustive_32x512x64_SG4x4_ST2,RCR,GemmExhaustive,32,512,64,4,4,2,15.5,OK,5,batch_0260_gpu5
BmgGemmBF16BF16FP32_RCR_DataParallel_64x256x64,RCR,DataParallel,64,256,64,,,2,13.6,OK,6,unknown
BmgGemmBF16BF16FP32_RCR_GemmExhaustive_128x256x64_SG8x2_ST1,RCR,GemmExhaustive,128,256,64,8,2,1,12.7,OK,6,batch_0091_gpu6
BmgGemmBF16BF16FP32_RCR_DataParallel_64x512x16,RCR,DataParallel,64,512,16,,,2,12.2,OK,6,unknown
BmgGemmBF16BF16FP32_RCR_9,RCR,Gemm,8,64,32,1,4,2,12.1,OK,6,unknown
BmgGemmBF16BF16FP32_RCR_GemmExhaustive_128x512x64_SG8x4_ST1,RCR,GemmExhaustive,128,512,64,8,4,1,11.6,OK,6,batch_0111_gpu6
BmgGemmBF16BF16FP32_RCR_7,RCR,Gemm,8,128,32,1,8,2,11.5,OK,6,unknown
BmgGemmBF16BF16FP32_RCR_GemmExhaustive_128x256x64_SG8x2_ST2,RCR,GemmExhaustive,128,256,64,8,2,2,10.9,OK,5,batch_0092_gpu5
BmgGemmBF16BF16FP32_RCR_GemmExhaustive_128x512x64_SG8x4_ST2,RCR,GemmExhaustive,128,512,64,8,4,2,10.4,OK,6,batch_0111_gpu6
BmgGemmBF16BF16FP32_RCR_GemmExhaustive_128x256x64_SG8x2_ST3,RCR,GemmExhaustive,128,256,64,8,2,3,10.1,OK,5,batch_0092_gpu5
BmgGemmBF16BF16FP32_RRR_Gemm_128x128x64_SG2x4,RRR,Gemm,128,128,64,2,4,2,10.1,OK,5,batch_0510_gpu5
BmgGemmBF16BF16FP32_RCR_GemmExhaustive_128x512x64_SG8x4_ST3,RCR,GemmExhaustive,128,512,64,8,4,3,10.0,OK,5,batch_0112_gpu5
BmgGemmBF16BF16FP32_RRR_TileShape_512_256_32,RRR,Gemm,,,,,,2,9.8,OK,6,batch_0545_gpu6
BmgGemmBF16BF16FP32_RRR_Gemm_512x256x32_SG8x4,RRR,Gemm,512,256,32,8,4,2,9.8,OK,6,batch_0535_gpu6
BmgGemmBF16BF16FP32_RCR_StreamK_128x512x64,RCR,StreamK,128,512,64,,,2,9.3,OK,5,unknown
BmgGemmBF16BF16FP32_RCR_DataParallel_128x512x64,RCR,DataParallel,128,512,64,,,2,9.3,OK,6,unknown
BmgGemmBF16BF16FP32_RCR_5,RCR,Gemm,8,128,32,1,4,2,9.0,OK,5,unknown
BmgGemmBF16BF16FP32_RCR_GemmExhaustive_256x128x64_SG2x8_ST1,RCR,GemmExhaustive,256,128,64,2,8,1,9.0,OK,6,batch_0163_gpu6
BmgGemmBF16BF16FP32_RCR_GemmExhaustive_64x512x64_SG4x4_ST1,RCR,GemmExhaustive,64,512,64,4,4,1,8.7,OK,5,batch_0394_gpu5
BmgGemmBF16BF16FP32_RCR_GemmExhaustive_64x512x64_SG4x4_ST3,RCR,GemmExhaustive,64,512,64,4,4,3,8.4,OK,6,batch_0395_gpu6
BmgGemmBF16BF16FP32_RCR_GemmExhaustive_256x128x64_SG2x8_ST3,RCR,GemmExhaustive,256,128,64,2,8,3,8.3,OK,5,batch_0164_gpu5
BmgGemmBF16BF16FP32_RCR_GemmExhaustive_256x128x64_SG2x8_ST2,RCR,GemmExhaustive,256,128,64,2,8,2,8.3,OK,5,batch_0164_gpu5
BmgGemmBF16BF16FP32_RCR_StreamK_64x512x64,RCR,StreamK,64,512,64,,,2,8.2,OK,6,unknown
BmgGemmBF16BF16FP32_RCR_DataParallel_64x512x64,RCR,DataParallel,64,512,64,,,2,8.2,OK,5,unknown
BmgGemmBF16BF16FP32_RCR_GemmExhaustive_64x512x64_SG4x4_ST2,RCR,GemmExhaustive,64,512,64,4,4,2,7.5,OK,6,batch_0395_gpu6
BmgGemmBF16BF16FP32_RCR_Gemm_128x128x64_SG1x8,RCR,Gemm,128,128,64,1,8,2,7.3,OK,6,batch_0423_gpu6
BmgGemmBF16BF16FP32_RCR_Gemm_512x256x32_SG8x4,RCR,Gemm,512,256,32,8,4,2,7.3,OK,5,batch_0448_gpu5
BmgGemmBF16BF16FP32_RCR_GemmExhaustive_64x512x32_SG8x2_ST1,RCR,GemmExhaustive,64,512,32,8,2,1,5.4,OK,5,batch_0388_gpu5
BmgGemmBF16BF16FP32_RCR_GemmExhaustive_64x512x32_SG8x2_ST2,RCR,GemmExhaustive,64,512,32,8,2,2,5.0,OK,6,batch_0389_gpu6
BmgGemmBF16BF16FP32_RCR_GemmExhaustive_512x128x64_SG4x8_ST1,RCR,GemmExhaustive,512,128,64,4,8,1,5.0,OK,5,batch_0276_gpu5
BmgGemmBF16BF16FP32_RCR_GemmExhaustive_64x512x32_SG8x2_ST3,RCR,GemmExhaustive,64,512,32,8,2,3,4.6,OK,6,batch_0389_gpu6
BmgGemmBF16BF16FP32_RCR_GemmExhaustive_512x64x64_SG4x4_ST1,RCR,GemmExhaustive,512,64,64,4,4,1,4.6,OK,5,batch_0298_gpu5
BmgGemmBF16BF16FP32_RCR_GemmExhaustive_512x128x64_SG4x8_ST2,RCR,GemmExhaustive,512,128,64,4,8,2,4.5,OK,5,batch_0276_gpu5
BmgGemmBF16BF16FP32_RCR_GemmExhaustive_512x128x64_SG4x8_ST3,RCR,GemmExhaustive,512,128,64,4,8,3,4.5,OK,6,batch_0277_gpu6
BmgGemmBF16BF16FP32_RCR_GemmExhaustive_512x64x64_SG4x4_ST2,RCR,GemmExhaustive,512,64,64,4,4,2,4.0,OK,6,batch_0299_gpu6
BmgGemmBF16BF16FP32_RCR_GemmExhaustive_512x64x64_SG4x4_ST3,RCR,GemmExhaustive,512,64,64,4,4,3,3.9,OK,6,batch_0299_gpu6
BmgGemmBF16BF16FP32_RCR_Gemm_512x256x64_SG8x4,RCR,Gemm,512,256,64,8,4,2,3.0,OK,6,batch_0449_gpu6
BmgGemmBF16BF16FP32_RRR_Gemm_128x128x64_SG1x8,RRR,Gemm,128,128,64,1,8,2,2.3,OK,5,batch_0510_gpu5
BmgGemmBF16BF16FP32_RCR_GemmExhaustive_64x512x64_SG8x2_ST1,RCR,GemmExhaustive,64,512,64,8,2,1,2.2,OK,6,batch_0397_gpu6
BmgGemmBF16BF16FP32_RCR_GemmExhaustive_64x512x64_SG8x2_ST3,RCR,GemmExhaustive,64,512,64,8,2,3,2.2,OK,5,batch_0398_gpu5
BmgGemmBF16BF16FP32_RCR_GemmExhaustive_64x512x64_SG8x2_ST2,RCR,GemmExhaustive,64,512,64,8,2,2,2.1,OK,5,batch_0398_gpu5
BmgGemmBF16BF16FP32_RRR_Gemm_512x256x64_SG8x4,RRR,Gemm,512,256,64,8,4,2,1.9,OK,5,batch_0536_gpu5
BmgGemmBF16BF16FP32_RCR_GemmExhaustive_128x256x16_SG8x8_ST1,RCR,GemmExhaustive,128,256,16,8,8,1,0.0,TIMEOUT,5,batch_0076_gpu5
BmgGemmBF16BF16FP32_RCR_GemmExhaustive_128x256x16_SG8x8_ST2,RCR,GemmExhaustive,128,256,16,8,8,2,0.0,TIMEOUT,6,batch_0077_gpu6
BmgGemmBF16BF16FP32_RCR_GemmExhaustive_128x256x16_SG8x8_ST3,RCR,GemmExhaustive,128,256,16,8,8,3,0.0,TIMEOUT,6,batch_0077_gpu6
BmgGemmBF16BF16FP32_RCR_GemmExhaustive_128x256x32_SG8x8_ST1,RCR,GemmExhaustive,128,256,32,8,8,1,0.0,TIMEOUT,6,batch_0085_gpu6
BmgGemmBF16BF16FP32_RCR_GemmExhaustive_128x256x32_SG8x8_ST2,RCR,GemmExhaustive,128,256,32,8,8,2,0.0,TIMEOUT,5,batch_0086_gpu5
BmgGemmBF16BF16FP32_RCR_GemmExhaustive_128x256x32_SG8x8_ST3,RCR,GemmExhaustive,128,256,32,8,8,3,0.0,TIMEOUT,5,batch_0086_gpu5
BmgGemmBF16BF16FP32_RCR_GemmExhaustive_128x256x64_SG8x8_ST1,RCR,GemmExhaustive,128,256,64,8,8,1,0.0,TIMEOUT,5,batch_0094_gpu5
BmgGemmBF16BF16FP32_RCR_GemmExhaustive_128x256x64_SG8x8_ST2,RCR,GemmExhaustive,128,256,64,8,8,2,0.0,TIMEOUT,6,batch_0095_gpu6
BmgGemmBF16BF16FP32_RCR_GemmExhaustive_128x256x64_SG8x8_ST3,RCR,GemmExhaustive,128,256,64,8,8,3,0.0,TIMEOUT,6,batch_0095_gpu6
BmgGemmBF16BF16FP32_RCR_GemmExhaustive_128x512x16_SG8x8_ST1,RCR,GemmExhaustive,128,512,16,8,8,1,0.0,TIMEOUT,6,batch_0103_gpu6
BmgGemmBF16BF16FP32_RCR_GemmExhaustive_128x512x16_SG8x8_ST2,RCR,GemmExhaustive,128,512,16,8,8,2,0.0,TIMEOUT,5,batch_0104_gpu5
BmgGemmBF16BF16FP32_RCR_GemmExhaustive_128x512x16_SG8x8_ST3,RCR,GemmExhaustive,128,512,16,8,8,3,0.0,TIMEOUT,5,batch_0104_gpu5
BmgGemmBF16BF16FP32_RCR_GemmExhaustive_128x512x32_SG8x8_ST1,RCR,GemmExhaustive,128,512,32,8,8,1,0.0,TIMEOUT,5,batch_0108_gpu5
BmgGemmBF16BF16FP32_RCR_GemmExhaustive_128x512x32_SG8x8_ST2,RCR,GemmExhaustive,128,512,32,8,8,2,0.0,TIMEOUT,5,batch_0108_gpu5
BmgGemmBF16BF16FP32_RCR_GemmExhaustive_128x512x32_SG8x8_ST3,RCR,GemmExhaustive,128,512,32,8,8,3,0.0,TIMEOUT,6,batch_0109_gpu6
BmgGemmBF16BF16FP32_RCR_GemmExhaustive_128x512x64_SG8x8_ST1,RCR,GemmExhaustive,128,512,64,8,8,1,0.0,TIMEOUT,5,batch_0112_gpu5
BmgGemmBF16BF16FP32_RCR_GemmExhaustive_256x128x16_SG8x8_ST1,RCR,GemmExhaustive,256,128,16,8,8,1,0.0,TIMEOUT,6,batch_0153_gpu6
BmgGemmBF16BF16FP32_RCR_GemmExhaustive_256x128x16_SG8x8_ST2,RCR,GemmExhaustive,256,128,16,8,8,2,0.0,TIMEOUT,6,batch_0153_gpu6
BmgGemmBF16BF16FP32_RCR_GemmExhaustive_256x128x16_SG8x8_ST3,RCR,GemmExhaustive,256,128,16,8,8,3,0.0,TIMEOUT,5,batch_0154_gpu5
BmgGemmBF16BF16FP32_RCR_GemmExhaustive_256x128x32_SG8x8_ST1,RCR,GemmExhaustive,256,128,32,8,8,1,0.0,TIMEOUT,5,batch_0162_gpu5
BmgGemmBF16BF16FP32_RCR_GemmExhaustive_256x128x32_SG8x8_ST2,RCR,GemmExhaustive,256,128,32,8,8,2,0.0,TIMEOUT,5,batch_0162_gpu5
BmgGemmBF16BF16FP32_RCR_GemmExhaustive_256x128x32_SG8x8_ST3,RCR,GemmExhaustive,256,128,32,8,8,3,0.0,TIMEOUT,6,batch_0163_gpu6
BmgGemmBF16BF16FP32_RCR_GemmExhaustive_256x128x64_SG8x8_ST1,RCR,GemmExhaustive,256,128,64,8,8,1,0.0,TIMEOUT,6,batch_0171_gpu6
BmgGemmBF16BF16FP32_RCR_GemmExhaustive_256x128x64_SG8x8_ST2,RCR,GemmExhaustive,256,128,64,8,8,2,0.0,TIMEOUT,6,batch_0171_gpu6
BmgGemmBF16BF16FP32_RCR_GemmExhaustive_256x128x64_SG8x8_ST3,RCR,GemmExhaustive,256,128,64,8,8,3,0.0,TIMEOUT,5,batch_0172_gpu5
BmgGemmBF16BF16FP32_RCR_GemmExhaustive_256x256x16_SG8x8_ST1,RCR,GemmExhaustive,256,256,16,8,8,1,0.0,TIMEOUT,5,batch_0180_gpu5
BmgGemmBF16BF16FP32_RCR_GemmExhaustive_256x256x16_SG8x8_ST2,RCR,GemmExhaustive,256,256,16,8,8,2,0.0,TIMEOUT,5,batch_0180_gpu5
BmgGemmBF16BF16FP32_RCR_GemmExhaustive_256x256x16_SG8x8_ST3,RCR,GemmExhaustive,256,256,16,8,8,3,0.0,TIMEOUT,6,batch_0181_gpu6
BmgGemmBF16BF16FP32_RCR_GemmExhaustive_256x256x32_SG8x8_ST1,RCR,GemmExhaustive,256,256,32,8,8,1,0.0,TIMEOUT,5,batch_0184_gpu5
BmgGemmBF16BF16FP32_RCR_GemmExhaustive_256x256x32_SG8x8_ST2,RCR,GemmExhaustive,256,256,32,8,8,2,0.0,TIMEOUT,6,batch_0185_gpu6
BmgGemmBF16BF16FP32_RCR_GemmExhaustive_256x256x32_SG8x8_ST3,RCR,GemmExhaustive,256,256,32,8,8,3,0.0,TIMEOUT,6,batch_0185_gpu6
BmgGemmBF16BF16FP32_RCR_GemmExhaustive_256x256x64_SG8x8_ST1,RCR,GemmExhaustive,256,256,64,8,8,1,0.0,TIMEOUT,6,batch_0189_gpu6
BmgGemmBF16BF16FP32_RCR_GemmExhaustive_256x256x64_SG8x8_ST2,RCR,GemmExhaustive,256,256,64,8,8,2,0.0,TIMEOUT,6,batch_0189_gpu6
BmgGemmBF16BF16FP32_RCR_GemmExhaustive_256x256x64_SG8x8_ST3,RCR,GemmExhaustive,256,256,64,8,8,3,0.0,TIMEOUT,5,batch_0190_gpu5
BmgGemmBF16BF16FP32_RCR_GemmExhaustive_256x512x16_SG8x8_ST1,RCR,GemmExhaustive,256,512,16,8,8,1,0.0,TIMEOUT,6,batch_0195_gpu6
BmgGemmBF16BF16FP32_RCR_GemmExhaustive_256x512x16_SG8x8_ST2,RCR,GemmExhaustive,256,512,16,8,8,2,0.0,TIMEOUT,6,batch_0195_gpu6
BmgGemmBF16BF16FP32_RCR_GemmExhaustive_256x512x16_SG8x8_ST3,RCR,GemmExhaustive,256,512,16,8,8,3,0.0,TIMEOUT,5,batch_0196_gpu5
BmgGemmBF16BF16FP32_RCR_GemmExhaustive_256x512x32_SG8x8_ST1,RCR,GemmExhaustive,256,512,32,8,8,1,0.0,TIMEOUT,5,batch_0196_gpu5
BmgGemmBF16BF16FP32_RCR_GemmExhaustive_256x512x32_SG8x8_ST2,RCR,GemmExhaustive,256,512,32,8,8,2,0.0,TIMEOUT,6,batch_0197_gpu6
BmgGemmBF16BF16FP32_RCR_GemmExhaustive_256x512x32_SG8x8_ST3,RCR,GemmExhaustive,256,512,32,8,8,3,0.0,TIMEOUT,6,batch_0197_gpu6
BmgGemmBF16BF16FP32_RCR_GemmExhaustive_256x512x64_SG8x8_ST1,RCR,GemmExhaustive,256,512,64,8,8,1,0.0,TIMEOUT,5,batch_0198_gpu5
BmgGemmBF16BF16FP32_RCR_GemmExhaustive_256x512x64_SG8x8_ST2,RCR,GemmExhaustive,256,512,64,8,8,2,0.0,TIMEOUT,5,batch_0198_gpu5
BmgGemmBF16BF16FP32_RCR_GemmExhaustive_256x512x64_SG8x8_ST3,RCR,GemmExhaustive,256,512,64,8,8,3,0.0,TIMEOUT,6,batch_0199_gpu6
BmgGemmBF16BF16FP32_RCR_GemmExhaustive_512x128x16_SG8x8_ST1,RCR,GemmExhaustive,512,128,16,8,8,1,0.0,TIMEOUT,5,batch_0270_gpu5
BmgGemmBF16BF16FP32_RCR_GemmExhaustive_512x128x16_SG8x8_ST2,RCR,GemmExhaustive,512,128,16,8,8,2,0.0,TIMEOUT,5,batch_0270_gpu5
BmgGemmBF16BF16FP32_RCR_GemmExhaustive_512x128x16_SG8x8_ST3,RCR,GemmExhaustive,512,128,16,8,8,3,0.0,TIMEOUT,6,batch_0271_gpu6
BmgGemmBF16BF16FP32_RCR_GemmExhaustive_512x128x32_SG8x8_ST1,RCR,GemmExhaustive,512,128,32,8,8,1,0.0,TIMEOUT,5,batch_0274_gpu5
BmgGemmBF16BF16FP32_RCR_GemmExhaustive_512x128x32_SG8x8_ST2,RCR,GemmExhaustive,512,128,32,8,8,2,0.0,TIMEOUT,6,batch_0275_gpu6
BmgGemmBF16BF16FP32_RCR_GemmExhaustive_512x128x32_SG8x8_ST3,RCR,GemmExhaustive,512,128,32,8,8,3,0.0,TIMEOUT,6,batch_0275_gpu6
BmgGemmBF16BF16FP32_RCR_GemmExhaustive_512x128x64_SG8x8_ST1,RCR,GemmExhaustive,512,128,64,8,8,1,0.0,TIMEOUT,6,batch_0279_gpu6
BmgGemmBF16BF16FP32_RCR_GemmExhaustive_512x128x64_SG8x8_ST2,RCR,GemmExhaustive,512,128,64,8,8,2,0.0,TIMEOUT,6,batch_0279_gpu6
BmgGemmBF16BF16FP32_RCR_GemmExhaustive_512x128x64_SG8x8_ST3,RCR,GemmExhaustive,512,128,64,8,8,3,0.0,TIMEOUT,5,batch_0280_gpu5
BmgGemmBF16BF16FP32_RCR_GemmExhaustive_512x256x16_SG8x8_ST1,RCR,GemmExhaustive,512,256,16,8,8,1,0.0,TIMEOUT,5,batch_0280_gpu5
BmgGemmBF16BF16FP32_RCR_GemmExhaustive_512x256x16_SG8x8_ST2,RCR,GemmExhaustive,512,256,16,8,8,2,0.0,TIMEOUT,6,batch_0281_gpu6
BmgGemmBF16BF16FP32_RCR_GemmExhaustive_512x256x16_SG8x8_ST3,RCR,GemmExhaustive,512,256,16,8,8,3,0.0,TIMEOUT,6,batch_0281_gpu6
BmgGemmBF16BF16FP32_RCR_GemmExhaustive_512x256x32_SG8x8_ST1,RCR,GemmExhaustive,512,256,32,8,8,1,0.0,TIMEOUT,5,batch_0282_gpu5
BmgGemmBF16BF16FP32_RCR_GemmExhaustive_512x256x32_SG8x8_ST2,RCR,GemmExhaustive,512,256,32,8,8,2,0.0,TIMEOUT,5,batch_0282_gpu5
BmgGemmBF16BF16FP32_RCR_GemmExhaustive_512x256x32_SG8x8_ST3,RCR,GemmExhaustive,512,256,32,8,8,3,0.0,TIMEOUT,6,batch_0283_gpu6
BmgGemmBF16BF16FP32_RCR_GemmExhaustive_512x256x64_SG8x8_ST1,RCR,GemmExhaustive,512,256,64,8,8,1,0.0,TIMEOUT,6,batch_0283_gpu6
BmgGemmBF16BF16FP32_RCR_GemmExhaustive_512x256x64_SG8x8_ST2,RCR,GemmExhaustive,512,256,64,8,8,2,0.0,TIMEOUT,5,batch_0284_gpu5
BmgGemmBF16BF16FP32_RCR_GemmExhaustive_512x256x64_SG8x8_ST3,RCR,GemmExhaustive,512,256,64,8,8,3,0.0,TIMEOUT,5,batch_0284_gpu5
BmgGemmBF16BF16FP32_RCR_GemmExhaustive_64x128x16_SG8x8_ST1,RCR,GemmExhaustive,64,128,16,8,8,1,0.0,TIMEOUT,5,batch_0310_gpu5
BmgGemmBF16BF16FP32_RCR_GemmExhaustive_64x128x16_SG8x8_ST2,RCR,GemmExhaustive,64,128,16,8,8,2,0.0,TIMEOUT,6,batch_0311_gpu6
BmgGemmBF16BF16FP32_RCR_GemmExhaustive_64x128x16_SG8x8_ST3,RCR,GemmExhaustive,64,128,16,8,8,3,0.0,TIMEOUT,6,batch_0311_gpu6
BmgGemmBF16BF16FP32_RCR_GemmExhaustive_64x128x32_SG8x8_ST1,RCR,GemmExhaustive,64,128,32,8,8,1,0.0,TIMEOUT,6,batch_0319_gpu6
BmgGemmBF16BF16FP32_RCR_GemmExhaustive_64x128x32_SG8x8_ST2,RCR,GemmExhaustive,64,128,32,8,8,2,0.0,TIMEOUT,5,batch_0320_gpu5
BmgGemmBF16BF16FP32_RCR_GemmExhaustive_64x128x32_SG8x8_ST3,RCR,GemmExhaustive,64,128,32,8,8,3,0.0,TIMEOUT,5,batch_0320_gpu5
BmgGemmBF16BF16FP32_RCR_GemmExhaustive_64x128x64_SG8x8_ST1,RCR,GemmExhaustive,64,128,64,8,8,1,0.0,TIMEOUT,5,batch_0328_gpu5
BmgGemmBF16BF16FP32_RCR_GemmExhaustive_64x128x64_SG8x8_ST2,RCR,GemmExhaustive,64,128,64,8,8,2,0.0,TIMEOUT,6,batch_0329_gpu6
BmgGemmBF16BF16FP32_RCR_GemmExhaustive_64x128x64_SG8x8_ST3,RCR,GemmExhaustive,64,128,64,8,8,3,0.0,TIMEOUT,6,batch_0329_gpu6
BmgGemmBF16BF16FP32_RCR_GemmExhaustive_64x256x16_SG8x8_ST1,RCR,GemmExhaustive,64,256,16,8,8,1,0.0,TIMEOUT,6,batch_0351_gpu6
BmgGemmBF16BF16FP32_RCR_GemmExhaustive_64x256x16_SG8x8_ST2,RCR,GemmExhaustive,64,256,16,8,8,2,0.0,TIMEOUT,6,batch_0351_gpu6
BmgGemmBF16BF16FP32_RCR_GemmExhaustive_64x256x16_SG8x8_ST3,RCR,GemmExhaustive,64,256,16,8,8,3,0.0,TIMEOUT,5,batch_0352_gpu5
BmgGemmBF16BF16FP32_RCR_GemmExhaustive_64x256x32_SG8x8_ST1,RCR,GemmExhaustive,64,256,32,8,8,1,0.0,TIMEOUT,5,batch_0360_gpu5
BmgGemmBF16BF16FP32_RCR_GemmExhaustive_64x256x32_SG8x8_ST2,RCR,GemmExhaustive,64,256,32,8,8,2,0.0,TIMEOUT,5,batch_0360_gpu5
BmgGemmBF16BF16FP32_RCR_GemmExhaustive_64x256x32_SG8x8_ST3,RCR,GemmExhaustive,64,256,32,8,8,3,0.0,TIMEOUT,6,batch_0361_gpu6
BmgGemmBF16BF16FP32_RCR_GemmExhaustive_64x256x64_SG8x8_ST1,RCR,GemmExhaustive,64,256,64,8,8,1,0.0,TIMEOUT,6,batch_0369_gpu6
BmgGemmBF16BF16FP32_RCR_GemmExhaustive_64x256x64_SG8x8_ST2,RCR,GemmExhaustive,64,256,64,8,8,2,0.0,TIMEOUT,6,batch_0369_gpu6
BmgGemmBF16BF16FP32_RCR_GemmExhaustive_64x256x64_SG8x8_ST3,RCR,GemmExhaustive,64,256,64,8,8,3,0.0,TIMEOUT,5,batch_0370_gpu5
BmgGemmBF16BF16FP32_RCR_GemmExhaustive_64x512x16_SG8x8_ST1,RCR,GemmExhaustive,64,512,16,8,8,1,0.0,TIMEOUT,5,batch_0382_gpu5
BmgGemmBF16BF16FP32_RCR_GemmExhaustive_64x512x16_SG8x8_ST2,RCR,GemmExhaustive,64,512,16,8,8,2,0.0,TIMEOUT,6,batch_0383_gpu6
BmgGemmBF16BF16FP32_RCR_GemmExhaustive_64x512x16_SG8x8_ST3,RCR,GemmExhaustive,64,512,16,8,8,3,0.0,TIMEOUT,6,batch_0383_gpu6
BmgGemmBF16BF16FP32_RCR_GemmExhaustive_64x512x32_SG8x8_ST1,RCR,GemmExhaustive,64,512,32,8,8,1,0.0,TIMEOUT,6,batch_0391_gpu6
BmgGemmBF16BF16FP32_RCR_GemmExhaustive_64x512x32_SG8x8_ST2,RCR,GemmExhaustive,64,512,32,8,8,2,0.0,TIMEOUT,5,batch_0392_gpu5
BmgGemmBF16BF16FP32_RCR_GemmExhaustive_64x512x32_SG8x8_ST3,RCR,GemmExhaustive,64,512,32,8,8,3,0.0,TIMEOUT,5,batch_0392_gpu5
BmgGemmBF16BF16FP32_RCR_GemmExhaustive_64x512x64_SG8x8_ST1,RCR,GemmExhaustive,64,512,64,8,8,1,0.0,TIMEOUT,5,batch_0400_gpu5
BmgGemmBF16BF16FP32_RCR_GemmExhaustive_64x512x64_SG8x8_ST2,RCR,GemmExhaustive,64,512,64,8,8,2,0.0,TIMEOUT,6,batch_0401_gpu6
BmgGemmBF16BF16FP32_RCR_GemmExhaustive_64x512x64_SG8x8_ST3,RCR,GemmExhaustive,64,512,64,8,8,3,0.0,TIMEOUT,6,batch_0401_gpu6
BmgGemmBF16BF16FP32_RCR_DataParallel_256x192x16,RCR,DataParallel,256,192,16,,,2,0.0,TIMEOUT,6,unknown
BmgGemmBF16BF16FP32_RCR_DataParallel_256x192x32,RCR,DataParallel,256,192,32,,,2,0.0,TIMEOUT,6,unknown
BmgGemmBF16BF16FP32_RCR_DataParallel_64x128x64,RCR,DataParallel,64,128,64,,,2,0.0,TIMEOUT,5,unknown
BmgGemmBF16BF16FP32_RCR_DataParallel_64x192x16,RCR,DataParallel,64,192,16,,,2,0.0,TIMEOUT,5,unknown
BmgGemmBF16BF16FP32_RCR_DataParallel_64x192x32,RCR,DataParallel,64,192,32,,,2,0.0,TIMEOUT,6,unknown
BmgGemmBF16BF16FP32_RCR_DataParallel_64x192x64,RCR,DataParallel,64,192,64,,,2,0.0,TIMEOUT,6,unknown
BmgGemmBF16BF16FP32_RCR_GemmExhaustive_128x128x16_SG8x8_ST1,RCR,GemmExhaustive,128,128,16,8,8,1,0.0,TIMEOUT,5,unknown
BmgGemmBF16BF16FP32_RCR_GemmExhaustive_128x128x16_SG8x8_ST2,RCR,GemmExhaustive,128,128,16,8,8,2,0.0,TIMEOUT,5,unknown
BmgGemmBF16BF16FP32_RCR_GemmExhaustive_128x128x16_SG8x8_ST3,RCR,GemmExhaustive,128,128,16,8,8,3,0.0,TIMEOUT,6,unknown
BmgGemmBF16BF16FP32_RCR_GemmExhaustive_128x128x32_SG8x8_ST1,RCR,GemmExhaustive,128,128,32,8,8,1,0.0,TIMEOUT,6,unknown
BmgGemmBF16BF16FP32_RCR_GemmExhaustive_128x128x32_SG8x8_ST2,RCR,GemmExhaustive,128,128,32,8,8,2,0.0,TIMEOUT,6,unknown
BmgGemmBF16BF16FP32_RCR_GemmExhaustive_128x128x32_SG8x8_ST3,RCR,GemmExhaustive,128,128,32,8,8,3,0.0,TIMEOUT,5,unknown
BmgGemmBF16BF16FP32_RCR_GemmExhaustive_128x128x64_SG8x8_ST1,RCR,GemmExhaustive,128,128,64,8,8,1,0.0,TIMEOUT,5,unknown
BmgGemmBF16BF16FP32_RCR_GemmExhaustive_128x128x64_SG8x8_ST2,RCR,GemmExhaustive,128,128,64,8,8,2,0.0,TIMEOUT,5,unknown
BmgGemmBF16BF16FP32_RCR_GemmExhaustive_128x128x64_SG8x8_ST3,RCR,GemmExhaustive,128,128,64,8,8,3,0.0,TIMEOUT,6,unknown
BmgGemmBF16BF16FP32_RCR_GemmExhaustive_128x512x64_SG8x8_ST2,RCR,GemmExhaustive,128,512,64,8,8,2,0.0,TIMEOUT,6,unknown
BmgGemmBF16BF16FP32_RCR_GemmExhaustive_128x512x64_SG8x8_ST3,RCR,GemmExhaustive,128,512,64,8,8,3,0.0,TIMEOUT,6,unknown
BmgGemmBF16BF16FP32_RCR_SplitK_128x128x16,RCR,SplitK,128,128,16,,,2,0.0,TIMEOUT,5,unknown
BmgGemmBF16BF16FP32_RCR_SplitK_128x128x32,RCR,SplitK,128,128,32,,,2,0.0,TIMEOUT,5,unknown
BmgGemmBF16BF16FP32_RCR_SplitK_128x192x32,RCR,SplitK,128,192,32,,,2,0.0,TIMEOUT,5,unknown
BmgGemmBF16BF16FP32_RCR_SplitK_128x192x64,RCR,SplitK,128,192,64,,,2,0.0,TIMEOUT,5,unknown
BmgGemmBF16BF16FP32_RCR_SplitK_128x256x16,RCR,SplitK,128,256,16,,,2,0.0,TIMEOUT,6,unknown
BmgGemmBF16BF16FP32_RCR_SplitK_128x256x32,RCR,SplitK,128,256,32,,,2,0.0,TIMEOUT,6,unknown
BmgGemmBF16BF16FP32_RCR_SplitK_128x512x32,RCR,SplitK,128,512,32,,,2,0.0,TIMEOUT,6,unknown
BmgGemmBF16BF16FP32_RCR_SplitK_128x512x64,RCR,SplitK,128,512,64,,,2,0.0,TIMEOUT,6,unknown
BmgGemmBF16BF16FP32_RCR_SplitK_128x64x64,RCR,SplitK,128,64,64,,,2,0.0,TIMEOUT,6,unknown
BmgGemmBF16BF16FP32_RCR_SplitK_256x128x16,RCR,SplitK,256,128,16,,,2,0.0,TIMEOUT,6,unknown
BmgGemmBF16BF16FP32_RCR_SplitK_256x192x16,RCR,SplitK,256,192,16,,,2,0.0,TIMEOUT,6,unknown
BmgGemmBF16BF16FP32_RCR_SplitK_256x192x32,RCR,SplitK,256,192,32,,,2,0.0,TIMEOUT,6,unknown
BmgGemmBF16BF16FP32_RCR_SplitK_256x192x64,RCR,SplitK,256,192,64,,,2,0.0,TIMEOUT,5,unknown
BmgGemmBF16BF16FP32_RCR_SplitK_256x256x16,RCR,SplitK,256,256,16,,,2,0.0,TIMEOUT,5,unknown
BmgGemmBF16BF16FP32_RCR_SplitK_256x64x64,RCR,SplitK,256,64,64,,,2,0.0,TIMEOUT,6,unknown
BmgGemmBF16BF16FP32_RCR_SplitK_512x128x16,RCR,SplitK,512,128,16,,,2,0.0,TIMEOUT,6,unknown
BmgGemmBF16BF16FP32_RCR_SplitK_512x256x32,RCR,SplitK,512,256,32,,,2,0.0,TIMEOUT,6,unknown
BmgGemmBF16BF16FP32_RCR_SplitK_512x64x16,RCR,SplitK,512,64,16,,,2,0.0,TIMEOUT,6,unknown
BmgGemmBF16BF16FP32_RCR_SplitK_64x128x64,RCR,SplitK,64,128,64,,,2,0.0,TIMEOUT,5,unknown
BmgGemmBF16BF16FP32_RCR_SplitK_64x192x16,RCR,SplitK,64,192,16,,,2,0.0,TIMEOUT,5,unknown
BmgGemmBF16BF16FP32_RCR_SplitK_64x192x32,RCR,SplitK,64,192,32,,,2,0.0,TIMEOUT,6,unknown
BmgGemmBF16BF16FP32_RCR_SplitK_64x192x64,RCR,SplitK,64,192,64,,,2,0.0,TIMEOUT,6,unknown
BmgGemmBF16BF16FP32_RCR_SplitK_64x256x64,RCR,SplitK,64,256,64,,,2,0.0,TIMEOUT,6,unknown
BmgGemmBF16BF16FP32_RCR_SplitK_64x512x16,RCR,SplitK,64,512,16,,,2,0.0,TIMEOUT,6,unknown
BmgGemmBF16BF16FP32_RCR_SplitK_64x512x32,RCR,SplitK,64,512,32,,,2,0.0,TIMEOUT,5,unknown
BmgGemmBF16BF16FP32_RCR_SplitK_64x512x64,RCR,SplitK,64,512,64,,,2,0.0,TIMEOUT,5,unknown
BmgGemmBF16BF16FP32_RCR_SplitK_64x64x16,RCR,SplitK,64,64,16,,,2,0.0,TIMEOUT,6,unknown
BmgGemmBF16BF16FP32_RCR_SplitK_64x64x32,RCR,SplitK,64,64,32,,,2,0.0,TIMEOUT,6,unknown
BmgGemmBF16BF16FP32_RCR_SplitK_64x64x64,RCR,SplitK,64,64,64,,,2,0.0,TIMEOUT,5,unknown
